pathname,url,status,in_sitemap,word_count,thin,gap_words,title,h1,final_url
/sfda-market-access-strategy-saudi-arabia,https://www.bionixus.com/sfda-market-access-strategy-saudi-arabia,200,true,1069,true,931,"SFDA Market Access Strategy KSA | BioNixus","SFDA Market Access Strategy in Saudi Arabia: 2026 Complete Guide",https://www.bionixus.com/sfda-market-access-strategy-saudi-arabia
/ar/methodology,https://www.bionixus.com/ar/methodology,200,true,1051,true,949,"منهجية أبحاث السوق الصحي | BioNixus","منهجية أبحاث السوق الصحي والدوائي",https://www.bionixus.com/ar/methodology
/global-websites/united-arab-emirates,https://www.bionixus.com/global-websites/united-arab-emirates,200,true,1051,true,949,"UAE Pharmaceutical Go-to-Market Blueprint | Dubai | BioNixus","UAE Pharmaceutical Go-to-Market Blueprint",https://www.bionixus.com/global-websites/united-arab-emirates
/ru/about,https://www.bionixus.com/ru/about,200,true,1021,true,979,"О BioNixus | Глобальные исследования рынка на основе...","Глобальные исследования рынка — построенные на pharma, наиболее регулируемой отрасли, которую мы обслуживаем, и расширенные на доверие во всех индустриях",https://www.bionixus.com/ru/about
/services/clinical-trial-support,https://www.bionixus.com/services/clinical-trial-support,200,true,1004,true,996,"Clinical Trial Support | Site Identification EMEA — BioNixus","Clinical Trial Support",https://www.bionixus.com/services/clinical-trial-support
/real-world-evidence,https://www.bionixus.com/real-world-evidence,200,true,1000,true,1000,"Real World Evidence (RWE) for Pharma | BioNixus EMEA & MENA","Real World Evidence (RWE) for Pharmaceutical and Biotech Teams",https://www.bionixus.com/real-world-evidence
/physician-survey-saudi-arabia,https://www.bionixus.com/physician-survey-saudi-arabia,200,true,964,true,1036,"Saudi Physician Surveys (2026) | BioNixus","How to Conduct Physician Surveys in Saudi Arabia: A Complete Guide for Pharma Teams",https://www.bionixus.com/physician-survey-saudi-arabia
/de/methodology,https://www.bionixus.com/de/methodology,200,true,955,true,1045,"Methodik der Gesundheitsmarktforschung | BioNixus","Methodik der Gesundheitsmarktforschung",https://www.bionixus.com/de/methodology
/services/quantitative-research,https://www.bionixus.com/services/quantitative-research,200,true,953,true,1047,"Quantitative Healthcare Research | Physician Surveys EMEA","Quantitative Healthcare Research & Physician Surveys",https://www.bionixus.com/services/quantitative-research
/services/competitive-intelligence,https://www.bionixus.com/services/competitive-intelligence,200,true,946,true,1054,"Pharmaceutical Competitive Intelligence | Pipeline Analysis","Competitive Intelligence",https://www.bionixus.com/services/competitive-intelligence
/fr/healthcare-market-research,https://www.bionixus.com/fr/healthcare-market-research,200,true,938,true,1062,"Recherche de marché santé et pharma | Europe et M | BioNixus","Recherche de marché santé et pharmaceutique pour l&#x27;Europe et le Moyen-Orient",https://www.bionixus.com/fr/healthcare-market-research
/fr/market-research-healthcare,https://www.bionixus.com/fr/market-research-healthcare,200,true,938,true,1062,"Recherche de marché santé et pharma | Europe et M | BioNixus","Recherche de marché santé et pharmaceutique pour l&#x27;Europe et le Moyen-Orient",https://www.bionixus.com/fr/healthcare-market-research
/services/qualitative-research,https://www.bionixus.com/services/qualitative-research,200,true,930,true,1070,"Qualitative Pharma Research | KOL Interviews EMEA — BioNixus","Qualitative Pharmaceutical Research & Expert Insights",https://www.bionixus.com/services/qualitative-research
/fr/methodology,https://www.bionixus.com/fr/methodology,200,true,925,true,1075,"Méthodologie des études de marché santé | BioNixus","Méthodologie des études de marché santé",https://www.bionixus.com/fr/methodology
/services/kol-stakeholder-mapping,https://www.bionixus.com/services/kol-stakeholder-mapping,200,true,895,true,1105,"KOL Mapping & Stakeholder Engagement | EMEA — BioNixus","KOL & Stakeholder Mapping",https://www.bionixus.com/services/kol-stakeholder-mapping
/mena-pharma-market-data,https://www.bionixus.com/mena-pharma-market-data,200,true,878,true,1122,"MENA Pharmaceutical Market Data 2026 | Statistics | BioNixus","MENA Pharmaceutical Market Data 2026",https://www.bionixus.com/mena-pharma-market-data
/desmoid-tumor-pharma-market-research,https://www.bionixus.com/desmoid-tumor-pharma-market-research,200,true,861,true,1139,"Desmoid Tumour Pharma Market Research Services | Ogsiveo...","Desmoid Tumour Pharma Market Research & Competitive Intelligence Services",https://www.bionixus.com/desmoid-tumor-pharma-market-research
/saudi-arabia-financial-services-market-research,https://www.bionixus.com/saudi-arabia-financial-services-market-research,200,true,855,true,1145,"Financial Services Market Research Company in Saudi Arabia.","Financial Services & Banking market research company in Saudi Arabia",https://www.bionixus.com/saudi-arabia-financial-services-market-research
/saudi-arabia-public-sector-market-research,https://www.bionixus.com/saudi-arabia-public-sector-market-research,200,true,853,true,1147,"Public Sector Market Research Company in Saudi Arabia (2026","Public Sector & Government market research company in Saudi Arabia",https://www.bionixus.com/saudi-arabia-public-sector-market-research
/saudi-arabia-real-estate-market-research,https://www.bionixus.com/saudi-arabia-real-estate-market-research,200,true,847,true,1153,"Real Estate Market Research Company in Saudi Arabia (2026)","Real Estate & Construction market research company in Saudi Arabia",https://www.bionixus.com/saudi-arabia-real-estate-market-research
/saudi-arabia-fmcg-market-research,https://www.bionixus.com/saudi-arabia-fmcg-market-research,200,true,836,true,1164,"FMCG Market Research Company in Saudi Arabia (2026) |...","FMCG & Consumer Goods market research company in Saudi Arabia",https://www.bionixus.com/saudi-arabia-fmcg-market-research
/saudi-arabia-technology-market-research,https://www.bionixus.com/saudi-arabia-technology-market-research,200,true,833,true,1167,"Technology Market Research Company in Saudi Arabia (2026)","Technology & B2B Software market research company in Saudi Arabia",https://www.bionixus.com/saudi-arabia-technology-market-research
/saudi-arabia-telecom-market-research,https://www.bionixus.com/saudi-arabia-telecom-market-research,200,true,833,true,1167,"Telecom Market Research Company in Saudi Arabia (2026) |...","Telecom & Connectivity market research company in Saudi Arabia",https://www.bionixus.com/saudi-arabia-telecom-market-research
/saudi-arabia-energy-market-research,https://www.bionixus.com/saudi-arabia-energy-market-research,200,true,825,true,1175,"Energy Market Research Company in Saudi Arabia (2026) |...","Energy & Industrials market research company in Saudi Arabia",https://www.bionixus.com/saudi-arabia-energy-market-research
/saudi-arabia-retail-market-research,https://www.bionixus.com/saudi-arabia-retail-market-research,200,true,825,true,1175,"Retail Market Research Company in Saudi Arabia (2026) |...","Retail & Shopper market research company in Saudi Arabia",https://www.bionixus.com/saudi-arabia-retail-market-research
/uae-financial-services-market-research,https://www.bionixus.com/uae-financial-services-market-research,200,true,825,true,1175,"Financial Services Market Research Company in UAE (2026) |.","Financial Services & Banking market research company in UAE",https://www.bionixus.com/uae-financial-services-market-research
/saudi-arabia-media-market-research,https://www.bionixus.com/saudi-arabia-media-market-research,200,true,823,true,1177,"Media Market Research Company in Saudi Arabia (2026) |...","Media & Entertainment market research company in Saudi Arabia",https://www.bionixus.com/saudi-arabia-media-market-research
/saudi-arabia-hospitality-market-research,https://www.bionixus.com/saudi-arabia-hospitality-market-research,200,true,821,true,1179,"Hospitality Market Research Company in Saudi Arabia (2026)","Hospitality & Tourism market research company in Saudi Arabia",https://www.bionixus.com/saudi-arabia-hospitality-market-research
/saudi-arabia-automotive-market-research,https://www.bionixus.com/saudi-arabia-automotive-market-research,200,true,820,true,1180,"Automotive Market Research Company in Saudi Arabia (2026)","Automotive market research company in Saudi Arabia",https://www.bionixus.com/saudi-arabia-automotive-market-research
/uae-real-estate-market-research,https://www.bionixus.com/uae-real-estate-market-research,200,true,818,true,1182,"Real Estate Market Research Company in UAE (2026) | Fieldwo","Real Estate & Construction market research company in UAE",https://www.bionixus.com/uae-real-estate-market-research
/uae-public-sector-market-research,https://www.bionixus.com/uae-public-sector-market-research,200,true,815,true,1185,"Public Sector Market Research Company in UAE (2026) |...","Public Sector & Government market research company in UAE",https://www.bionixus.com/uae-public-sector-market-research
/egypt-real-estate-market-research,https://www.bionixus.com/egypt-real-estate-market-research,200,true,814,true,1186,"Real Estate Market Research Company in Egypt (2026) |...","Real Estate & Construction market research company in Egypt",https://www.bionixus.com/egypt-real-estate-market-research
/saudi-arabia-education-market-research,https://www.bionixus.com/saudi-arabia-education-market-research,200,true,814,true,1186,"Education Market Research Company in Saudi Arabia (2026) |.","Education market research company in Saudi Arabia",https://www.bionixus.com/saudi-arabia-education-market-research
/egypt-public-sector-market-research,https://www.bionixus.com/egypt-public-sector-market-research,200,true,811,true,1189,"Public Sector Market Research Company in Egypt (2026) |...","Public Sector & Government market research company in Egypt",https://www.bionixus.com/egypt-public-sector-market-research
/egypt-fmcg-market-research,https://www.bionixus.com/egypt-fmcg-market-research,200,true,801,true,1199,"FMCG Market Research Company in Egypt (2026) | Fieldwork &.","FMCG & Consumer Goods market research company in Egypt",https://www.bionixus.com/egypt-fmcg-market-research
/egypt-technology-market-research,https://www.bionixus.com/egypt-technology-market-research,200,true,801,true,1199,"Technology Market Research Company in Egypt (2026) |...","Technology & B2B Software market research company in Egypt",https://www.bionixus.com/egypt-technology-market-research
/uae-fmcg-market-research,https://www.bionixus.com/uae-fmcg-market-research,200,true,799,true,1201,"FMCG Market Research Company in UAE (2026) | Fieldwork &...","FMCG & Consumer Goods market research company in UAE",https://www.bionixus.com/uae-fmcg-market-research
/uae-retail-market-research,https://www.bionixus.com/uae-retail-market-research,200,true,797,true,1203,"Retail Market Research Company in UAE (2026) | Fieldwork &.","Retail & Shopper market research company in UAE",https://www.bionixus.com/uae-retail-market-research
/uae-technology-market-research,https://www.bionixus.com/uae-technology-market-research,200,true,797,true,1203,"Technology Market Research Company in UAE (2026) | Fieldwor","Technology & B2B Software market research company in UAE",https://www.bionixus.com/uae-technology-market-research
/uae-energy-market-research,https://www.bionixus.com/uae-energy-market-research,200,true,796,true,1204,"Energy Market Research Company in UAE (2026) | Fieldwork &.","Energy & Industrials market research company in UAE",https://www.bionixus.com/uae-energy-market-research
/egypt-retail-market-research,https://www.bionixus.com/egypt-retail-market-research,200,true,795,true,1205,"Retail Market Research Company in Egypt (2026) | Fieldwork","Retail & Shopper market research company in Egypt",https://www.bionixus.com/egypt-retail-market-research
/egypt-hospitality-market-research,https://www.bionixus.com/egypt-hospitality-market-research,200,true,793,true,1207,"Hospitality Market Research Company in Egypt (2026) |...","Hospitality & Tourism market research company in Egypt",https://www.bionixus.com/egypt-hospitality-market-research
/uae-telecom-market-research,https://www.bionixus.com/uae-telecom-market-research,200,true,792,true,1208,"Telecom Market Research Company in UAE (2026) | Fieldwork &","Telecom & Connectivity market research company in UAE",https://www.bionixus.com/uae-telecom-market-research
/egypt-telecom-market-research,https://www.bionixus.com/egypt-telecom-market-research,200,true,790,true,1210,"Telecom Market Research Company in Egypt (2026) | Fieldwork","Telecom & Connectivity market research company in Egypt",https://www.bionixus.com/egypt-telecom-market-research
/uae-hospitality-market-research,https://www.bionixus.com/uae-hospitality-market-research,200,true,786,true,1214,"Hospitality Market Research Company in UAE (2026) | Fieldwo","Hospitality & Tourism market research company in UAE",https://www.bionixus.com/uae-hospitality-market-research
/egypt-energy-market-research,https://www.bionixus.com/egypt-energy-market-research,200,true,785,true,1215,"Energy Market Research Company in Egypt (2026) | Fieldwork","Energy & Industrials market research company in Egypt",https://www.bionixus.com/egypt-energy-market-research
/uae-automotive-market-research,https://www.bionixus.com/uae-automotive-market-research,200,true,785,true,1215,"Automotive Market Research Company in UAE (2026) | Fieldwor","Automotive market research company in UAE",https://www.bionixus.com/uae-automotive-market-research
/egypt-media-market-research,https://www.bionixus.com/egypt-media-market-research,200,true,783,true,1217,"Media Market Research Company in Egypt (2026) | Fieldwork &","Media & Entertainment market research company in Egypt",https://www.bionixus.com/egypt-media-market-research
/uae-education-market-research,https://www.bionixus.com/uae-education-market-research,200,true,782,true,1218,"Education Market Research Company in UAE (2026) | Fieldwork","Education market research company in UAE",https://www.bionixus.com/uae-education-market-research
/uae-media-market-research,https://www.bionixus.com/uae-media-market-research,200,true,781,true,1219,"Media Market Research Company in UAE (2026) | Fieldwork &...","Media & Entertainment market research company in UAE",https://www.bionixus.com/uae-media-market-research
/egypt-automotive-market-research,https://www.bionixus.com/egypt-automotive-market-research,200,true,779,true,1221,"Automotive Market Research Company in Egypt (2026) |...","Automotive market research company in Egypt",https://www.bionixus.com/egypt-automotive-market-research
/egypt-education-market-research,https://www.bionixus.com/egypt-education-market-research,200,true,778,true,1222,"Education Market Research Company in Egypt (2026) | Fieldwo","Education market research company in Egypt",https://www.bionixus.com/egypt-education-market-research
/market-research-healthcare,https://www.bionixus.com/market-research-healthcare,200,true,746,true,1254,"Healthcare Market Research in Europe & the Middle | BioNixus","Healthcare market research for pharmaceutical decisions in Europe and the Middle East",https://www.bionixus.com/market-research-healthcare
/pt/market-research-healthcare,https://www.bionixus.com/pt/market-research-healthcare,200,true,746,true,1254,"Healthcare Market Research in Europe & the Middle | BioNixus","Healthcare market research for pharmaceutical decisions in Europe and the Middle East",https://www.bionixus.com/pt/market-research-healthcare
/ru/market-research-healthcare,https://www.bionixus.com/ru/market-research-healthcare,200,true,746,true,1254,"Healthcare Market Research in Europe & the Middle | BioNixus","Healthcare market research for pharmaceutical decisions in Europe and the Middle East",https://www.bionixus.com/ru/market-research-healthcare
/global-websites/egypt,https://www.bionixus.com/global-websites/egypt,200,true,706,true,1294,"Egypt Pharmaceutical Market Research | MOH, HCV E | BioNixus","Pharmaceutical Market Research in Egypt",https://www.bionixus.com/global-websites/egypt
/global-websites/kuwait,https://www.bionixus.com/global-websites/kuwait,200,true,701,true,1299,"Kuwait Pharmaceutical Market Research | MOH, KFDA | BioNixus","Pharmaceutical Market Research in Kuwait",https://www.bionixus.com/global-websites/kuwait
/ar/contacts,https://www.bionixus.com/ar/contacts,200,true,698,true,1302,"تواصل مع BioNixus | أبحاث السوق الصحي والدوائي","لنتواصل",https://www.bionixus.com/ar/contacts
/global-websites/saudi-arabia,https://www.bionixus.com/global-websites/saudi-arabia,200,true,694,true,1306,"Saudi Arabia Pharma Market Entry Blueprint | SFDA | BioNixus","Saudi Arabia Pharmaceutical Market Entry Blueprint",https://www.bionixus.com/global-websites/saudi-arabia
/fr/healthcare-market-research/france,https://www.bionixus.com/fr/healthcare-market-research/france,200,true,686,true,1314,"Études de marché pharmaceutique France | HAS et A | BioNixus","Études de marché pharmaceutique en France",https://www.bionixus.com/fr/healthcare-market-research/france
/es/methodology,https://www.bionixus.com/es/methodology,200,true,668,true,1332,"Metodología de investigación de mercado sanitario | BioNixus","Metodología de investigación de mercado sanitario",https://www.bionixus.com/es/methodology
/global-websites/qatar,https://www.bionixus.com/global-websites/qatar,200,true,657,true,1343,"Qatar Pharmaceutical Market Research | Public and | BioNixus","Pharmaceutical Market Research in Qatar",https://www.bionixus.com/global-websites/qatar
/global-websites/united-states,https://www.bionixus.com/global-websites/united-states,200,true,633,true,1367,"US Pharmaceutical Market Research | Physician Sur | BioNixus","Pharmaceutical Market Research in the United States",https://www.bionixus.com/global-websites/united-states
/global-websites/bahrain,https://www.bionixus.com/global-websites/bahrain,200,true,629,true,1371,"Bahrain Pharmaceutical Market Research | Public a | BioNixus","Pharmaceutical Market Research in Bahrain",https://www.bionixus.com/global-websites/bahrain
/global-websites/oman,https://www.bionixus.com/global-websites/oman,200,true,627,true,1373,"Oman Pharmaceutical Market Research | Public and | BioNixus","Pharmaceutical Market Research in Oman",https://www.bionixus.com/global-websites/oman
/global-websites/united-kingdom,https://www.bionixus.com/global-websites/united-kingdom,200,true,617,true,1383,"UK Pharmaceutical Market Research | NHS, NICE and | BioNixus","Pharmaceutical Market Research in the United Kingdom",https://www.bionixus.com/global-websites/united-kingdom
/global-websites/france,https://www.bionixus.com/global-websites/france,200,true,579,true,1421,"France Pharmaceutical Market Research | HAS, HTA | BioNixus","Pharmaceutical Market Research in France",https://www.bionixus.com/global-websites/france
/global-websites/spain,https://www.bionixus.com/global-websites/spain,200,true,577,true,1423,"Spain Pharmaceutical Market Research | HTA and Co | BioNixus","Pharmaceutical Market Research in Spain",https://www.bionixus.com/global-websites/spain
/consumer-market-research,https://www.bionixus.com/consumer-market-research,200,true,572,true,1428,"Consumer & Business Market Research Company — FMCG, Retail","Consumer & Business Market Research — Global Coverage",https://www.bionixus.com/consumer-market-research
/global-websites/germany,https://www.bionixus.com/global-websites/germany,200,true,572,true,1428,"Germany Pharmaceutical Market Research | AMNOG, H | BioNixus","Pharmaceutical Market Research in Germany",https://www.bionixus.com/global-websites/germany
/global-websites/italy,https://www.bionixus.com/global-websites/italy,200,true,571,true,1429,"Italy Pharmaceutical Market Research | AIFA, HTA | BioNixus","Pharmaceutical Market Research in Italy",https://www.bionixus.com/global-websites/italy
/global-websites,https://www.bionixus.com/global-websites,200,true,489,true,1511,"Global Websites | BioNixus Country & Regional Navigation","Global Websites",https://www.bionixus.com/global-websites
/qualitative-market-research,https://www.bionixus.com/qualitative-market-research,200,true,408,true,1592,"Qualitative Market Research for Healthcare and Ph | BioNixus","Qualitative Market Research for Pharmaceutical Strategy",https://www.bionixus.com/qualitative-market-research
/insights,https://www.bionixus.com/insights,200,true,390,true,1610,"BioNixus Insights for Healthcare & Pharma Strategy","Why BioNixus Insights Matter in Healthcare and Pharmaceuticals",https://www.bionixus.com/insights
/es/market-research-healthcare,https://www.bionixus.com/es/market-research-healthcare,200,true,346,true,1654,"Healthcare Market Research | Investigacion healthcare y...","Healthcare market research para decisiones farmaceuticas en Europa y Oriente Medio",https://www.bionixus.com/es/market-research-healthcare
/de/market-research-healthcare,https://www.bionixus.com/de/market-research-healthcare,200,true,335,true,1665,"Healthcare Market Research | Pharma Healthcare Market...","Healthcare market research fuer pharmazeutische Entscheidungen in Europa und Nahost",https://www.bionixus.com/de/market-research-healthcare
/es/market-access,https://www.bionixus.com/es/market-access,200,true,322,true,1678,"Market Access en Salud y Farma | BioNixus","Market Access para Farma y Healthcare",https://www.bionixus.com/es/market-access
/ar/market-research-healthcare,https://www.bionixus.com/ar/market-research-healthcare,200,true,319,true,1681,"Healthcare Market Research | ابحاث healthcare ودوائية لاوروبا...","Healthcare market research لقرارات دوائية في اوروبا والشرق الاوسط",https://www.bionixus.com/ar/market-research-healthcare
/ar/arabic-blog-alsawdyh,https://www.bionixus.com/ar/arabic-blog-alsawdyh,200,true,298,true,1702,"المدونة العربية: أبحاث السوق الدوائي في السعودية | BioNixus","دليل أبحاث السوق الدوائي في السعودية",https://www.bionixus.com/ar/arabic-blog-alsawdyh
/zh/about,https://www.bionixus.com/zh/about,200,true,295,true,1705,"About | BioNixus","全球市场研究——建立在医药这一我们服务的最受监管行业之上，并扩展至跨行业信赖",https://www.bionixus.com/zh/about
/de/success-in-startups,https://www.bionixus.com/de/success-in-startups,200,true,245,true,1755,"Erfolg in Healthcare Startups | BioNixus Blog (DE)","Erfolgsfaktoren für Healthcare Startups",https://www.bionixus.com/de/success-in-startups
/clinical-diagnostics-proposal-request,https://www.bionixus.com/clinical-diagnostics-proposal-request,200,true,146,true,1854,"Register for Clinical Diagnostics Proposal | BioNixus","Receive the full market assessment proposal",https://www.bionixus.com/clinical-diagnostics-proposal-request
/zh/market-research-healthcare,https://www.bionixus.com/zh/market-research-healthcare,200,true,139,true,1861,"Healthcare Market Research | 欧洲与中东医药Healthcare市场研究","服务欧洲与中东制药决策的healthcare market research",https://www.bionixus.com/zh/market-research-healthcare
/zh/methodology,https://www.bionixus.com/zh/methodology,200,true,137,true,1863,"Healthcare Research Methodology & Process | BioNixus","医疗健康市场研究方法",https://www.bionixus.com/zh/methodology
/news,https://www.bionixus.com/news,200,true,130,true,1870,"News & Press Releases | BioNixus Healthcare Market Research","News",https://www.bionixus.com/news
/media,https://www.bionixus.com/media,200,true,121,true,1879,"Media Kit & Press Contact | BioNixus","Media kit",https://www.bionixus.com/media
/ar/strategic-portfolio,https://www.bionixus.com/ar/strategic-portfolio,200,true,85,true,1915,"محفظة BioNixus الاستراتيجية | أبحاث السوق والاستشارات","أبحاث السوق و الاستشارات الاستراتيجية",https://www.bionixus.com/ar/strategic-portfolio
/bionixus-ai-chatbots-increase-sales-and-lead-generation,https://www.bionixus.com/bionixus-ai-chatbots-increase-sales-and-lead-generation,200,true,19,true,1981,"Bionixus Ai Chatbots Increase Sales And Lead Generation |...","",https://www.bionixus.com/bionixus-ai-chatbots-increase-sales-and-lead-generation
/ar/insights/top-market-research-companies-egypt-2026,https://www.bionixus.com/ar/insights/top-market-research-companies-egypt-2026,200,true,18,true,1982,"Top Market Research Companies Egypt 2026 | BioNixus","",https://www.bionixus.com/ar/insights/top-market-research-companies-egypt-2026
/bionixus-industries/insights/online-market-research-social-listening-brand-growth-2026,https://www.bionixus.com/bionixus-industries/insights/online-market-research-social-listening-brand-growth-2026,200,true,17,true,1983,"Bionixus Industries Insights Online Market Research Social.","",https://www.bionixus.com/bionixus-industries/insights/online-market-research-social-listening-brand-growth-2026
/pharmaceutical-companies-saudi-arabia,https://www.bionixus.com/pharmaceutical-companies-saudi-arabia,200,true,17,true,1983,"Pharmaceutical Companies in Saudi Arabia | BioNixus","",https://www.bionixus.com/pharmaceutical-companies-saudi-arabia
/pharmaceutical-companies-bahrain,https://www.bionixus.com/pharmaceutical-companies-bahrain,200,true,16,true,1984,"Pharmaceutical Companies in Bahrain | BioNixus","",https://www.bionixus.com/pharmaceutical-companies-bahrain
/pharmaceutical-companies-egypt,https://www.bionixus.com/pharmaceutical-companies-egypt,200,true,16,true,1984,"Pharmaceutical Companies in Egypt | BioNixus","",https://www.bionixus.com/pharmaceutical-companies-egypt
