pathname,url,status,in_sitemap,word_count,thin,gap_words,title,h1,final_url
/pharmaceutical-companies-egypt,https://www.bionixus.com/pharmaceutical-companies-egypt,200,true,2215,false,-215,"Pharmaceutical Companies in Egypt | Industry Guid | BioNixus","Pharmaceutical Companies in Egypt",https://www.bionixus.com/pharmaceutical-companies-egypt
/healthcare-market-research/united-arab-emirates,https://www.bionixus.com/healthcare-market-research/united-arab-emirates,200,true,2187,false,-187,"Pharmaceutical Market Research in United Arab Emirates |...","Pharmaceutical Market Research in United Arab Emirates",https://www.bionixus.com/healthcare-market-research/united-arab-emirates
/healthcare-market-research/egypt,https://www.bionixus.com/healthcare-market-research/egypt,200,true,2171,false,-171,"Healthcare Market Research in Egypt | Pharma & Consumer |...","Healthcare Market Research in Egypt",https://www.bionixus.com/healthcare-market-research/egypt
/pt/insights/top-empresas-pesquisa-mercado-saude-brasil-2026,https://www.bionixus.com/pt/insights/top-empresas-pesquisa-mercado-saude-brasil-2026,200,true,2163,false,-163,"Top Empresas de Pesquisa de Mercado em Saúde no B | BioNixus","Top Empresas de Pesquisa de Mercado em Saúde no Brasil (Guia 2026)",https://www.bionixus.com/pt/insights/top-empresas-pesquisa-mercado-saude-brasil-2026
/pharmaceutical-companies-oman,https://www.bionixus.com/pharmaceutical-companies-oman,200,true,2148,false,-148,"Pharmaceutical Companies in Oman | Industry Guide | BioNixus","Pharmaceutical Companies in Oman",https://www.bionixus.com/pharmaceutical-companies-oman
/healthcare-market-research/south-africa,https://www.bionixus.com/healthcare-market-research/south-africa,200,true,2140,false,-140,"Pharmaceutical Market Research in South Africa | BioNixus","Pharmaceutical Market Research in South Africa",https://www.bionixus.com/healthcare-market-research/south-africa
/healthcare-market-research/united-states,https://www.bionixus.com/healthcare-market-research/united-states,200,true,2140,false,-140,"Pharmaceutical Market Research in United States | BioNixus","Pharmaceutical Market Research in United States",https://www.bionixus.com/healthcare-market-research/united-states
/healthcare-market-research/uk,https://www.bionixus.com/healthcare-market-research/uk,200,true,2127,false,-127,"Pharmaceutical Market Research in United Kingdom | BioNixus","Pharmaceutical Market Research in the United Kingdom",https://www.bionixus.com/healthcare-market-research/uk
/es/insights/top-empresas-investigacion-mercado-salud-argentina-2026,https://www.bionixus.com/es/insights/top-empresas-investigacion-mercado-salud-argentina-2026,200,true,2126,false,-126,"Top Empresas de Investigación de Mercado en Salud | BioNixus","Top Empresas de Investigación de Mercado en Salud en Argentina (Guía 2026)",https://www.bionixus.com/es/insights/top-empresas-investigacion-mercado-salud-argentina-2026
/healthcare-market-research/abu-dhabi,https://www.bionixus.com/healthcare-market-research/abu-dhabi,200,true,2112,false,-112,"Pharmaceutical Market Research in Abu Dhabi | BioNixus","Pharmaceutical Market Research in Abu Dhabi",https://www.bionixus.com/healthcare-market-research/abu-dhabi
/iqvia-alternative,https://www.bionixus.com/iqvia-alternative,200,true,2101,false,-101,"IQVIA Competitors &amp; Alternatives for Pharma Market Research | BioNixus","IQVIA Competitors & Alternatives Built for How Pharma Really Works",https://www.bionixus.com/iqvia-alternative
/healthcare-market-research/germany,https://www.bionixus.com/healthcare-market-research/germany,200,true,2097,false,-97,"Pharmaceutical Market Research in Germany | BioNixus","Pharmaceutical Market Research in Germany",https://www.bionixus.com/healthcare-market-research/germany
/healthcare-market-research/denmark,https://www.bionixus.com/healthcare-market-research/denmark,200,true,2095,false,-95,"Pharmaceutical Market Research in Denmark | BioNixus","Pharmaceutical Market Research in Denmark",https://www.bionixus.com/healthcare-market-research/denmark
/healthcare-market-research/france,https://www.bionixus.com/healthcare-market-research/france,200,true,2095,false,-95,"Pharmaceutical Market Research in France | BioNixus","Pharmaceutical Market Research in France",https://www.bionixus.com/healthcare-market-research/france
/healthcare-market-research/italy,https://www.bionixus.com/healthcare-market-research/italy,200,true,2095,false,-95,"Pharmaceutical Market Research in Italy | BioNixus","Pharmaceutical Market Research in Italy",https://www.bionixus.com/healthcare-market-research/italy
/healthcare-market-research/spain,https://www.bionixus.com/healthcare-market-research/spain,200,true,2095,false,-95,"Pharmaceutical Market Research in Spain | BioNixus","Pharmaceutical Market Research in Spain",https://www.bionixus.com/healthcare-market-research/spain
/healthcare-market-research/sweden,https://www.bionixus.com/healthcare-market-research/sweden,200,true,2095,false,-95,"Pharmaceutical Market Research in Sweden | BioNixus","Pharmaceutical Market Research in Sweden",https://www.bionixus.com/healthcare-market-research/sweden
/healthcare-market-research/switzerland,https://www.bionixus.com/healthcare-market-research/switzerland,200,true,2095,false,-95,"Pharmaceutical Market Research in Switzerland | BioNixus","Pharmaceutical Market Research in Switzerland",https://www.bionixus.com/healthcare-market-research/switzerland
/healthcare-market-research/oman,https://www.bionixus.com/healthcare-market-research/oman,200,true,2094,false,-94,"Pharmaceutical Market Research in Oman | BioNixus","Pharmaceutical Market Research in Oman",https://www.bionixus.com/healthcare-market-research/oman
/healthcare-market-research/algeria,https://www.bionixus.com/healthcare-market-research/algeria,200,true,2093,false,-93,"Pharmaceutical Market Research in Algeria | BioNixus","Pharmaceutical Market Research in Algeria",https://www.bionixus.com/healthcare-market-research/algeria
/healthcare-market-research/iraq,https://www.bionixus.com/healthcare-market-research/iraq,200,true,2093,false,-93,"Pharmaceutical Market Research in Iraq | BioNixus","Pharmaceutical Market Research in Iraq",https://www.bionixus.com/healthcare-market-research/iraq
/healthcare-market-research/jordan,https://www.bionixus.com/healthcare-market-research/jordan,200,true,2093,false,-93,"Pharmaceutical Market Research in Jordan | BioNixus","Pharmaceutical Market Research in Jordan",https://www.bionixus.com/healthcare-market-research/jordan
/healthcare-market-research/kenya,https://www.bionixus.com/healthcare-market-research/kenya,200,true,2093,false,-93,"Pharmaceutical Market Research in Kenya | BioNixus","Pharmaceutical Market Research in Kenya",https://www.bionixus.com/healthcare-market-research/kenya
/healthcare-market-research/lebanon,https://www.bionixus.com/healthcare-market-research/lebanon,200,true,2093,false,-93,"Pharmaceutical Market Research in Lebanon | BioNixus","Pharmaceutical Market Research in Lebanon",https://www.bionixus.com/healthcare-market-research/lebanon
/healthcare-market-research/libya,https://www.bionixus.com/healthcare-market-research/libya,200,true,2093,false,-93,"Pharmaceutical Market Research in Libya | BioNixus","Pharmaceutical Market Research in Libya",https://www.bionixus.com/healthcare-market-research/libya
/healthcare-market-research/mexico,https://www.bionixus.com/healthcare-market-research/mexico,200,true,2093,false,-93,"Pharmaceutical Market Research in Mexico | BioNixus","Pharmaceutical Market Research in Mexico",https://www.bionixus.com/healthcare-market-research/mexico
/healthcare-market-research/morocco,https://www.bionixus.com/healthcare-market-research/morocco,200,true,2093,false,-93,"Pharmaceutical Market Research in Morocco | BioNixus","Pharmaceutical Market Research in Morocco",https://www.bionixus.com/healthcare-market-research/morocco
/healthcare-market-research/nigeria,https://www.bionixus.com/healthcare-market-research/nigeria,200,true,2093,false,-93,"Pharmaceutical Market Research in Nigeria | BioNixus","Pharmaceutical Market Research in Nigeria",https://www.bionixus.com/healthcare-market-research/nigeria
/healthcare-market-research/tunisia,https://www.bionixus.com/healthcare-market-research/tunisia,200,true,2093,false,-93,"Pharmaceutical Market Research in Tunisia | BioNixus","Pharmaceutical Market Research in Tunisia",https://www.bionixus.com/healthcare-market-research/tunisia
/pharmaceutical-companies-bahrain,https://www.bionixus.com/pharmaceutical-companies-bahrain,200,true,2093,false,-93,"Pharmaceutical Companies in Bahrain | Industry Gu | BioNixus","Pharmaceutical Companies in Bahrain",https://www.bionixus.com/pharmaceutical-companies-bahrain
/healthcare-market-research/bahrain,https://www.bionixus.com/healthcare-market-research/bahrain,200,true,2092,false,-92,"Pharmaceutical Market Research in Bahrain | BioNixus","Pharmaceutical Market Research in Bahrain",https://www.bionixus.com/healthcare-market-research/bahrain
/healthcare-market-research/canada,https://www.bionixus.com/healthcare-market-research/canada,200,true,2092,false,-92,"Pharmaceutical Market Research in Canada | BioNixus","Pharmaceutical Market Research in Canada",https://www.bionixus.com/healthcare-market-research/canada
/healthcare-market-research/qatar,https://www.bionixus.com/healthcare-market-research/qatar,200,true,2092,false,-92,"Pharmaceutical Market Research in Qatar | BioNixus","Pharmaceutical Market Research in Qatar",https://www.bionixus.com/healthcare-market-research/qatar
/healthcare-market-research/china,https://www.bionixus.com/healthcare-market-research/china,200,true,2091,false,-91,"Pharmaceutical Market Research in China | BioNixus","Pharmaceutical Market Research in China",https://www.bionixus.com/healthcare-market-research/china
/healthcare-market-research/japan,https://www.bionixus.com/healthcare-market-research/japan,200,true,2091,false,-91,"Pharmaceutical Market Research in Japan | BioNixus","Pharmaceutical Market Research in Japan",https://www.bionixus.com/healthcare-market-research/japan
/healthcare-market-research/singapore,https://www.bionixus.com/healthcare-market-research/singapore,200,true,2091,false,-91,"Pharmaceutical Market Research in Singapore | BioNixus","Pharmaceutical Market Research in Singapore",https://www.bionixus.com/healthcare-market-research/singapore
/healthcare-market-research/turkey,https://www.bionixus.com/healthcare-market-research/turkey,200,true,2091,false,-91,"Pharmaceutical Market Research in Turkey | BioNixus","Pharmaceutical Market Research in Turkey",https://www.bionixus.com/healthcare-market-research/turkey
/healthcare-market-research/jeddah,https://www.bionixus.com/healthcare-market-research/jeddah,200,true,2078,false,-78,"Pharmaceutical Market Research in Jeddah | BioNixus","Pharmaceutical Market Research in Jeddah",https://www.bionixus.com/healthcare-market-research/jeddah
/healthcare-market-research/dubai,https://www.bionixus.com/healthcare-market-research/dubai,200,true,2075,false,-75,"Pharmaceutical Market Research in Dubai | BioNixus","Pharmaceutical Market Research in Dubai",https://www.bionixus.com/healthcare-market-research/dubai
/healthcare-market-research/europe,https://www.bionixus.com/healthcare-market-research/europe,200,true,2068,false,-68,"Pharmaceutical Market Research in Europe | BioNixus","Pharmaceutical Market Research Across Europe",https://www.bionixus.com/healthcare-market-research/europe
/healthcare-market-research/riyadh,https://www.bionixus.com/healthcare-market-research/riyadh,200,true,2068,false,-68,"Pharmaceutical Market Research in Riyadh | BioNixus","Pharmaceutical Market Research in Riyadh",https://www.bionixus.com/healthcare-market-research/riyadh
/healthcare-market-research/kuwait,https://www.bionixus.com/healthcare-market-research/kuwait,200,true,2044,false,-44,"Pharmaceutical Market Research in Kuwait | BioNixus","Pharmaceutical Market Research in Kuwait",https://www.bionixus.com/healthcare-market-research/kuwait
/gfk-alternative-egypt,https://www.bionixus.com/gfk-alternative-egypt,200,true,2040,false,-40,"GfK Alternative in Egypt — International Market Research | BioNixus","GfK Alternative in Egypt — International Market Research by BioNixus",https://www.bionixus.com/gfk-alternative-egypt
/brand-tracking-pharma-gcc,https://www.bionixus.com/brand-tracking-pharma-gcc,404,true,0,false,,"404 - Page not found | BioNixus","404",https://www.bionixus.com/brand-tracking-pharma-gcc
/commercial-effectiveness-pharma-middle-east,https://www.bionixus.com/commercial-effectiveness-pharma-middle-east,404,true,0,false,,"404 - Page not found | BioNixus","404",https://www.bionixus.com/commercial-effectiveness-pharma-middle-east
/healthcare-fieldwork-gcc,https://www.bionixus.com/healthcare-fieldwork-gcc,404,true,0,false,,"404 - Page not found | BioNixus","404",https://www.bionixus.com/healthcare-fieldwork-gcc
/patient-adherence-research-middle-east,https://www.bionixus.com/patient-adherence-research-middle-east,404,true,0,false,,"404 - Page not found | BioNixus","404",https://www.bionixus.com/patient-adherence-research-middle-east
/patient-journey-research-gcc,https://www.bionixus.com/patient-journey-research-gcc,404,true,0,false,,"404 - Page not found | BioNixus","404",https://www.bionixus.com/patient-journey-research-gcc
/respiratory-market-access-gcc,https://www.bionixus.com/respiratory-market-access-gcc,404,true,0,false,,"404 - Page not found | BioNixus","404",https://www.bionixus.com/respiratory-market-access-gcc
/specialist-physician-panel-uae,https://www.bionixus.com/specialist-physician-panel-uae,404,true,0,false,,"404 - Page not found | BioNixus","404",https://www.bionixus.com/specialist-physician-panel-uae
/uae-pricing-reimbursement-strategy,https://www.bionixus.com/uae-pricing-reimbursement-strategy,404,true,0,false,,"404 - Page not found | BioNixus","404",https://www.bionixus.com/uae-pricing-reimbursement-strategy
/msl-insight-research-middle-east,https://www.bionixus.com/msl-insight-research-middle-east,404,false,0,false,,"404 - Page not found | BioNixus","404",https://www.bionixus.com/msl-insight-research-middle-east
/pt/methodology,https://www.bionixus.com/pt/methodology,500,true,0,false,,"","",https://www.bionixus.com/pt/methodology
/ru/methodology,https://www.bionixus.com/ru/methodology,500,true,0,false,,"","",https://www.bionixus.com/ru/methodology