pathname,url,status,in_sitemap,word_count,thin,gap_words,title,h1,final_url
/pharmaceutical-companies-iran,https://www.bionixus.com/pharmaceutical-companies-iran,200,true,16,true,1984,"Pharmaceutical Companies in Iran | BioNixus","",https://www.bionixus.com/pharmaceutical-companies-iran
/pharmaceutical-companies-iraq,https://www.bionixus.com/pharmaceutical-companies-iraq,200,true,16,true,1984,"Pharmaceutical Companies in Iraq | BioNixus","",https://www.bionixus.com/pharmaceutical-companies-iraq
/pharmaceutical-companies-kuwait,https://www.bionixus.com/pharmaceutical-companies-kuwait,200,true,16,true,1984,"Pharmaceutical Companies in Kuwait | BioNixus","",https://www.bionixus.com/pharmaceutical-companies-kuwait
/pharmaceutical-companies-oman,https://www.bionixus.com/pharmaceutical-companies-oman,200,true,16,true,1984,"Pharmaceutical Companies in Oman | BioNixus","",https://www.bionixus.com/pharmaceutical-companies-oman
/pharmaceutical-companies-qatar,https://www.bionixus.com/pharmaceutical-companies-qatar,200,true,16,true,1984,"Pharmaceutical Companies in Qatar | BioNixus","",https://www.bionixus.com/pharmaceutical-companies-qatar
/pharmaceutical-companies-uae,https://www.bionixus.com/pharmaceutical-companies-uae,200,true,16,true,1984,"Pharmaceutical Companies in Uae | BioNixus","",https://www.bionixus.com/pharmaceutical-companies-uae
/ar/market-research-egypt,https://www.bionixus.com/ar/market-research-egypt,200,true,15,true,1985,"Market Research Egypt | BioNixus","",https://www.bionixus.com/ar/market-research-egypt
/ar/market-research-ksa,https://www.bionixus.com/ar/market-research-ksa,200,true,15,true,1985,"Market Research KSA | BioNixus","",https://www.bionixus.com/ar/market-research-ksa
/ar/market-research-kuwait,https://www.bionixus.com/ar/market-research-kuwait,200,true,15,true,1985,"Market Research Kuwait | BioNixus","",https://www.bionixus.com/ar/market-research-kuwait
/ar/market-research-saudi,https://www.bionixus.com/ar/market-research-saudi,200,true,15,true,1985,"Market Research Saudi | BioNixus","",https://www.bionixus.com/ar/market-research-saudi
/ar/market-research-uae,https://www.bionixus.com/ar/market-research-uae,200,true,15,true,1985,"Market Research UAE | BioNixus","",https://www.bionixus.com/ar/market-research-uae
/market-research-by-industry,https://www.bionixus.com/market-research-by-industry,200,true,9634,false,-7634,"Market Research by Industry | Global Coverage | 16 Industri","Market research by industry — global coverage",https://www.bionixus.com/market-research-by-industry
/healthcare-fieldwork-middle-east,https://www.bionixus.com/healthcare-fieldwork-middle-east,200,true,8008,false,-6008,"Healthcare Fieldwork Middle East | BioNixus","Healthcare Fieldwork Middle East",https://www.bionixus.com/healthcare-fieldwork-middle-east
/pharma-fieldwork-uae,https://www.bionixus.com/pharma-fieldwork-uae,200,true,7956,false,-5956,"Pharma Fieldwork UAE | Physician & Payer Research | BioNixus","Pharma Fieldwork UAE",https://www.bionixus.com/pharma-fieldwork-uae
/kuwait-market-access-research,https://www.bionixus.com/kuwait-market-access-research,200,true,7274,false,-5274,"Market Access Research Kuwait | BioNixus","Market Access Research Kuwait",https://www.bionixus.com/kuwait-market-access-research
/pharma-fieldwork-saudi-arabia,https://www.bionixus.com/pharma-fieldwork-saudi-arabia,200,true,7152,false,-5152,"Pharma Fieldwork Saudi Arabia | Physician & Payer Research","Pharma Fieldwork Saudi Arabia",https://www.bionixus.com/pharma-fieldwork-saudi-arabia
/patient-support-program-research-gcc,https://www.bionixus.com/patient-support-program-research-gcc,200,true,6375,false,-4375,"Patient Support Program Research GCC | BioNixus","Patient Support Program Research GCC",https://www.bionixus.com/patient-support-program-research-gcc
/qatar-market-access-research,https://www.bionixus.com/qatar-market-access-research,200,true,6065,false,-4065,"Market Access Research Qatar | BioNixus","Market Access Research Qatar",https://www.bionixus.com/qatar-market-access-research
/pharma-fieldwork-egypt,https://www.bionixus.com/pharma-fieldwork-egypt,200,true,5612,false,-3612,"Pharma Fieldwork Egypt | Physician & Pharmacy Res | BioNixus","Pharma Fieldwork Egypt",https://www.bionixus.com/pharma-fieldwork-egypt
/budget-impact-model-saudi-arabia,https://www.bionixus.com/budget-impact-model-saudi-arabia,200,true,5239,false,-3239,"Budget Impact Model Saudi Arabia | BioNixus","Budget Impact Model Saudi Arabia",https://www.bionixus.com/budget-impact-model-saudi-arabia
/saudi-payer-market-access-research,https://www.bionixus.com/saudi-payer-market-access-research,200,true,5225,false,-3225,"Saudi Payer Market Access Research | BioNixus","Saudi Payer Market Access Research",https://www.bionixus.com/saudi-payer-market-access-research
/uae-market-access-research,https://www.bionixus.com/uae-market-access-research,200,true,5129,false,-3129,"Market Access Research UAE | BioNixus","Market Access Research UAE",https://www.bionixus.com/uae-market-access-research
/gcc-hcp-recruitment-market-research,https://www.bionixus.com/gcc-hcp-recruitment-market-research,200,true,5117,false,-3117,"Physician Recruitment in Saudi Arabia and GCC | BioNixus","Physician Recruitment in Saudi Arabia and GCC",https://www.bionixus.com/gcc-hcp-recruitment-market-research
/msl-insight-research-middle-east,https://www.bionixus.com/msl-insight-research-middle-east,200,false,4386,false,-2386,"MSL Insight Research Middle East | BioNixus","MSL Insight Research Middle East",https://www.bionixus.com/msl-insight-research-middle-east
/healthcare-market-research,https://www.bionixus.com/healthcare-market-research,200,true,4347,false,-2347,"Healthcare Market Research | Global Pharma & MedT | BioNixus","Healthcare market research — global pharmaceutical & medtech insights across the Americas, Europe, MENA, and Asia-Pacific",https://www.bionixus.com/healthcare-market-research
/medical-affairs-insight-research-gcc,https://www.bionixus.com/medical-affairs-insight-research-gcc,200,true,4108,false,-2108,"Medical Affairs Insight Research GCC | BioNixus","Medical Affairs Insight Research GCC",https://www.bionixus.com/medical-affairs-insight-research-gcc
/patient-adherence-research-middle-east,https://www.bionixus.com/patient-adherence-research-middle-east,200,true,3946,false,-1946,"Patient Adherence Research Middle East | MPR & Pe | BioNixus","Patient Adherence Research Middle East",https://www.bionixus.com/patient-adherence-research-middle-east
/real-world-evidence-gcc,https://www.bionixus.com/real-world-evidence-gcc,200,true,3876,false,-1876,"Real World Evidence GCC | BioNixus","Real World Evidence GCC",https://www.bionixus.com/real-world-evidence-gcc
/uk-healthcare-market-report,https://www.bionixus.com/uk-healthcare-market-report,200,true,3692,false,-1692,"UK Healthcare Market Research Report 2026 | NHS, NICE &...","UK Healthcare Market Report 2026: NHS Pharmaceutical Market, NICE Access, and Commercial Intelligence",https://www.bionixus.com/uk-healthcare-market-report
/patient-journey-research-gcc,https://www.bionixus.com/patient-journey-research-gcc,200,true,3517,false,-1517,"Patient Journey Research GCC | Pathway Mapping | BioNixus","Patient Journey Research GCC",https://www.bionixus.com/patient-journey-research-gcc
/respiratory-market-access-gcc,https://www.bionixus.com/respiratory-market-access-gcc,200,true,3502,false,-1502,"Respiratory Market Access GCC | BioNixus","Respiratory Market Access GCC",https://www.bionixus.com/respiratory-market-access-gcc
/germany-healthcare-market-report,https://www.bionixus.com/germany-healthcare-market-report,200,true,3460,false,-1460,"Germany Healthcare Market Research Report 2026 | AMNOG & GK","Germany Healthcare Market Report 2026: AMNOG Market Access, GKV Pharmaceutical Spend, and Commercial Intelligence",https://www.bionixus.com/germany-healthcare-market-report
/uae-pricing-reimbursement-strategy,https://www.bionixus.com/uae-pricing-reimbursement-strategy,200,true,3441,false,-1441,"UAE Pricing and Reimbursement Strategy | BioNixus","UAE Pricing and Reimbursement Strategy",https://www.bionixus.com/uae-pricing-reimbursement-strategy
/healthcare-fieldwork-gcc,https://www.bionixus.com/healthcare-fieldwork-gcc,200,true,3409,false,-1409,"Healthcare Fieldwork GCC | Specialist HCP Researc | BioNixus","Healthcare Fieldwork GCC",https://www.bionixus.com/healthcare-fieldwork-gcc
/australia-healthcare-market-report,https://www.bionixus.com/australia-healthcare-market-report,200,true,3322,false,-1322,"Australia Healthcare Market Report 2026 | TGA, PBS, PBAC &.","Australia Healthcare Market Report 2026: TGA, PBS, PBAC Market Access, and Commercial Intelligence",https://www.bionixus.com/australia-healthcare-market-report
/healthcare-market-research/therapy/diabetes,https://www.bionixus.com/healthcare-market-research/therapy/diabetes,200,true,3317,false,-1317,"Diabetes Market Research | BioNixus","Diabetes market research",https://www.bionixus.com/healthcare-market-research/therapy/diabetes
/healthcare-market-research-agency-gcc,https://www.bionixus.com/healthcare-market-research-agency-gcc,200,true,3309,false,-1309,"Pharma Market Research Company GCC | Healthcare Market...","Healthcare Market Research Companies in GCC for Pharmaceutical Launch and Access Decisions",https://www.bionixus.com/healthcare-market-research-agency-gcc
/canada-healthcare-market-report,https://www.bionixus.com/canada-healthcare-market-report,200,true,3283,false,-1283,"Canada Healthcare Market Research Report 2026 | CADTH & pCP","Canada Healthcare Market Report 2026: CADTH HTA, pCPA Negotiations, and Provincial Formulary Intelligence",https://www.bionixus.com/canada-healthcare-market-report
/bionixus-industries/insights/financial-services-market-research-egypt-2026,https://www.bionixus.com/bionixus-industries/insights/financial-services-market-research-egypt-2026,200,true,3252,false,-1252,"Financial Services Market Research Egypt 2026 | BioNixus","Financial Services Market Research in Egypt (2026 Guide)",https://www.bionixus.com/bionixus-industries/insights/financial-services-market-research-egypt-2026
/qatar-healthcare-market-report,https://www.bionixus.com/qatar-healthcare-market-report,200,true,3235,false,-1235,"Qatar Healthcare Market Report 2026 | Pharma, HTA & Market.","Qatar Healthcare Market Report 2026: Pharmaceutical Intelligence, HMC Access, and HTA Landscape",https://www.bionixus.com/qatar-healthcare-market-report
/japan-healthcare-market-report,https://www.bionixus.com/japan-healthcare-market-report,200,true,3207,false,-1207,"Japan Healthcare Market Research Report 2026 | PMDA & NHI...","Japan Healthcare Market Report 2026: PMDA Approval, NHI Pricing, and Pharmaceutical Market Intelligence",https://www.bionixus.com/japan-healthcare-market-report
/healthcare-market-research/therapy/vaccines,https://www.bionixus.com/healthcare-market-research/therapy/vaccines,200,true,3172,false,-1172,"Vaccines Market Research | BioNixus","Vaccines market research",https://www.bionixus.com/healthcare-market-research/therapy/vaccines
/gcc-pharma-market-report-2026,https://www.bionixus.com/gcc-pharma-market-report-2026,200,true,3142,false,-1142,"GCC Pharma Market Report 2026 | Biologics & Generic Drugs","GCC Pharma Market Report 2026: Biologics, Generic Drugs & Market Size",https://www.bionixus.com/gcc-pharma-market-report-2026
/south-korea-healthcare-market-report,https://www.bionixus.com/south-korea-healthcare-market-report,200,true,3126,false,-1126,"South Korea Healthcare Market Report 2026 | HIRA, NHIS...","South Korea Healthcare Market Report 2026: HIRA, NHIS Reimbursement, and Biopharmaceutical Industry Intelligence",https://www.bionixus.com/south-korea-healthcare-market-report
/japan-medical-devices-market-report,https://www.bionixus.com/japan-medical-devices-market-report,200,true,3100,false,-1100,"Japan Medical Devices Market Report 2026 | PMDA Approval, N","Japan Medical Devices Market Report 2026: PMDA Regulation, NHI Reimbursement, and Commercial Intelligence",https://www.bionixus.com/japan-medical-devices-market-report
/pharmaceutical-market-research-india,https://www.bionixus.com/pharmaceutical-market-research-india,200,true,3067,false,-1067,"Pharmaceutical Market Research Company in India | CDSCO, NP","Pharmaceutical Market Research Company in India",https://www.bionixus.com/pharmaceutical-market-research-india
/australia-medical-devices-market-report,https://www.bionixus.com/australia-medical-devices-market-report,200,true,2993,false,-993,"Australia Medical Devices Market Report 2026 | TGA ARTG,...","Australia Medical Devices Market Report 2026: TGA Registration, Prostheses List, and MSAC Reimbursement Intelligence",https://www.bionixus.com/australia-medical-devices-market-report
/singapore-healthcare-market-report,https://www.bionixus.com/singapore-healthcare-market-report,200,true,2983,false,-983,"Singapore Healthcare Market Report 2026 | HSA, ACE, 3Ms &...","Singapore Healthcare Market Report 2026: HSA Registration, ACE HTA, and Southeast Asia Pharma Hub Intelligence",https://www.bionixus.com/singapore-healthcare-market-report
/france-healthcare-market-report,https://www.bionixus.com/france-healthcare-market-report,200,true,2981,false,-981,"France Healthcare Market Report 2026 | HAS ASMR, Assurance.","France Healthcare Market Report 2026: HAS Market Access, Assurance Maladie, and Commercial Intelligence",https://www.bionixus.com/france-healthcare-market-report
/spain-healthcare-market-report,https://www.bionixus.com/spain-healthcare-market-report,200,true,2954,false,-954,"Spain Healthcare Market Report 2026 | AEMPS, SNS...","Spain Healthcare Market Report 2026: AEMPS Market Access, SNS Reimbursement, and Regional Commercial Intelligence",https://www.bionixus.com/spain-healthcare-market-report
/china-medical-devices-market-report,https://www.bionixus.com/china-medical-devices-market-report,200,true,2949,false,-949,"China Medical Devices Market Report 2026 | NMPA, VBP...","China Medical Devices Market Report 2026: NMPA Regulation, VBP Procurement, and Import Substitution Intelligence",https://www.bionixus.com/china-medical-devices-market-report
/commercial-effectiveness-pharma-middle-east,https://www.bionixus.com/commercial-effectiveness-pharma-middle-east,200,true,2916,false,-916,"Commercial Effectiveness Pharma Middle East | BioNixus","Commercial Effectiveness Pharma Middle East",https://www.bionixus.com/commercial-effectiveness-pharma-middle-east
/canada-medical-devices-market-report,https://www.bionixus.com/canada-medical-devices-market-report,200,true,2862,false,-862,"Canada Medical Devices Market Report 2026 | Health Canada...","Canada Medical Devices Market Report 2026: Health Canada Licensing, CADTH Review, and Provincial Procurement Intelligence",https://www.bionixus.com/canada-medical-devices-market-report
/italy-medical-devices-market-report,https://www.bionixus.com/italy-medical-devices-market-report,200,true,2847,false,-847,"Italy Medical Devices Market Report 2026 | EU MDR, BDNM...","Italy Medical Devices Market Report 2026: EU MDR, BDNM Registration, and Regional Hospital Procurement Intelligence",https://www.bionixus.com/italy-medical-devices-market-report
/bahrain-healthcare-market-report,https://www.bionixus.com/bahrain-healthcare-market-report,200,true,2840,false,-840,"Bahrain Healthcare Market Report 2026 | NHRA Registration &","Bahrain Healthcare Market Report 2026: NHRA Registration, Pharmaceutical Intelligence, and GCC Market Access",https://www.bionixus.com/bahrain-healthcare-market-report
/uae-medical-devices-market-report,https://www.bionixus.com/uae-medical-devices-market-report,200,true,2824,false,-824,"UAE Medical Devices Market Report 2026 | MOHAP Registration","UAE Medical Devices Market Report 2026: MOHAP Registration, Dubai Hub Strategy, and Hospital Procurement Intelligence",https://www.bionixus.com/uae-medical-devices-market-report
/usa-medical-devices-market-report,https://www.bionixus.com/usa-medical-devices-market-report,200,true,2816,false,-816,"USA Medical Devices Market Report 2026 | FDA 510(k)/PMA, CM","USA Medical Devices Market Report 2026: FDA Approval, CMS Reimbursement, and GPO/IDN Procurement Intelligence",https://www.bionixus.com/usa-medical-devices-market-report
/italy-healthcare-market-report,https://www.bionixus.com/italy-healthcare-market-report,200,true,2815,false,-815,"Italy Healthcare Market Report 2026 | AIFA, SSN Reimburseme","Italy Healthcare Market Report 2026: AIFA Market Access, SSN Reimbursement, and Commercial Intelligence",https://www.bionixus.com/italy-healthcare-market-report
/pharmaceutical-market-research-uk,https://www.bionixus.com/pharmaceutical-market-research-uk,200,true,2789,false,-789,"Pharmaceutical Market Research Company in the UK | MHRA, NI","Pharmaceutical Market Research Company in the UK",https://www.bionixus.com/pharmaceutical-market-research-uk
/brazil-medical-devices-market-report,https://www.bionixus.com/brazil-medical-devices-market-report,200,true,2779,false,-779,"Brazil Medical Devices Market Report 2026 | ANVISA...","Brazil Medical Devices Market Report 2026: ANVISA Regulation, SUS Procurement, and Commercial Strategy Intelligence",https://www.bionixus.com/brazil-medical-devices-market-report
/pharmaceutical-market-research-china,https://www.bionixus.com/pharmaceutical-market-research-china,200,true,2748,false,-748,"Pharmaceutical Market Research China | BioNixus","Pharmaceutical Market Research Company in China",https://www.bionixus.com/pharmaceutical-market-research-china
/kuwait-healthcare-market-report,https://www.bionixus.com/kuwait-healthcare-market-report,200,true,2746,false,-746,"Kuwait Healthcare Market Report 2026 | Pharma, Medical...","Kuwait Healthcare Market Report 2026: Pharmaceutical Intelligence, Medical Devices, and Market Access",https://www.bionixus.com/kuwait-healthcare-market-report
/pharmaceutical-market-research-poland,https://www.bionixus.com/pharmaceutical-market-research-poland,200,true,2732,false,-732,"Pharmaceutical Market Research Company in Poland | URPL,...","Pharmaceutical Market Research Company in Poland",https://www.bionixus.com/pharmaceutical-market-research-poland
/pharmaceutical-market-research-japan,https://www.bionixus.com/pharmaceutical-market-research-japan,200,true,2708,false,-708,"Pharmaceutical Market Research Company in Japan | PMDA, MHL","Pharmaceutical Market Research Company in Japan",https://www.bionixus.com/pharmaceutical-market-research-japan
/pharmaceutical-market-research-malaysia,https://www.bionixus.com/pharmaceutical-market-research-malaysia,200,true,2706,false,-706,"Pharmaceutical Market Research Company in Malaysia | NPRA,.","Pharmaceutical Market Research Company in Malaysia",https://www.bionixus.com/pharmaceutical-market-research-malaysia
/healthcare-market-research/saudi-arabia,https://www.bionixus.com/healthcare-market-research/saudi-arabia,200,true,2689,false,-689,"Healthcare Market Research Saudi Arabia | SFDA & | BioNixus","Healthcare Market Research in Saudi Arabia",https://www.bionixus.com/healthcare-market-research/saudi-arabia
/pharmaceutical-market-research-singapore,https://www.bionixus.com/pharmaceutical-market-research-singapore,200,true,2689,false,-689,"Pharmaceutical Market Research Company in Singapore | HSA,.","Pharmaceutical Market Research Company in Singapore",https://www.bionixus.com/pharmaceutical-market-research-singapore
/oman-medical-devices-market-report,https://www.bionixus.com/oman-medical-devices-market-report,200,true,2684,false,-684,"Oman Medical Devices Market Report 2026 | MOH Procurement &","Oman Medical Devices Market Report 2026: MOH Registration, Royal Hospital, and Vision 2040 Commercial Intelligence",https://www.bionixus.com/oman-medical-devices-market-report
/global-websites/south-africa,https://www.bionixus.com/global-websites/south-africa,200,true,2670,false,-670,"South Africa Pharmaceutical Market Research | Glo | BioNixus","South Africa Healthcare Market Strategy",https://www.bionixus.com/global-websites/south-africa
/pharmaceutical-market-research-new-zealand,https://www.bionixus.com/pharmaceutical-market-research-new-zealand,200,true,2665,false,-665,"Pharmaceutical Market Research New Zealand | BioNixus","Pharmaceutical Market Research Company in New Zealand",https://www.bionixus.com/pharmaceutical-market-research-new-zealand
/pharmaceutical-market-research-italy,https://www.bionixus.com/pharmaceutical-market-research-italy,200,true,2661,false,-661,"Pharmaceutical Market Research Italy | BioNixus","Pharmaceutical Market Research Company in Italy",https://www.bionixus.com/pharmaceutical-market-research-italy
/pharmaceutical-market-research-australia,https://www.bionixus.com/pharmaceutical-market-research-australia,200,true,2653,false,-653,"Pharmaceutical Market Research Company in Australia | TGA,.","Pharmaceutical Market Research Company in Australia",https://www.bionixus.com/pharmaceutical-market-research-australia
/global-websites/algeria,https://www.bionixus.com/global-websites/algeria,200,true,2627,false,-627,"Algeria Pharmaceutical Market Research | Global H | BioNixus","Algeria Healthcare Market Strategy",https://www.bionixus.com/global-websites/algeria
/global-websites/iraq,https://www.bionixus.com/global-websites/iraq,200,true,2627,false,-627,"Iraq Pharmaceutical Market Research | Global Heal | BioNixus","Iraq Healthcare Market Strategy",https://www.bionixus.com/global-websites/iraq
/global-websites/jordan,https://www.bionixus.com/global-websites/jordan,200,true,2627,false,-627,"Jordan Pharmaceutical Market Research | Global He | BioNixus","Jordan Healthcare Market Strategy",https://www.bionixus.com/global-websites/jordan
/global-websites/lebanon,https://www.bionixus.com/global-websites/lebanon,200,true,2627,false,-627,"Lebanon Pharmaceutical Market Research | Global H | BioNixus","Lebanon Healthcare Market Strategy",https://www.bionixus.com/global-websites/lebanon
/global-websites/libya,https://www.bionixus.com/global-websites/libya,200,true,2627,false,-627,"Libya Pharmaceutical Market Research | Global Hea | BioNixus","Libya Healthcare Market Strategy",https://www.bionixus.com/global-websites/libya
/global-websites/morocco,https://www.bionixus.com/global-websites/morocco,200,true,2627,false,-627,"Morocco Pharmaceutical Market Research | Global H | BioNixus","Morocco Healthcare Market Strategy",https://www.bionixus.com/global-websites/morocco
/global-websites/tunisia,https://www.bionixus.com/global-websites/tunisia,200,true,2627,false,-627,"Tunisia Pharmaceutical Market Research | Global H | BioNixus","Tunisia Healthcare Market Strategy",https://www.bionixus.com/global-websites/tunisia
/global-websites/kenya,https://www.bionixus.com/global-websites/kenya,200,true,2625,false,-625,"Kenya Pharmaceutical Market Research | Global Hea | BioNixus","Kenya Healthcare Market Strategy",https://www.bionixus.com/global-websites/kenya
/global-websites/nigeria,https://www.bionixus.com/global-websites/nigeria,200,true,2625,false,-625,"Nigeria Pharmaceutical Market Research | Global H | BioNixus","Nigeria Healthcare Market Strategy",https://www.bionixus.com/global-websites/nigeria
/pharmaceutical-market-research-turkey,https://www.bionixus.com/pharmaceutical-market-research-turkey,200,true,2623,false,-623,"Pharmaceutical Market Research Company in Turkey | TİTCK &.","Pharmaceutical Market Research Company in Turkey",https://www.bionixus.com/pharmaceutical-market-research-turkey
/global-websites/switzerland,https://www.bionixus.com/global-websites/switzerland,200,true,2615,false,-615,"Switzerland Pharmaceutical Market Research | Glob | BioNixus","Switzerland Healthcare Market Strategy",https://www.bionixus.com/global-websites/switzerland
/global-websites/denmark,https://www.bionixus.com/global-websites/denmark,200,true,2613,false,-613,"Denmark Pharmaceutical Market Research | Global H | BioNixus","Denmark Healthcare Market Strategy",https://www.bionixus.com/global-websites/denmark
/global-websites/sweden,https://www.bionixus.com/global-websites/sweden,200,true,2613,false,-613,"Sweden Pharmaceutical Market Research | Global He | BioNixus","Sweden Healthcare Market Strategy",https://www.bionixus.com/global-websites/sweden
/global-websites/turkey,https://www.bionixus.com/global-websites/turkey,200,true,2613,false,-613,"Turkey Pharmaceutical Market Research | Global He | BioNixus","Turkey Healthcare Market Strategy",https://www.bionixus.com/global-websites/turkey
/qatar-medical-devices-market-report,https://www.bionixus.com/qatar-medical-devices-market-report,200,true,2612,false,-612,"Qatar Medical Devices Market Report 2026 | HMC Procurement","Qatar Medical Devices Market Report 2026: HMC Procurement, Sidra Medicine, and Commercial Intelligence",https://www.bionixus.com/qatar-medical-devices-market-report
/pharmaceutical-market-research-germany,https://www.bionixus.com/pharmaceutical-market-research-germany,200,true,2607,false,-607,"Pharmaceutical Market Research Germany | BioNixus","Pharmaceutical Market Research Company in Germany",https://www.bionixus.com/pharmaceutical-market-research-germany
/global-websites/canada,https://www.bionixus.com/global-websites/canada,200,true,2605,false,-605,"Canada Pharmaceutical Market Research | Global He | BioNixus","Canada Healthcare Market Strategy",https://www.bionixus.com/global-websites/canada
/global-websites/mexico,https://www.bionixus.com/global-websites/mexico,200,true,2605,false,-605,"Mexico Pharmaceutical Market Research | Global He | BioNixus","Mexico Healthcare Market Strategy",https://www.bionixus.com/global-websites/mexico
/global-websites/china,https://www.bionixus.com/global-websites/china,200,true,2604,false,-604,"China Pharmaceutical Market Research | Global Hea | BioNixus","China Healthcare Market Strategy",https://www.bionixus.com/global-websites/china
