pathname,url,status,in_sitemap,word_count,thin,gap_words,title,h1,final_url
/global-websites/japan,https://www.bionixus.com/global-websites/japan,200,true,2602,false,-602,"Japan Pharmaceutical Market Research | Global Hea | BioNixus","Japan Healthcare Market Strategy",https://www.bionixus.com/global-websites/japan
/global-websites/singapore,https://www.bionixus.com/global-websites/singapore,200,true,2602,false,-602,"Singapore Pharmaceutical Market Research | Global | BioNixus","Singapore Healthcare Market Strategy",https://www.bionixus.com/global-websites/singapore
/pharmaceutical-market-research-argentina,https://www.bionixus.com/pharmaceutical-market-research-argentina,200,true,2595,false,-595,"Pharmaceutical Market Research Company in Argentina | ANMAT","Pharmaceutical Market Research Company in Argentina",https://www.bionixus.com/pharmaceutical-market-research-argentina
/bahrain-medical-devices-market-report,https://www.bionixus.com/bahrain-medical-devices-market-report,200,true,2594,false,-594,"Bahrain Medical Devices Market Report 2026 | NHRA...","Bahrain Medical Devices Market Report 2026: NHRA Registration, GCC Sequential Entry, and Commercial Strategy",https://www.bionixus.com/bahrain-medical-devices-market-report
/france-medical-devices-market-report,https://www.bionixus.com/france-medical-devices-market-report,200,true,2594,false,-594,"France Medical Devices Market Report 2026 | LPP...","France Medical Devices Market Report 2026: LPP Listing, ANSM Regulation, and Hospital Procurement Intelligence",https://www.bionixus.com/france-medical-devices-market-report
/pharmaceutical-market-research-france,https://www.bionixus.com/pharmaceutical-market-research-france,200,true,2590,false,-590,"Pharmaceutical Market Research France | BioNixus","Pharmaceutical Market Research Company in France",https://www.bionixus.com/pharmaceutical-market-research-france
/pharmaceutical-market-research-canada,https://www.bionixus.com/pharmaceutical-market-research-canada,200,true,2520,false,-520,"Pharmaceutical Market Research Company in Canada | CADTH,...","Pharmaceutical Market Research Company in Canada",https://www.bionixus.com/pharmaceutical-market-research-canada
/pharmaceutical-market-research-south-korea,https://www.bionixus.com/pharmaceutical-market-research-south-korea,200,true,2497,false,-497,"Pharmaceutical Market Research South Korea | BioNixus","Pharmaceutical Market Research Company in South Korea",https://www.bionixus.com/pharmaceutical-market-research-south-korea
/pharmaceutical-market-research-sweden,https://www.bionixus.com/pharmaceutical-market-research-sweden,200,true,2464,false,-464,"Pharmaceutical Market Research Company in Sweden |...","Pharmaceutical Market Research Company in Sweden",https://www.bionixus.com/pharmaceutical-market-research-sweden
/pharmaceutical-market-research-switzerland,https://www.bionixus.com/pharmaceutical-market-research-switzerland,200,true,2453,false,-453,"Pharmaceutical Market Research Switzerland | BioNixus","Pharmaceutical Market Research Company in Switzerland",https://www.bionixus.com/pharmaceutical-market-research-switzerland
/pharmaceutical-market-research-ireland,https://www.bionixus.com/pharmaceutical-market-research-ireland,200,true,2448,false,-448,"Pharmaceutical Market Research Company in Ireland | HPRA,...","Pharmaceutical Market Research Company in Ireland",https://www.bionixus.com/pharmaceutical-market-research-ireland
/oman-healthcare-market-report,https://www.bionixus.com/oman-healthcare-market-report,200,true,2445,false,-445,"Oman Healthcare Market Report 2026 | Pharma Market Size & M","Oman Healthcare Market Report 2026: Pharmaceutical Intelligence, MOH Access, and Vision 2040 Strategy",https://www.bionixus.com/oman-healthcare-market-report
/pharmaceutical-market-research-spain,https://www.bionixus.com/pharmaceutical-market-research-spain,200,true,2444,false,-444,"Pharmaceutical Market Research Spain | BioNixus","Pharmaceutical Market Research Company in Spain",https://www.bionixus.com/pharmaceutical-market-research-spain
/pharmaceutical-market-research-netherlands,https://www.bionixus.com/pharmaceutical-market-research-netherlands,200,true,2433,false,-433,"Pharmaceutical Market Research Company in the Netherlands","Pharmaceutical Market Research Company in the Netherlands",https://www.bionixus.com/pharmaceutical-market-research-netherlands
/healthcare-market-research-in-uae,https://www.bionixus.com/healthcare-market-research-in-uae,200,true,2425,false,-425,"Healthcare Market Research UAE | DHA, DOH & MOHAP | BioNixus","Healthcare Market Research in the UAE",https://www.bionixus.com/healthcare-market-research/uae
/healthcare-market-research/uae,https://www.bionixus.com/healthcare-market-research/uae,200,true,2425,false,-425,"Healthcare Market Research UAE | DHA, DOH & MOHAP | BioNixus","Healthcare Market Research in the UAE",https://www.bionixus.com/healthcare-market-research/uae
/market-research-in-uae,https://www.bionixus.com/market-research-in-uae,200,true,2425,false,-425,"Healthcare Market Research UAE | DHA, DOH & MOHAP | BioNixus","Healthcare Market Research in the UAE",https://www.bionixus.com/healthcare-market-research/uae
/market-research-in-saudi-arabia,https://www.bionixus.com/market-research-in-saudi-arabia,200,true,2372,false,-372,"Market Research Companies Saudi Arabia | BioNixus","Market Research Company in Saudi Arabia",https://www.bionixus.com/market-research-in-saudi-arabia
/healthcare-market-research/therapy/immunology,https://www.bionixus.com/healthcare-market-research/therapy/immunology,200,true,2368,false,-368,"Immunology Research Guide: Biologics & Patient Pathways |...","Immunology market research guide",https://www.bionixus.com/healthcare-market-research/therapy/immunology
/ar,https://www.bionixus.com/ar,200,true,2363,false,-363,"BioNixus | Healthcare & Pharmaceutical Market Research","خدمات BioNixus لأبحاث السوق الصحية والدوائية",https://www.bionixus.com/ar
/diabetes-market-research-uae,https://www.bionixus.com/diabetes-market-research-uae,200,true,2363,false,-363,"Diabetes Market Research UAE | BioNixus","Diabetes Market Research UAE",https://www.bionixus.com/diabetes-market-research-uae
/brand-tracking-pharma-gcc,https://www.bionixus.com/brand-tracking-pharma-gcc,200,true,2358,false,-358,"Brand Tracking Pharma GCC | BioNixus","Brand Tracking Pharma GCC",https://www.bionixus.com/brand-tracking-pharma-gcc
/pharmaceutical-market-research-denmark,https://www.bionixus.com/pharmaceutical-market-research-denmark,200,true,2353,false,-353,"Pharmaceutical Market Research Denmark | BioNixus","Pharmaceutical Market Research Company in Denmark",https://www.bionixus.com/pharmaceutical-market-research-denmark
/market-research-uae,https://www.bionixus.com/market-research-uae,200,true,2345,false,-345,"Market Research in UAE | Healthcare & Pharma Market Researc","Market Research in the UAE",https://www.bionixus.com/market-research-uae
/gcc-medical-devices-market-report,https://www.bionixus.com/gcc-medical-devices-market-report,200,true,2334,false,-334,"GCC Medical Devices Market 2026 | IVD & $5.8B Siz | BioNixus","GCC Medical Devices Market 2026: IVD, Prefilled Syringes & Hospital Procurement",https://www.bionixus.com/gcc-medical-devices-market-report
/market-research-ksa,https://www.bionixus.com/market-research-ksa,200,true,2311,false,-311,"Market Research KSA | Pharma & Healthcare Intelli | BioNixus","Market Research KSA",https://www.bionixus.com/market-research-ksa
/uae-healthcare-market-research,https://www.bionixus.com/uae-healthcare-market-research,200,true,2298,false,-298,"Healthcare Market Research Company in UAE (2026) | MOHAP...","Healthcare Providers & Hospitals market research company in UAE",https://www.bionixus.com/uae-healthcare-market-research
/healthcare-market-research-in-saudi-arabia,https://www.bionixus.com/healthcare-market-research-in-saudi-arabia,200,true,2296,false,-296,"Healthcare Market Research Saudi Arabia | SFDA & | BioNixus","Healthcare & Pharmaceutical Market Research in Saudi Arabia",https://www.bionixus.com/healthcare-market-research-in-saudi-arabia
/saudi-arabia-healthcare-market-research,https://www.bionixus.com/saudi-arabia-healthcare-market-research,200,true,2285,false,-285,"Healthcare Market Research Company in Saudi Arabia (2026)","Healthcare Providers & Hospitals market research company in Saudi Arabia",https://www.bionixus.com/saudi-arabia-healthcare-market-research
/specialist-physician-panel-uae,https://www.bionixus.com/specialist-physician-panel-uae,200,true,2251,false,-251,"Specialist Physician Panel UAE | BioNixus","Specialist Physician Panel UAE",https://www.bionixus.com/specialist-physician-panel-uae
/saudi-arabia-healthcare-market-report,https://www.bionixus.com/saudi-arabia-healthcare-market-report,200,true,2239,false,-239,"Saudi Arabia Healthcare Market Report 2026 | USD 60B Market","Saudi Arabia Healthcare Market Report 2026: Market Size, Pharmaceutical Intelligence, and Vision 2030 Strategy",https://www.bionixus.com/saudi-arabia-healthcare-market-report
/healthcare-market-research/therapy/biologics,https://www.bionixus.com/healthcare-market-research/therapy/biologics,200,true,2230,false,-230,"Biologics Research Guide: Biosimilars & Market Ac | BioNixus","Biologics market research guide",https://www.bionixus.com/healthcare-market-research/therapy/biologics
/egypt-financial-services-market-research,https://www.bionixus.com/egypt-financial-services-market-research,200,true,2224,false,-224,"Financial Services Market Research Company in Egypt (2026)","Financial Services & Banking market research company in Egypt",https://www.bionixus.com/egypt-financial-services-market-research
/gcc-generic-injectables-market,https://www.bionixus.com/gcc-generic-injectables-market,200,true,2220,false,-220,"GCC Generic Injectables Market Research & Intelli | BioNixus","GCC Generic Injectables Market: Research & Commercial Intelligence",https://www.bionixus.com/gcc-generic-injectables-market
/healthcare-market-research/united-arab-emirates,https://www.bionixus.com/healthcare-market-research/united-arab-emirates,200,true,2218,false,-218,"United Arab Emirates Healthcare Market Research | MOHAP, DH","Healthcare Market Research Across the United Arab Emirates",https://www.bionixus.com/healthcare-market-research/united-arab-emirates
/gcc-clinical-trials-market,https://www.bionixus.com/gcc-clinical-trials-market,200,true,2210,false,-210,"GCC Clinical Trials Market — Site Feasibility & Landscape...","GCC Clinical Trials Market: Feasibility & Landscape Intelligence",https://www.bionixus.com/gcc-clinical-trials-market
/gcc-personalized-medicine-market,https://www.bionixus.com/gcc-personalized-medicine-market,200,true,2207,false,-207,"GCC Personalized Medicine Market — Genomics & Precision...","GCC Personalized Medicine Market: Genomics & Precision Intelligence",https://www.bionixus.com/gcc-personalized-medicine-market
/gcc-pharmacy-market,https://www.bionixus.com/gcc-pharmacy-market,200,true,2196,false,-196,"GCC Pharmacy Market Research — Retail, E-Pharmacy & Communi","GCC Pharmacy Market: Retail, E-Pharmacy & Community Intelligence",https://www.bionixus.com/gcc-pharmacy-market
/market-research,https://www.bionixus.com/market-research,200,true,2196,false,-196,"Market Research Services Hub | Global Coverage | Healthcare","Market research for healthcare, pharma & industry",https://www.bionixus.com/market-research
/gcc-biopharmaceuticals-market,https://www.bionixus.com/gcc-biopharmaceuticals-market,200,true,2192,false,-192,"GCC Biopharmaceuticals Market — Biologics & Localization...","GCC Biopharmaceuticals Market: Biologics & Localization Intelligence",https://www.bionixus.com/gcc-biopharmaceuticals-market
/pt/insights/top-empresas-pesquisa-mercado-saude-brasil-2026,https://www.bionixus.com/pt/insights/top-empresas-pesquisa-mercado-saude-brasil-2026,200,true,2189,false,-189,"5 Melhores Empresas de Pesquisa de Mercado em Saú | BioNixus","5 Melhores Empresas de Pesquisa de Mercado em Saúde no Brasil (2026)",https://www.bionixus.com/pt/insights/top-empresas-pesquisa-mercado-saude-brasil-2026
/healthcare-market-research/egypt,https://www.bionixus.com/healthcare-market-research/egypt,200,true,2184,false,-184,"Healthcare Market Research in Egypt | Pharma & Consumer |...","Healthcare Market Research in Egypt",https://www.bionixus.com/healthcare-market-research/egypt
/saudi-arabia-medtech-market-research,https://www.bionixus.com/saudi-arabia-medtech-market-research,200,true,2177,false,-177,"MedTech Market Research Company in Saudi Arabia (2026) | SF","MedTech & Medical Devices market research company in Saudi Arabia",https://www.bionixus.com/saudi-arabia-medtech-market-research
/saudi-arabia-consumer-health-market-research,https://www.bionixus.com/saudi-arabia-consumer-health-market-research,200,true,2165,false,-165,"Consumer Health Market Research Company in Saudi Arabia...","Consumer Health & OTC market research company in Saudi Arabia",https://www.bionixus.com/saudi-arabia-consumer-health-market-research
/healthcare-market-research/therapy/rare-diseases,https://www.bionixus.com/healthcare-market-research/therapy/rare-diseases,200,true,2160,false,-160,"Rare Disease & Orphan Drug Market Research | BioNixus","Rare disease market research",https://www.bionixus.com/healthcare-market-research/therapy/rare-diseases
/pharmaceutical-market-research-usa,https://www.bionixus.com/pharmaceutical-market-research-usa,200,true,2159,false,-159,"Pharmaceutical Market Research Company in USA | FDA, CMS &.","Pharmaceutical Market Research Company in USA",https://www.bionixus.com/pharmaceutical-market-research-usa
/market-research-saudi,https://www.bionixus.com/market-research-saudi,200,true,2156,false,-156,"Market Research Saudi | Healthcare & Pharma Servi | BioNixus","Market Research Saudi",https://www.bionixus.com/market-research-saudi
/es/insights/top-empresas-investigacion-mercado-salud-argentina-2026,https://www.bionixus.com/es/insights/top-empresas-investigacion-mercado-salud-argentina-2026,200,true,2152,false,-152,"5 Mejores Empresas de Investigación de Mercado en | BioNixus","5 Mejores Empresas de Investigación de Mercado en Salud en Argentina (2026)",https://www.bionixus.com/es/insights/top-empresas-investigacion-mercado-salud-argentina-2026
/pharmaceutical-market-research-kuwait,https://www.bionixus.com/pharmaceutical-market-research-kuwait,200,true,2142,false,-142,"Pharmaceutical Market Research Company in Kuwait | MOH &...","Pharmaceutical Market Research Company in Kuwait",https://www.bionixus.com/pharmaceutical-market-research-kuwait
/healthcare-market-research/south-africa,https://www.bionixus.com/healthcare-market-research/south-africa,200,true,2140,false,-140,"Pharmaceutical Market Research in South Africa | BioNixus","Pharmaceutical Market Research in South Africa",https://www.bionixus.com/healthcare-market-research/south-africa
/healthcare-market-research/united-states,https://www.bionixus.com/healthcare-market-research/united-states,200,true,2140,false,-140,"Pharmaceutical Market Research in United States | BioNixus","Pharmaceutical Market Research in United States",https://www.bionixus.com/healthcare-market-research/united-states
/market-research-egypt,https://www.bionixus.com/market-research-egypt,200,true,2131,false,-131,"Market Research Egypt | Pharma & Healthcare Intelligence |.","Market Research Egypt",https://www.bionixus.com/market-research-egypt
/healthcare-market-research-uk,https://www.bionixus.com/healthcare-market-research-uk,200,true,2127,false,-127,"Pharmaceutical Market Research in United Kingdom | BioNixus","Pharmaceutical Market Research in the United Kingdom",https://www.bionixus.com/healthcare-market-research/uk
/healthcare-market-research/uk,https://www.bionixus.com/healthcare-market-research/uk,200,true,2127,false,-127,"Pharmaceutical Market Research in United Kingdom | BioNixus","Pharmaceutical Market Research in the United Kingdom",https://www.bionixus.com/healthcare-market-research/uk
/saudi-arabia-biotech-market-research,https://www.bionixus.com/saudi-arabia-biotech-market-research,200,true,2121,false,-121,"Biotech Market Research Company in Saudi Arabia (2026) | SF","Biotech & Life Sciences market research company in Saudi Arabia",https://www.bionixus.com/saudi-arabia-biotech-market-research
/market-research-qatar,https://www.bionixus.com/market-research-qatar,200,true,2116,false,-116,"Market Research Qatar | Healthcare & Pharma Resea | BioNixus","Market Research in Qatar",https://www.bionixus.com/market-research-qatar
/heor-consulting-saudi-arabia,https://www.bionixus.com/heor-consulting-saudi-arabia,200,true,2114,false,-114,"HEOR Consulting Saudi Arabia | BioNixus","HEOR Consulting Saudi Arabia",https://www.bionixus.com/heor-consulting-saudi-arabia
/market-research-kuwait,https://www.bionixus.com/market-research-kuwait,200,true,2113,false,-113,"Market Research Kuwait | Pharma & Healthcare Rese | BioNixus","Market Research Kuwait",https://www.bionixus.com/market-research-kuwait
/healthcare-market-research/abu-dhabi,https://www.bionixus.com/healthcare-market-research/abu-dhabi,200,true,2112,false,-112,"Pharmaceutical Market Research in Abu Dhabi | BioNixus","Pharmaceutical Market Research in Abu Dhabi",https://www.bionixus.com/healthcare-market-research/abu-dhabi
/market-research-oman,https://www.bionixus.com/market-research-oman,200,true,2112,false,-112,"Market Research Oman | Healthcare & Pharma Resear | BioNixus","Market Research in Oman",https://www.bionixus.com/market-research-oman
/market-research-bahrain,https://www.bionixus.com/market-research-bahrain,200,true,2105,false,-105,"Market Research Bahrain | Healthcare & Pharma Res | BioNixus","Market Research in Bahrain",https://www.bionixus.com/market-research-bahrain
/iqvia-alternative,https://www.bionixus.com/iqvia-alternative,200,true,2101,false,-101,"IQVIA Competitors &amp; Alternatives for Pharma Market Research | BioNixus","IQVIA Competitors & Alternatives Built for How Pharma Really Works",https://www.bionixus.com/iqvia-alternative
/healthcare-market-research/services/market-access,https://www.bionixus.com/healthcare-market-research/services/market-access,200,true,2100,false,-100,"market access Healthcare Research Service | BioNixus","Market access research service",https://www.bionixus.com/healthcare-market-research/services/market-access
/healthcare-market-research/denmark,https://www.bionixus.com/healthcare-market-research/denmark,200,true,2095,false,-95,"Pharmaceutical Market Research in Denmark | BioNixus","Pharmaceutical Market Research in Denmark",https://www.bionixus.com/healthcare-market-research/denmark
/healthcare-market-research/italy,https://www.bionixus.com/healthcare-market-research/italy,200,true,2095,false,-95,"Pharmaceutical Market Research in Italy | BioNixus","Pharmaceutical Market Research in Italy",https://www.bionixus.com/healthcare-market-research/italy
/healthcare-market-research/sweden,https://www.bionixus.com/healthcare-market-research/sweden,200,true,2095,false,-95,"Pharmaceutical Market Research in Sweden | BioNixus","Pharmaceutical Market Research in Sweden",https://www.bionixus.com/healthcare-market-research/sweden
/healthcare-market-research/switzerland,https://www.bionixus.com/healthcare-market-research/switzerland,200,true,2095,false,-95,"Pharmaceutical Market Research in Switzerland | BioNixus","Pharmaceutical Market Research in Switzerland",https://www.bionixus.com/healthcare-market-research/switzerland
/healthcare-market-research/oman,https://www.bionixus.com/healthcare-market-research/oman,200,true,2094,false,-94,"Healthcare Market Research Oman | MOH Fieldwork | BioNixus","Healthcare Market Research in Oman",https://www.bionixus.com/healthcare-market-research/oman
/bionixus-market-research-middle-east,https://www.bionixus.com/bionixus-market-research-middle-east,200,true,2093,false,-93,"Middle East Pharmaceutical Market Research | GCC | BioNixus","Middle East Pharmaceutical Market Research That Moves GCC Launch Decisions Faster",https://www.bionixus.com/bionixus-market-research-middle-east
/healthcare-market-research/algeria,https://www.bionixus.com/healthcare-market-research/algeria,200,true,2093,false,-93,"Pharmaceutical Market Research in Algeria | BioNixus","Pharmaceutical Market Research in Algeria",https://www.bionixus.com/healthcare-market-research/algeria
/healthcare-market-research/iraq,https://www.bionixus.com/healthcare-market-research/iraq,200,true,2093,false,-93,"Pharmaceutical Market Research in Iraq | BioNixus","Pharmaceutical Market Research in Iraq",https://www.bionixus.com/healthcare-market-research/iraq
/healthcare-market-research/jordan,https://www.bionixus.com/healthcare-market-research/jordan,200,true,2093,false,-93,"Pharmaceutical Market Research in Jordan | BioNixus","Pharmaceutical Market Research in Jordan",https://www.bionixus.com/healthcare-market-research/jordan
/healthcare-market-research/kenya,https://www.bionixus.com/healthcare-market-research/kenya,200,true,2093,false,-93,"Pharmaceutical Market Research in Kenya | BioNixus","Pharmaceutical Market Research in Kenya",https://www.bionixus.com/healthcare-market-research/kenya
/healthcare-market-research/lebanon,https://www.bionixus.com/healthcare-market-research/lebanon,200,true,2093,false,-93,"Pharmaceutical Market Research in Lebanon | BioNixus","Pharmaceutical Market Research in Lebanon",https://www.bionixus.com/healthcare-market-research/lebanon
/healthcare-market-research/libya,https://www.bionixus.com/healthcare-market-research/libya,200,true,2093,false,-93,"Pharmaceutical Market Research in Libya | BioNixus","Pharmaceutical Market Research in Libya",https://www.bionixus.com/healthcare-market-research/libya
/healthcare-market-research/mexico,https://www.bionixus.com/healthcare-market-research/mexico,200,true,2093,false,-93,"Pharmaceutical Market Research in Mexico | BioNixus","Pharmaceutical Market Research in Mexico",https://www.bionixus.com/healthcare-market-research/mexico
/healthcare-market-research/morocco,https://www.bionixus.com/healthcare-market-research/morocco,200,true,2093,false,-93,"Pharmaceutical Market Research in Morocco | BioNixus","Pharmaceutical Market Research in Morocco",https://www.bionixus.com/healthcare-market-research/morocco
/healthcare-market-research/nigeria,https://www.bionixus.com/healthcare-market-research/nigeria,200,true,2093,false,-93,"Pharmaceutical Market Research in Nigeria | BioNixus","Pharmaceutical Market Research in Nigeria",https://www.bionixus.com/healthcare-market-research/nigeria
/healthcare-market-research/tunisia,https://www.bionixus.com/healthcare-market-research/tunisia,200,true,2093,false,-93,"Pharmaceutical Market Research in Tunisia | BioNixus","Pharmaceutical Market Research in Tunisia",https://www.bionixus.com/healthcare-market-research/tunisia
/healthcare-market-research/canada,https://www.bionixus.com/healthcare-market-research/canada,200,true,2092,false,-92,"Pharmaceutical Market Research in Canada | BioNixus","Pharmaceutical Market Research in Canada",https://www.bionixus.com/healthcare-market-research/canada
/brazil-healthcare-market-research,https://www.bionixus.com/brazil-healthcare-market-research,200,true,2091,false,-91,"Pharmaceutical Market Research in Brazil | BioNixus","Pharmaceutical Market Research in Brazil",https://www.bionixus.com/healthcare-market-research/brazil
/healthcare-market-research/china,https://www.bionixus.com/healthcare-market-research/china,200,true,2091,false,-91,"Pharmaceutical Market Research in China | BioNixus","Pharmaceutical Market Research in China",https://www.bionixus.com/healthcare-market-research/china
/pharmaceutical-market-research-oman,https://www.bionixus.com/pharmaceutical-market-research-oman,200,true,2089,false,-89,"Pharmaceutical Market Research Company in Oman | MoH Oman","Healthcare & Pharmaceutical Market Research Company in Oman",https://www.bionixus.com/pharmaceutical-market-research-oman
/healthcare-market-research/qatar,https://www.bionixus.com/healthcare-market-research/qatar,200,true,2087,false,-87,"Healthcare Market Research Qatar | MOPH Fieldwork | BioNixus","Healthcare Market Research in Qatar",https://www.bionixus.com/healthcare-market-research/qatar
/usa-healthcare-market-report,https://www.bionixus.com/usa-healthcare-market-report,200,true,2087,false,-87,"USA Healthcare Market Research Report 2026 | FDA, CMS &...","USA Healthcare Market Report 2026: FDA Approval, Medicare IRA Negotiations, and Commercial Market Intelligence",https://www.bionixus.com/usa-healthcare-market-report
/healthcare-market-research/bahrain,https://www.bionixus.com/healthcare-market-research/bahrain,200,true,2081,false,-81,"Healthcare Market Research Bahrain | NHRA Fieldwo | BioNixus","Healthcare Market Research in Bahrain",https://www.bionixus.com/healthcare-market-research/bahrain
/healthcare-market-research-kuwait,https://www.bionixus.com/healthcare-market-research-kuwait,200,true,2080,false,-80,"Healthcare Market Research Kuwait | MOH Fieldwork | BioNixus","Pharmaceutical Market Research in Kuwait",https://www.bionixus.com/healthcare-market-research/kuwait
/healthcare-market-research/kuwait,https://www.bionixus.com/healthcare-market-research/kuwait,200,true,2080,false,-80,"Healthcare Market Research Kuwait | MOH Fieldwork | BioNixus","Pharmaceutical Market Research in Kuwait",https://www.bionixus.com/healthcare-market-research/kuwait
/healthcare-market-research/jeddah,https://www.bionixus.com/healthcare-market-research/jeddah,200,true,2078,false,-78,"Pharmaceutical Market Research in Jeddah | BioNixus","Pharmaceutical Market Research in Jeddah",https://www.bionixus.com/healthcare-market-research/jeddah
