pathname,url,status,in_sitemap,word_count,thin,gap_words,title,h1,final_url
/uae-fmcg-market-research,https://www.bionixus.com/uae-fmcg-market-research,200,true,708,true,1292,"FMCG Market Research Company in UAE | MOHAP Context | Bio...","FMCG & Consumer Goods Market Research Company in UAE",https://www.bionixus.com/uae-fmcg-market-research
/uae-technology-market-research,https://www.bionixus.com/uae-technology-market-research,200,true,706,true,1294,"Technology Market Research Company in UAE | MOHAP Context...","Technology & B2B Software Market Research Company in UAE",https://www.bionixus.com/uae-technology-market-research
/global-websites/egypt,https://www.bionixus.com/global-websites/egypt,200,true,705,true,1295,"Egypt Pharmaceutical Market Research | MOH, HCV E | BioNixus","Pharmaceutical Market Research in Egypt",https://www.bionixus.com/global-websites/egypt
/uae-retail-market-research,https://www.bionixus.com/uae-retail-market-research,200,true,705,true,1295,"Retail Market Research Company in UAE | MOHAP Context | B...","Retail & Shopper Market Research Company in UAE",https://www.bionixus.com/uae-retail-market-research
/uae-energy-market-research,https://www.bionixus.com/uae-energy-market-research,200,true,704,true,1296,"Energy Market Research Company in UAE | MOHAP Context | B...","Energy & Industrials Market Research Company in UAE",https://www.bionixus.com/uae-energy-market-research
/egypt-retail-market-research,https://www.bionixus.com/egypt-retail-market-research,200,true,703,true,1297,"Retail Market Research Company in Egypt | EDA Context | B...","Retail & Shopper Market Research Company in Egypt",https://www.bionixus.com/egypt-retail-market-research
/egypt-hospitality-market-research,https://www.bionixus.com/egypt-hospitality-market-research,200,true,701,true,1299,"Hospitality Market Research Company in Egypt | EDA Contex...","Hospitality & Tourism Market Research Company in Egypt",https://www.bionixus.com/egypt-hospitality-market-research
/global-websites/kuwait,https://www.bionixus.com/global-websites/kuwait,200,true,700,true,1300,"Kuwait Pharmaceutical Market Research | MOH, KFDA | BioNixus","Pharmaceutical Market Research in Kuwait",https://www.bionixus.com/global-websites/kuwait
/uae-telecom-market-research,https://www.bionixus.com/uae-telecom-market-research,200,true,700,true,1300,"Telecom Market Research Company in UAE | MOHAP Context |...","Telecom & Connectivity Market Research Company in UAE",https://www.bionixus.com/uae-telecom-market-research
/egypt-telecom-market-research,https://www.bionixus.com/egypt-telecom-market-research,200,true,698,true,1302,"Telecom Market Research Company in Egypt | EDA Context |...","Telecom & Connectivity Market Research Company in Egypt",https://www.bionixus.com/egypt-telecom-market-research
/market-research-egypt,https://www.bionixus.com/market-research-egypt,200,true,694,true,1306,"Market Research Egypt | Pharma & Healthcare Intelligence...","Market Research Egypt",https://www.bionixus.com/market-research-egypt
/uae-hospitality-market-research,https://www.bionixus.com/uae-hospitality-market-research,200,true,694,true,1306,"Hospitality Market Research Company in UAE | MOHAP Contex...","Hospitality & Tourism Market Research Company in UAE",https://www.bionixus.com/uae-hospitality-market-research
/egypt-energy-market-research,https://www.bionixus.com/egypt-energy-market-research,200,true,693,true,1307,"Energy Market Research Company in Egypt | EDA Context | B...","Energy & Industrials Market Research Company in Egypt",https://www.bionixus.com/egypt-energy-market-research
/egypt-media-market-research,https://www.bionixus.com/egypt-media-market-research,200,true,691,true,1309,"Media Market Research Company in Egypt | EDA Context | Bi...","Media & Entertainment Market Research Company in Egypt",https://www.bionixus.com/egypt-media-market-research
/uae-automotive-market-research,https://www.bionixus.com/uae-automotive-market-research,200,true,691,true,1309,"Automotive Market Research Company in UAE | MOHAP Context...","Automotive Market Research Company in UAE",https://www.bionixus.com/uae-automotive-market-research
/uae-media-market-research,https://www.bionixus.com/uae-media-market-research,200,true,689,true,1311,"Media Market Research Company in UAE | MOHAP Context | Bi...","Media & Entertainment Market Research Company in UAE",https://www.bionixus.com/uae-media-market-research
/uae-education-market-research,https://www.bionixus.com/uae-education-market-research,200,true,688,true,1312,"Education Market Research Company in UAE | MOHAP Context...","Education Market Research Company in UAE",https://www.bionixus.com/uae-education-market-research
/egypt-automotive-market-research,https://www.bionixus.com/egypt-automotive-market-research,200,true,685,true,1315,"Automotive Market Research Company in Egypt | EDA Context...","Automotive Market Research Company in Egypt",https://www.bionixus.com/egypt-automotive-market-research
/egypt-education-market-research,https://www.bionixus.com/egypt-education-market-research,200,true,684,true,1316,"Education Market Research Company in Egypt | EDA Context...","Education Market Research Company in Egypt",https://www.bionixus.com/egypt-education-market-research
/market-research-kuwait,https://www.bionixus.com/market-research-kuwait,200,true,683,true,1317,"Market Research Kuwait | Pharma & Healthcare Research | B...","Market Research Kuwait",https://www.bionixus.com/market-research-kuwait
/global-websites/saudi-arabia,https://www.bionixus.com/global-websites/saudi-arabia,200,true,665,true,1335,"Saudi Arabia Pharmaceutical Market Research | SFD | BioNixus","Pharmaceutical Market Research in Saudi Arabia",https://www.bionixus.com/global-websites/saudi-arabia
/es/methodology,https://www.bionixus.com/es/methodology,200,true,664,true,1336,"Metodología de investigación de mercado sanitario | BioNixus","Metodología de investigación de mercado sanitario",https://www.bionixus.com/es/methodology
/global-websites/qatar,https://www.bionixus.com/global-websites/qatar,200,true,656,true,1344,"Qatar Pharmaceutical Market Research | Public and | BioNixus","Pharmaceutical Market Research in Qatar",https://www.bionixus.com/global-websites/qatar
/ar/market-research-egypt,https://www.bionixus.com/ar/market-research-egypt,200,true,655,true,1345,"Market Research Egypt | BioNixus","أبحاث السوق في مصر",https://www.bionixus.com/ar/market-research-egypt
/ar/market-research-kuwait,https://www.bionixus.com/ar/market-research-kuwait,200,true,647,true,1353,"أبحاث السوق في الكويت | BioNixus","أبحاث السوق في الكويت",https://www.bionixus.com/ar/market-research-kuwait
/global-websites/united-states,https://www.bionixus.com/global-websites/united-states,200,true,630,true,1370,"US Pharmaceutical Market Research | Physician Sur | BioNixus","Pharmaceutical Market Research in the United States",https://www.bionixus.com/global-websites/united-states
/global-websites/bahrain,https://www.bionixus.com/global-websites/bahrain,200,true,628,true,1372,"Bahrain Pharmaceutical Market Research | Public a | BioNixus","Pharmaceutical Market Research in Bahrain",https://www.bionixus.com/global-websites/bahrain
/global-websites/oman,https://www.bionixus.com/global-websites/oman,200,true,626,true,1374,"Oman Pharmaceutical Market Research | Public and | BioNixus","Pharmaceutical Market Research in Oman",https://www.bionixus.com/global-websites/oman
/market-research-by-industry,https://www.bionixus.com/market-research-by-industry,200,true,616,true,1384,"Market Research by Industry | Saudi Arabia, UAE & Egypt |...","Market Research by Industry — Saudi Arabia, UAE & Egypt",https://www.bionixus.com/market-research-by-industry
/global-websites/united-kingdom,https://www.bionixus.com/global-websites/united-kingdom,200,true,615,true,1385,"UK Pharmaceutical Market Research | NHS, NICE and | BioNixus","Pharmaceutical Market Research in the United Kingdom",https://www.bionixus.com/global-websites/united-kingdom
/global-websites/france,https://www.bionixus.com/global-websites/france,200,true,576,true,1424,"France Pharmaceutical Market Research | HAS, HTA | BioNixus","Pharmaceutical Market Research in France",https://www.bionixus.com/global-websites/france
/global-websites/spain,https://www.bionixus.com/global-websites/spain,200,true,574,true,1426,"Spain Pharmaceutical Market Research | HTA and Co | BioNixus","Pharmaceutical Market Research in Spain",https://www.bionixus.com/global-websites/spain
/global-websites/germany,https://www.bionixus.com/global-websites/germany,200,true,569,true,1431,"Germany Pharmaceutical Market Research | AMNOG, H | BioNixus","Pharmaceutical Market Research in Germany",https://www.bionixus.com/global-websites/germany
/global-websites/italy,https://www.bionixus.com/global-websites/italy,200,true,568,true,1432,"Italy Pharmaceutical Market Research | AIFA, HTA | BioNixus","Pharmaceutical Market Research in Italy",https://www.bionixus.com/global-websites/italy
/uae-market-access-research,https://www.bionixus.com/uae-market-access-research,200,true,537,true,1463,"Market Access Research UAE | BioNixus","Market Access Research UAE",https://www.bionixus.com/uae-market-access-research
/saudi-payer-market-access-research,https://www.bionixus.com/saudi-payer-market-access-research,200,true,530,true,1470,"Saudi Payer Market Access Research | BioNixus","Saudi Payer Market Access Research",https://www.bionixus.com/saudi-payer-market-access-research
/budget-impact-model-saudi-arabia,https://www.bionixus.com/budget-impact-model-saudi-arabia,200,true,527,true,1473,"Budget Impact Model Saudi Arabia | BioNixus","Budget Impact Model Saudi Arabia",https://www.bionixus.com/budget-impact-model-saudi-arabia
/gcc-hcp-recruitment-market-research,https://www.bionixus.com/gcc-hcp-recruitment-market-research,200,true,518,true,1482,"Physician Recruitment in Saudi Arabia and GCC | BioNixus","Physician Recruitment in Saudi Arabia and GCC",https://www.bionixus.com/gcc-hcp-recruitment-market-research
/patient-support-program-research-gcc,https://www.bionixus.com/patient-support-program-research-gcc,200,true,509,true,1491,"Patient Support Program Research GCC | BioNixus","Patient Support Program Research GCC",https://www.bionixus.com/patient-support-program-research-gcc
/qatar-market-access-research,https://www.bionixus.com/qatar-market-access-research,200,true,503,true,1497,"Market Access Research Qatar | BioNixus","Market Access Research Qatar",https://www.bionixus.com/qatar-market-access-research
/heor-consulting-saudi-arabia,https://www.bionixus.com/heor-consulting-saudi-arabia,200,true,497,true,1503,"HEOR Consulting Saudi Arabia | BioNixus","HEOR Consulting Saudi Arabia",https://www.bionixus.com/heor-consulting-saudi-arabia
/global-websites,https://www.bionixus.com/global-websites,200,true,489,true,1511,"Global Websites | BioNixus Country & Regional Navigation","Global Websites",https://www.bionixus.com/global-websites
/ar/market-research-uae,https://www.bionixus.com/ar/market-research-uae,200,true,475,true,1525,"أبحاث السوق في الإمارات | BioNixus","أبحاث السوق في الإمارات",https://www.bionixus.com/ar/market-research-uae
/healthcare-fieldwork-middle-east,https://www.bionixus.com/healthcare-fieldwork-middle-east,200,true,469,true,1531,"Healthcare Fieldwork Middle East | BioNixus","Healthcare Fieldwork Middle East",https://www.bionixus.com/healthcare-fieldwork-middle-east
/pharma-fieldwork-uae,https://www.bionixus.com/pharma-fieldwork-uae,200,true,465,true,1535,"Pharma Fieldwork UAE | Physician & Payer Research | BioNixus","Pharma Fieldwork UAE",https://www.bionixus.com/pharma-fieldwork-uae
/pharma-fieldwork-saudi-arabia,https://www.bionixus.com/pharma-fieldwork-saudi-arabia,200,true,462,true,1538,"Pharma Fieldwork Saudi Arabia | Physician & Payer Researc...","Pharma Fieldwork Saudi Arabia",https://www.bionixus.com/pharma-fieldwork-saudi-arabia
/pharma-fieldwork-egypt,https://www.bionixus.com/pharma-fieldwork-egypt,200,true,456,true,1544,"Pharma Fieldwork Egypt | Physician & Pharmacy Research |...","Pharma Fieldwork Egypt",https://www.bionixus.com/pharma-fieldwork-egypt
/kuwait-market-access-research,https://www.bionixus.com/kuwait-market-access-research,200,true,455,true,1545,"Market Access Research Kuwait | BioNixus","Market Access Research Kuwait",https://www.bionixus.com/kuwait-market-access-research
/healthcare-market-research-agency-gcc,https://www.bionixus.com/healthcare-market-research-agency-gcc,200,true,424,true,1576,"Healthcare Market Research Companies GCC | Agency | BioNixus","Healthcare Market Research Companies in GCC for Pharmaceutical Launch and Access Decisions",https://www.bionixus.com/healthcare-market-research-agency-gcc
/qualitative-market-research,https://www.bionixus.com/qualitative-market-research,200,true,405,true,1595,"Qualitative Market Research for Healthcare and Pharma | B...","Qualitative Market Research for Pharmaceutical Strategy",https://www.bionixus.com/qualitative-market-research
/fr/market-research-healthcare,https://www.bionixus.com/fr/market-research-healthcare,200,true,359,true,1641,"Healthcare Market Research | Recherche healthcare et phar...","Healthcare market research pour decisions pharmaceutiques en Europe et Moyen-Orient",https://www.bionixus.com/fr/market-research-healthcare
/es/market-research-healthcare,https://www.bionixus.com/es/market-research-healthcare,200,true,346,true,1654,"Healthcare Market Research | Investigacion healthcare y f...","Healthcare market research para decisiones farmaceuticas en Europa y Oriente Medio",https://www.bionixus.com/es/market-research-healthcare
/de/market-research-healthcare,https://www.bionixus.com/de/market-research-healthcare,200,true,335,true,1665,"Healthcare Market Research | Pharma Healthcare Market Res...","Healthcare market research fuer pharmazeutische Entscheidungen in Europa und Nahost",https://www.bionixus.com/de/market-research-healthcare
/ar/market-research-healthcare,https://www.bionixus.com/ar/market-research-healthcare,200,true,319,true,1681,"Healthcare Market Research | ابحاث healthcare ودوائية لاو...","Healthcare market research لقرارات دوائية في اوروبا والشرق الاوسط",https://www.bionixus.com/ar/market-research-healthcare
/es/market-access,https://www.bionixus.com/es/market-access,200,true,319,true,1681,"Market Access en Salud y Farma | BioNixus","Market Access para Farma y Healthcare",https://www.bionixus.com/es/market-access
/ar/contacts,https://www.bionixus.com/ar/contacts,200,true,315,true,1685,"تواصل مع BioNixus | أبحاث السوق الصحي والدوائي","لنتواصل",https://www.bionixus.com/ar/contacts
/insights,https://www.bionixus.com/insights,200,true,312,true,1688,"BioNixus Insights for Healthcare & Pharma Strategy","Why BioNixus Insights Matter in Healthcare and Pharmaceuticals",https://www.bionixus.com/insights
/ar/arabic-blog-alsawdyh,https://www.bionixus.com/ar/arabic-blog-alsawdyh,200,true,295,true,1705,"المدونة العربية: أبحاث السوق الدوائي في السعودية | BioNixus","دليل أبحاث السوق الدوائي في السعودية",https://www.bionixus.com/ar/arabic-blog-alsawdyh
/bionixus-ai-chatbots-increase-sales-and-lead-generation,https://www.bionixus.com/bionixus-ai-chatbots-increase-sales-and-lead-generation,200,true,286,true,1714,"AI Chatbots in Pharmaceutical Market Research | BioNixus","AI Chatbots for Healthcare Market Research and Lead Generation",https://www.bionixus.com/bionixus-ai-chatbots-increase-sales-and-lead-generation
/real-world-evidence-gcc,https://www.bionixus.com/real-world-evidence-gcc,200,true,273,true,1727,"Real World Evidence GCC | BioNixus","Real World Evidence GCC",https://www.bionixus.com/real-world-evidence-gcc
/de/success-in-startups,https://www.bionixus.com/de/success-in-startups,200,true,242,true,1758,"Erfolg in Healthcare Startups | BioNixus Blog (DE)","Erfolgsfaktoren für Healthcare Startups",https://www.bionixus.com/de/success-in-startups
/clinical-diagnostics-proposal-request,https://www.bionixus.com/clinical-diagnostics-proposal-request,200,true,146,true,1854,"Register for Clinical Diagnostics Proposal | BioNixus","Receive the full market assessment proposal",https://www.bionixus.com/clinical-diagnostics-proposal-request
/zh/market-research-healthcare,https://www.bionixus.com/zh/market-research-healthcare,200,true,139,true,1861,"Healthcare Market Research | 欧洲与中东医药Healthcare市场研究","服务欧洲与中东制药决策的healthcare market research",https://www.bionixus.com/zh/market-research-healthcare
/zh/methodology,https://www.bionixus.com/zh/methodology,200,true,133,true,1867,"Healthcare Research Methodology & Process | BioNixus","医疗健康市场研究方法",https://www.bionixus.com/zh/methodology
/news,https://www.bionixus.com/news,200,true,128,true,1872,"News & Press Releases | BioNixus Healthcare Market Research","News",https://www.bionixus.com/news
/media,https://www.bionixus.com/media,200,true,118,true,1882,"Media Kit & Press Contact | BioNixus","Media kit",https://www.bionixus.com/media
/ar/strategic-portfolio,https://www.bionixus.com/ar/strategic-portfolio,200,true,85,true,1915,"محفظة BioNixus الاستراتيجية | أبحاث السوق والاستشارات","أبحاث السوق و الاستشارات الاستراتيجية",https://www.bionixus.com/ar/strategic-portfolio
/healthcare-market-research,https://www.bionixus.com/healthcare-market-research,200,true,3661,false,-1661,"Healthcare Market Research Companies | Global Pharma Insi...","Healthcare market research companies — global pharmaceutical insights across the USA, Europe, MENA and Asia",https://www.bionixus.com/healthcare-market-research
/pharmaceutical-companies-kuwait,https://www.bionixus.com/pharmaceutical-companies-kuwait,200,true,3216,false,-1216,"Pharmaceutical Companies in Kuwait | Top Medical | BioNixus","Pharmaceutical companies in Kuwait",https://www.bionixus.com/pharmaceutical-companies-kuwait
/quantitative-healthcare-market-research,https://www.bionixus.com/quantitative-healthcare-market-research,200,true,3205,false,-1205,"Quantitative Healthcare Market Research Guide 202 | BioNixus","Quantitative Healthcare Market Research Methodology Guide 2026",https://www.bionixus.com/quantitative-healthcare-market-research
/gcc-pharma-market-report-2026,https://www.bionixus.com/gcc-pharma-market-report-2026,200,true,3140,false,-1140,"GCC Pharma Market Report 2026 | Biologics, Generic Inject...","GCC Pharmaceutical Market Report 2026: Sales, Consumption, and Strategic Intelligence",https://www.bionixus.com/gcc-pharma-market-report-2026
/global-websites/south-africa,https://www.bionixus.com/global-websites/south-africa,200,true,2668,false,-668,"South Africa Pharmaceutical Market Research | Glo | BioNixus","South Africa Healthcare Market Strategy",https://www.bionixus.com/global-websites/south-africa
/global-websites/algeria,https://www.bionixus.com/global-websites/algeria,200,true,2625,false,-625,"Algeria Pharmaceutical Market Research | Global H | BioNixus","Algeria Healthcare Market Strategy",https://www.bionixus.com/global-websites/algeria
/global-websites/iraq,https://www.bionixus.com/global-websites/iraq,200,true,2625,false,-625,"Iraq Pharmaceutical Market Research | Global Heal | BioNixus","Iraq Healthcare Market Strategy",https://www.bionixus.com/global-websites/iraq
/global-websites/jordan,https://www.bionixus.com/global-websites/jordan,200,true,2625,false,-625,"Jordan Pharmaceutical Market Research | Global He | BioNixus","Jordan Healthcare Market Strategy",https://www.bionixus.com/global-websites/jordan
/global-websites/lebanon,https://www.bionixus.com/global-websites/lebanon,200,true,2625,false,-625,"Lebanon Pharmaceutical Market Research | Global H | BioNixus","Lebanon Healthcare Market Strategy",https://www.bionixus.com/global-websites/lebanon
/global-websites/libya,https://www.bionixus.com/global-websites/libya,200,true,2625,false,-625,"Libya Pharmaceutical Market Research | Global Hea | BioNixus","Libya Healthcare Market Strategy",https://www.bionixus.com/global-websites/libya
/global-websites/morocco,https://www.bionixus.com/global-websites/morocco,200,true,2625,false,-625,"Morocco Pharmaceutical Market Research | Global H | BioNixus","Morocco Healthcare Market Strategy",https://www.bionixus.com/global-websites/morocco
/global-websites/tunisia,https://www.bionixus.com/global-websites/tunisia,200,true,2625,false,-625,"Tunisia Pharmaceutical Market Research | Global H | BioNixus","Tunisia Healthcare Market Strategy",https://www.bionixus.com/global-websites/tunisia
/global-websites/kenya,https://www.bionixus.com/global-websites/kenya,200,true,2623,false,-623,"Kenya Pharmaceutical Market Research | Global Hea | BioNixus","Kenya Healthcare Market Strategy",https://www.bionixus.com/global-websites/kenya
/global-websites/nigeria,https://www.bionixus.com/global-websites/nigeria,200,true,2623,false,-623,"Nigeria Pharmaceutical Market Research | Global H | BioNixus","Nigeria Healthcare Market Strategy",https://www.bionixus.com/global-websites/nigeria
/global-websites/switzerland,https://www.bionixus.com/global-websites/switzerland,200,true,2613,false,-613,"Switzerland Pharmaceutical Market Research | Glob | BioNixus","Switzerland Healthcare Market Strategy",https://www.bionixus.com/global-websites/switzerland
/global-websites/denmark,https://www.bionixus.com/global-websites/denmark,200,true,2611,false,-611,"Denmark Pharmaceutical Market Research | Global H | BioNixus","Denmark Healthcare Market Strategy",https://www.bionixus.com/global-websites/denmark
/global-websites/sweden,https://www.bionixus.com/global-websites/sweden,200,true,2611,false,-611,"Sweden Pharmaceutical Market Research | Global He | BioNixus","Sweden Healthcare Market Strategy",https://www.bionixus.com/global-websites/sweden
/global-websites/turkey,https://www.bionixus.com/global-websites/turkey,200,true,2611,false,-611,"Turkey Pharmaceutical Market Research | Global He | BioNixus","Turkey Healthcare Market Strategy",https://www.bionixus.com/global-websites/turkey
/global-websites/canada,https://www.bionixus.com/global-websites/canada,200,true,2603,false,-603,"Canada Pharmaceutical Market Research | Global He | BioNixus","Canada Healthcare Market Strategy",https://www.bionixus.com/global-websites/canada
/global-websites/mexico,https://www.bionixus.com/global-websites/mexico,200,true,2603,false,-603,"Mexico Pharmaceutical Market Research | Global He | BioNixus","Mexico Healthcare Market Strategy",https://www.bionixus.com/global-websites/mexico
/global-websites/china,https://www.bionixus.com/global-websites/china,200,true,2602,false,-602,"China Pharmaceutical Market Research | Global Hea | BioNixus","China Healthcare Market Strategy",https://www.bionixus.com/global-websites/china
/global-websites/japan,https://www.bionixus.com/global-websites/japan,200,true,2600,false,-600,"Japan Pharmaceutical Market Research | Global Hea | BioNixus","Japan Healthcare Market Strategy",https://www.bionixus.com/global-websites/japan
/global-websites/singapore,https://www.bionixus.com/global-websites/singapore,200,true,2600,false,-600,"Singapore Pharmaceutical Market Research | Global | BioNixus","Singapore Healthcare Market Strategy",https://www.bionixus.com/global-websites/singapore
/pharmaceutical-companies-saudi-arabia,https://www.bionixus.com/pharmaceutical-companies-saudi-arabia,200,true,2582,false,-582,"Pharmaceutical Companies in Saudi Arabia | Indust | BioNixus","Pharmaceutical Companies in Saudi Arabia",https://www.bionixus.com/pharmaceutical-companies-saudi-arabia
/healthcare-market-research/saudi-arabia,https://www.bionixus.com/healthcare-market-research/saudi-arabia,200,true,2507,false,-507,"Pharmaceutical Market Research in Saudi Arabia | BioNixus","Pharmaceutical Market Research in Saudi Arabia",https://www.bionixus.com/healthcare-market-research/saudi-arabia
/pharmaceutical-companies-uae,https://www.bionixus.com/pharmaceutical-companies-uae,200,true,2480,false,-480,"Pharmaceutical Companies in the UAE | Industry Gu | BioNixus","Pharmaceutical Companies in the UAE",https://www.bionixus.com/pharmaceutical-companies-uae
/ar,https://www.bionixus.com/ar,200,true,2434,false,-434,"BioNixus | Healthcare & Pharmaceutical Market Research","خدمات BioNixus لأبحاث السوق الصحية والدوائية",https://www.bionixus.com/ar
/healthcare-market-research/therapy/immunology,https://www.bionixus.com/healthcare-market-research/therapy/immunology,200,true,2368,false,-368,"Immunology Research Guide: Biologics & Patient Pathways |...","Immunology market research guide",https://www.bionixus.com/healthcare-market-research/therapy/immunology
/diabetes-market-research-uae,https://www.bionixus.com/diabetes-market-research-uae,200,true,2363,false,-363,"Diabetes Market Research UAE | BioNixus","Diabetes Market Research UAE",https://www.bionixus.com/diabetes-market-research-uae
/pharmaceutical-companies-qatar,https://www.bionixus.com/pharmaceutical-companies-qatar,200,true,2287,false,-287,"Pharmaceutical Companies in Qatar | Industry Guid | BioNixus","Pharmaceutical Companies in Qatar",https://www.bionixus.com/pharmaceutical-companies-qatar
/healthcare-market-research/therapy/biologics,https://www.bionixus.com/healthcare-market-research/therapy/biologics,200,true,2230,false,-230,"Biologics Research Guide: Biosimilars & Market Access | B...","Biologics market research guide",https://www.bionixus.com/healthcare-market-research/therapy/biologics
/healthcare-market-research/uae,https://www.bionixus.com/healthcare-market-research/uae,200,true,2216,false,-216,"Healthcare Market Research in UAE | Pharma & Pharmaceutic...","Pharmaceutical Market Research in the UAE",https://www.bionixus.com/healthcare-market-research/uae
