pathname,url,status,in_sitemap,word_count,thin,gap_words,title,h1,final_url
/quantitative-healthcare-market-research,https://www.bionixus.com/quantitative-healthcare-market-research,0,true,0,false,,"","",https://www.bionixus.com/quantitative-healthcare-market-research
/kantar-health-alternative-gcc,https://www.bionixus.com/kantar-health-alternative-gcc,200,true,1987,true,13,"Kantar Health Alternative in GCC & Middle East | BioNixus","Kantar Health Alternative for GCC and Middle East — BioNixus",https://www.bionixus.com/kantar-health-alternative-gcc
/pt/insights/top-empresas-pesquisa-mercado-brasil-2026,https://www.bionixus.com/pt/insights/top-empresas-pesquisa-mercado-brasil-2026,200,true,1958,true,42,"Top Empresas de Pesquisa de Mercado no Brasil (Gu | BioNixus","Top Empresas de Pesquisa de Mercado no Brasil",https://www.bionixus.com/pt/insights/top-empresas-pesquisa-mercado-brasil-2026
/healthcare-market-research-italy,https://www.bionixus.com/healthcare-market-research-italy,200,true,1947,true,53,"Healthcare Market Research Company in Italy | AIFA & SSN...","Healthcare & Pharmaceutical Market Research in Italy",https://www.bionixus.com/healthcare-market-research-italy
/es/insights/top-empresas-investigacion-mercado-argentina-2026,https://www.bionixus.com/es/insights/top-empresas-investigacion-mercado-argentina-2026,200,true,1939,true,61,"5 Mejores Empresas de Investigación de Mercado en | BioNixus","5 Mejores Empresas de Investigación de Mercado en Argentina (2026)",https://www.bionixus.com/es/insights/top-empresas-investigacion-mercado-argentina-2026
/pt/insights/top-market-research-companies-brasil-2026,https://www.bionixus.com/pt/insights/top-market-research-companies-brasil-2026,200,true,1938,true,62,"5 Melhores Empresas de Pesquisa de Mercado no Bra | BioNixus","5 Melhores Empresas de Pesquisa de Mercado no Brasil (2026)",https://www.bionixus.com/pt/insights/top-market-research-companies-brasil-2026
/healthcare-market-research-new-zealand,https://www.bionixus.com/healthcare-market-research-new-zealand,200,true,1930,true,70,"Healthcare Market Research Company in New Zealand | Medsafe","Healthcare & Pharmaceutical Market Research in New Zealand",https://www.bionixus.com/healthcare-market-research-new-zealand
/brazil-pharmaceutical-market-research,https://www.bionixus.com/brazil-pharmaceutical-market-research,200,true,1929,true,71,"Pharmaceutical Market Research Company in Brazil | ANVISA,.","Pharmaceutical Market Research Company in Brazil",https://www.bionixus.com/brazil-pharmaceutical-market-research
/bionixus-vs-iqvia-mena,https://www.bionixus.com/bionixus-vs-iqvia-mena,200,true,1914,true,86,"BioNixus vs IQVIA MENA Research (2026) | BioNixus","BioNixus vs IQVIA for MENA Healthcare Research: Direct Comparison 2026",https://www.bionixus.com/bionixus-vs-iqvia-mena
/healthcare-market-research-china,https://www.bionixus.com/healthcare-market-research-china,200,true,1903,true,97,"Healthcare Market Research Company in China | NMPA & NHSA...","Healthcare & Pharmaceutical Market Research in China",https://www.bionixus.com/healthcare-market-research-china
/ar/insights/top-market-research-companies-qatar-2026,https://www.bionixus.com/ar/insights/top-market-research-companies-qatar-2026,200,true,1887,true,113,"أفضل شركات أبحاث السوق في قطر (دليل 2026) | بيونيكسوس","أفضل شركات أبحاث السوق في قطر (دليل 2026)",https://www.bionixus.com/ar/insights/top-market-research-companies-qatar-2026
/pharmaceutical-market-research-dubai,https://www.bionixus.com/pharmaceutical-market-research-dubai,200,true,1858,true,142,"Healthcare Market Research Dubai | Pharma Fieldwork UAE | BioNixus","Pharmaceutical Market Research Companies in Dubai — BioNixus UAE",https://www.bionixus.com/pharmaceutical-market-research-dubai
/healthcare-market-research-south-korea,https://www.bionixus.com/healthcare-market-research-south-korea,200,true,1840,true,160,"Healthcare Market Research Company in South Korea | MFDS &.","Healthcare & Pharmaceutical Market Research in South Korea",https://www.bionixus.com/healthcare-market-research-south-korea
/healthcare-market-research-japan,https://www.bionixus.com/healthcare-market-research-japan,200,true,1798,true,202,"Healthcare Market Research Company in Japan | PMDA, MHLW &.","Healthcare & Pharmaceutical Market Research in Japan",https://www.bionixus.com/healthcare-market-research-japan
/healthcare-market-research-switzerland,https://www.bionixus.com/healthcare-market-research-switzerland,200,true,1759,true,241,"Healthcare Market Research Switzerland | BioNixus","Healthcare Market Research Company in Switzerland",https://www.bionixus.com/healthcare-market-research-switzerland
/ar/insights/top-market-research-companies-kuwait-2026,https://www.bionixus.com/ar/insights/top-market-research-companies-kuwait-2026,200,true,1752,true,248,"أفضل شركات أبحاث السوق في الكويت (دليل 2026) | بيونيكسوس","أفضل شركات أبحاث السوق في الكويت (دليل 2026)",https://www.bionixus.com/ar/insights/top-market-research-companies-kuwait-2026
/gcc-market-access-guide,https://www.bionixus.com/gcc-market-access-guide,200,true,1728,true,272,"GCC Pharmaceutical Market Access Guide 2026 | SFD | BioNixus","GCC pharmaceutical market access guide 2026 — registration, pricing, and reimbursement",https://www.bionixus.com/gcc-market-access-guide
/clinical-diagnostics-market-research,https://www.bionixus.com/clinical-diagnostics-market-research,200,true,1703,true,297,"Clinical Diagnostics Market Research | QC & Immunohematolog","Clinical Diagnostics Market Assessment",https://www.bionixus.com/clinical-diagnostics-market-research
/healthcare-market-research-singapore,https://www.bionixus.com/healthcare-market-research-singapore,200,true,1686,true,314,"Healthcare Market Research Company in Singapore | ACE & HSA","Healthcare & Pharmaceutical Market Research in Singapore",https://www.bionixus.com/healthcare-market-research-singapore
/healthcare-market-research-denmark,https://www.bionixus.com/healthcare-market-research-denmark,200,true,1664,true,336,"Healthcare Market Research Company in Denmark | DKMA &...","Healthcare & Pharmaceutical Market Research in Denmark",https://www.bionixus.com/healthcare-market-research-denmark
/healthcare-market-research-malaysia,https://www.bionixus.com/healthcare-market-research-malaysia,200,true,1660,true,340,"Healthcare Market Research Company in Malaysia | NPRA &...","Healthcare & Pharmaceutical Market Research in Malaysia",https://www.bionixus.com/healthcare-market-research-malaysia
/pharmacies-saudi-arabia-marketing,https://www.bionixus.com/pharmacies-saudi-arabia-marketing,200,true,1658,true,342,"Pharmacy Market Research Saudi Arabia: Boost Retail Sales 4","Market Research & Marketing Automation for Pharmacies in Saudi Arabia",https://www.bionixus.com/pharmacies-saudi-arabia-marketing
/gcc-pharmaceutical-market-research,https://www.bionixus.com/gcc-pharmaceutical-market-research,200,true,1656,true,344,"GCC Biologics & Generic Injectables Market 2026 | BioNixus","GCC Biologics & Generic Injectables Market Research 2026 — Precision Medicine & Drug Repurposing",https://www.bionixus.com/gcc-pharmaceutical-market-research
/healthcare-market-research-australia,https://www.bionixus.com/healthcare-market-research-australia,200,true,1656,true,344,"Healthcare Market Research Company in Australia | TGA & PBA","Healthcare & Pharmaceutical Market Research in Australia",https://www.bionixus.com/healthcare-market-research-australia
/healthcare-market-research-poland,https://www.bionixus.com/healthcare-market-research-poland,200,true,1624,true,376,"Healthcare Market Research Company in Poland | AOTMiT & URP","Healthcare & Pharmaceutical Market Research in Poland",https://www.bionixus.com/healthcare-market-research-poland
/healthcare-market-research-turkey,https://www.bionixus.com/healthcare-market-research-turkey,200,true,1620,true,380,"Healthcare Market Research Company in Turkey | TİTCK & SGK.","Healthcare & Pharmaceutical Market Research in Turkey",https://www.bionixus.com/healthcare-market-research-turkey
/ar/insights/top-sharaket-abhath-sihha-alsaudia-2026,https://www.bionixus.com/ar/insights/top-sharaket-abhath-sihha-alsaudia-2026,200,true,1592,true,408,"أفضل شركات أبحاث سوق الرعاية الصحية في المملكة العربية السعودية (2026) | بيونيكسس","أفضل شركات أبحاث سوق الرعاية الصحية في المملكة العربية السعودية (دليل 2026)",https://www.bionixus.com/ar/insights/top-sharaket-abhath-sihha-alsaudia-2026
/healthcare-market-research-canada,https://www.bionixus.com/healthcare-market-research-canada,200,true,1575,true,425,"Healthcare Market Research Company in Canada | CADTH & Heal","Healthcare & Pharmaceutical Market Research in Canada",https://www.bionixus.com/healthcare-market-research-canada
/client-reviews,https://www.bionixus.com/client-reviews,200,true,1574,true,426,"Client Reviews | BioNixus Pharmaceutical Market Research","Recommended by more than 40 happy clients",https://www.bionixus.com/client-reviews
/egypt-pharmaceutical-market-research,https://www.bionixus.com/egypt-pharmaceutical-market-research,200,true,1564,true,436,"Healthcare Market Research Company in Egypt | EDA & MENA...","Healthcare & Pharmaceutical Market Research Company in Egypt",https://www.bionixus.com/egypt-pharmaceutical-market-research
/healthcare-market-research-spain,https://www.bionixus.com/healthcare-market-research-spain,200,true,1549,true,451,"Healthcare Market Research Company in Spain | AEMPS & SNS...","Healthcare Market Research Company in Spain",https://www.bionixus.com/healthcare-market-research-spain
/uae-pharmaceutical-market-research,https://www.bionixus.com/uae-pharmaceutical-market-research,200,true,1545,true,455,"Healthcare Market Research Company in UAE | DHA, DOH & MOHA","Healthcare & Pharmaceutical Market Research Company in UAE",https://www.bionixus.com/uae-pharmaceutical-market-research
/healthcare-market-research-usa,https://www.bionixus.com/healthcare-market-research-usa,200,true,1529,true,471,"Healthcare Market Research Company in USA | IRB-Compliant H","Healthcare & Pharmaceutical Market Research in the USA",https://www.bionixus.com/healthcare-market-research-usa
/ar/insights/top-sharaket-abhath-alsuq-alsaudia-2026,https://www.bionixus.com/ar/insights/top-sharaket-abhath-alsuq-alsaudia-2026,200,true,1525,true,475,"أفضل شركات أبحاث السوق في المملكة العربية السعودية (دليل 2026) | بيونيكسس","أفضل شركات أبحاث السوق في المملكة العربية السعودية (دليل 2026)",https://www.bionixus.com/ar/insights/top-sharaket-abhath-alsuq-alsaudia-2026
/services,https://www.bionixus.com/services,200,true,1521,true,479,"Global Market Research Services | Pharma, Healthcare &...","Market research services for pharma, healthcare, and commercial industries",https://www.bionixus.com/services
/healthcare-market-research-france,https://www.bionixus.com/healthcare-market-research-france,200,true,1492,true,508,"Healthcare Market Research Company in France | HAS &...","Healthcare Market Research Company in France",https://www.bionixus.com/healthcare-market-research-france
/healthcare-market-research-germany,https://www.bionixus.com/healthcare-market-research-germany,200,true,1428,true,572,"Healthcare Market Research Germany | BioNixus","Healthcare Market Research Company in Germany",https://www.bionixus.com/healthcare-market-research-germany
/bionixus-industries,https://www.bionixus.com/bionixus-industries,200,true,1376,true,624,"Market Research Across Industries | BioNixus","One research firm guiding every industry we serve",https://www.bionixus.com/bionixus-industries
/bionixus-industries/insights,https://www.bionixus.com/bionixus-industries/insights,200,true,1376,true,624,"Market Research Across Industries | BioNixus","One research firm guiding every industry we serve",https://www.bionixus.com/bionixus-industries
/biosimilar-market-entry-saudi-arabia,https://www.bionixus.com/biosimilar-market-entry-saudi-arabia,200,true,1376,true,624,"Biosimilar Entry Saudi Arabia (2026) | BioNixus","Biosimilar Market Entry in Saudi Arabia: 2026 Strategy Guide",https://www.bionixus.com/biosimilar-market-entry-saudi-arabia
/pt/methodology,https://www.bionixus.com/pt/methodology,200,true,1318,true,682,"Metodologia de pesquisa de mercado em saúde | BioNixus","Metodologia de pesquisa de mercado em saúde",https://www.bionixus.com/pt/methodology
/gcc-generic-injectables-market,https://www.bionixus.com/gcc-generic-injectables-market,200,true,1313,true,687,"GCC Generic Injectables Market Research & Intelli | BioNixus","GCC Generic Injectables Market: Research & Commercial Intelligence",https://www.bionixus.com/gcc-generic-injectables-market
/nf1-pharma-market-research,https://www.bionixus.com/nf1-pharma-market-research,200,true,1308,true,692,"NF1 Pharma Market Research Services | Competitive...","NF1 Pharma Market Research & Competitive Intelligence Services",https://www.bionixus.com/nf1-pharma-market-research
/pt/pesquisa-mercado-farmaceutico-brasil,https://www.bionixus.com/pt/pesquisa-mercado-farmaceutico-brasil,200,true,1295,true,705,"Empresa de Pesquisa de Mercado Farmacêutico no Br | BioNixus","Empresa de Pesquisa de Mercado Farmacêutico no Brasil",https://www.bionixus.com/pt/pesquisa-mercado-farmaceutico-brasil
/pt/pesquisa-mercado-saude-brasil,https://www.bionixus.com/pt/pesquisa-mercado-saude-brasil,200,true,1290,true,710,"Empresa de Pesquisa de Mercado de Saúde no Brasil | BioNixus","Empresa de Pesquisa de Mercado de Saúde no Brasil",https://www.bionixus.com/pt/pesquisa-mercado-saude-brasil
/ru/methodology,https://www.bionixus.com/ru/methodology,200,true,1288,true,712,"Методология исследований рынка здравоохранения | BioNixus","Методология исследований рынка здравоохранения",https://www.bionixus.com/ru/methodology
/home-staging,https://www.bionixus.com/home-staging,200,true,1286,true,714,"BioNixus | Pharma Market Research — Europe, Middle East & Africa","Research that shapes pharma strategy",https://www.bionixus.com/home-staging
/premium-home-page,https://www.bionixus.com/premium-home-page,200,true,1286,true,714,"BioNixus | Pharma Market Research — Europe, Middle East & Africa","Research that shapes pharma strategy",https://www.bionixus.com/premium-home-page
/gcc-pharmacy-market,https://www.bionixus.com/gcc-pharmacy-market,200,true,1228,true,772,"GCC Pharmacy Market Research — Retail, E-Pharmacy & Communi","GCC Pharmacy Market: Retail, E-Pharmacy & Community Intelligence",https://www.bionixus.com/gcc-pharmacy-market
/pharmaceutical-therapy-areas,https://www.bionixus.com/pharmaceutical-therapy-areas,200,true,1212,true,788,"Pharmaceutical Therapy Areas Market Research | 12 | BioNixus","Pharmaceutical Therapy Areas Market Research Across MENA, UK, and Europe",https://www.bionixus.com/pharmaceutical-therapy-areas
/gcc-clinical-trials-market,https://www.bionixus.com/gcc-clinical-trials-market,200,true,1195,true,805,"GCC Clinical Trials Market — Site Feasibility & Landscape...","GCC Clinical Trials Market: Feasibility & Landscape Intelligence",https://www.bionixus.com/gcc-clinical-trials-market
/fr/about,https://www.bionixus.com/fr/about,200,true,1193,true,807,"À propos de BioNixus | Recherche marché mondiale fondée sur","Recherche marché mondiale — fondée sur le pharma, l’industrie la plus réglementée que nous servons, et étendue à l’ensemble des secteurs",https://www.bionixus.com/fr/about
/market-research-in-uae,https://www.bionixus.com/market-research-in-uae,200,true,1190,true,810,"Market Research in UAE | Healthcare & Pharma Market Researc","Market Research in the UAE",https://www.bionixus.com/market-research-uae
/market-research-uae,https://www.bionixus.com/market-research-uae,200,true,1190,true,810,"Market Research in UAE | Healthcare & Pharma Market Researc","Market Research in the UAE",https://www.bionixus.com/market-research-uae
/es/about,https://www.bionixus.com/es/about,200,true,1175,true,825,"Sobre BioNixus | Investigación de mercado global basada en.","Investigación de mercado global — construida sobre pharma, la industria más regulada que servimos, y ampliada para ser de confianza en todas las industrias",https://www.bionixus.com/es/about
/gcc-personalized-medicine-market,https://www.bionixus.com/gcc-personalized-medicine-market,200,true,1171,true,829,"GCC Personalized Medicine Market — Genomics & Precision...","GCC Personalized Medicine Market: Genomics & Precision Intelligence",https://www.bionixus.com/gcc-personalized-medicine-market
/ar/about,https://www.bionixus.com/ar/about,200,true,1165,true,835,"عن BioNixus | أبحاث سوق عالمية مبنية على قطاع الأدوية المنظم","أبحاث سوق عالمية — مبنية على قطاع الأدوية، أكثر القطاعات تنظيمًا الذي نخدمه، وتوسّعت لتُوثَق عبر الصناعات",https://www.bionixus.com/ar/about
/de/about,https://www.bionixus.com/de/about,200,true,1162,true,838,"Über BioNixus | Globale Marktforschung auf reguliertem...","Globale Marktforschung — auf pharmazeutischer Forschung aufgebaut, der am stärksten regulierten Branche, die wir bedienen, und über Branchen hinweg ausgeweitet",https://www.bionixus.com/de/about
/pt/about,https://www.bionixus.com/pt/about,200,true,1162,true,838,"Sobre a BioNixus | Pesquisa de mercado global fundada em...","Pesquisa de mercado global — construída sobre pharma, a indústria mais regulada que servimos, e expandida para ser confiável em todas as indústrias",https://www.bionixus.com/pt/about
/gcc-biopharmaceuticals-market,https://www.bionixus.com/gcc-biopharmaceuticals-market,200,true,1131,true,869,"GCC Biopharmaceuticals Market — Biologics & Localization...","GCC Biopharmaceuticals Market: Biologics & Localization Intelligence",https://www.bionixus.com/gcc-biopharmaceuticals-market
/services/market-access,https://www.bionixus.com/services/market-access,200,true,1118,true,882,"Market Access Consulting | HTA EMEA & GCC Pricing | BioNixus","Market Access Consulting | HTA EMEA & GCC Pricing",https://www.bionixus.com/services/market-access
/ar/abhath-suq-adwiyah-saudi-arabia,https://www.bionixus.com/ar/abhath-suq-adwiyah-saudi-arabia,200,true,1094,true,906,"أبحاث سوق الأدوية في المملكة العربية السعودية | بيونيكسس","أبحاث سوق الأدوية في المملكة العربية السعودية",https://www.bionixus.com/ar/abhath-suq-adwiyah-saudi-arabia
/kol-mapping-saudi-arabia-oncology,https://www.bionixus.com/kol-mapping-saudi-arabia-oncology,200,true,1092,true,908,"KOL Mapping for Oncology in Saudi Arabia | BioNixus MENA Research","KOL Mapping for Oncology in Saudi Arabia: Methodology, Data, and Engagement Strategy",https://www.bionixus.com/kol-mapping-saudi-arabia-oncology
/sfda-market-access-strategy-saudi-arabia,https://www.bionixus.com/sfda-market-access-strategy-saudi-arabia,200,true,1069,true,931,"SFDA Market Access Strategy KSA | BioNixus","SFDA Market Access Strategy in Saudi Arabia: 2026 Complete Guide",https://www.bionixus.com/sfda-market-access-strategy-saudi-arabia
/ar/methodology,https://www.bionixus.com/ar/methodology,200,true,1051,true,949,"منهجية أبحاث السوق الصحي | BioNixus","منهجية أبحاث السوق الصحي والدوائي",https://www.bionixus.com/ar/methodology
/global-websites/united-arab-emirates,https://www.bionixus.com/global-websites/united-arab-emirates,200,true,1051,true,949,"UAE Pharmaceutical Go-to-Market Blueprint | Dubai | BioNixus","UAE Pharmaceutical Go-to-Market Blueprint",https://www.bionixus.com/global-websites/united-arab-emirates
/ru/about,https://www.bionixus.com/ru/about,200,true,1021,true,979,"О BioNixus | Глобальные исследования рынка на основе...","Глобальные исследования рынка — построенные на pharma, наиболее регулируемой отрасли, которую мы обслуживаем, и расширенные на доверие во всех индустриях",https://www.bionixus.com/ru/about
/services/clinical-trial-support,https://www.bionixus.com/services/clinical-trial-support,200,true,1004,true,996,"Clinical Trial Support | Site Identification EMEA — BioNixus","Clinical Trial Support",https://www.bionixus.com/services/clinical-trial-support
/real-world-evidence,https://www.bionixus.com/real-world-evidence,200,true,1000,true,1000,"Real World Evidence (RWE) for Pharma | BioNixus EMEA & MENA","Real World Evidence (RWE) for Pharmaceutical and Biotech Teams",https://www.bionixus.com/real-world-evidence
/physician-survey-saudi-arabia,https://www.bionixus.com/physician-survey-saudi-arabia,200,true,964,true,1036,"Saudi Physician Surveys (2026) | BioNixus","How to Conduct Physician Surveys in Saudi Arabia: A Complete Guide for Pharma Teams",https://www.bionixus.com/physician-survey-saudi-arabia
/de/methodology,https://www.bionixus.com/de/methodology,200,true,955,true,1045,"Methodik der Gesundheitsmarktforschung | BioNixus","Methodik der Gesundheitsmarktforschung",https://www.bionixus.com/de/methodology
/services/quantitative-research,https://www.bionixus.com/services/quantitative-research,200,true,953,true,1047,"Quantitative Healthcare Research | Physician Surveys EMEA","Quantitative Healthcare Research & Physician Surveys",https://www.bionixus.com/services/quantitative-research
/services/competitive-intelligence,https://www.bionixus.com/services/competitive-intelligence,200,true,946,true,1054,"Pharmaceutical Competitive Intelligence | Pipeline Analysis","Competitive Intelligence",https://www.bionixus.com/services/competitive-intelligence
/fr/healthcare-market-research,https://www.bionixus.com/fr/healthcare-market-research,200,true,938,true,1062,"Recherche de marché santé et pharma | Europe et M | BioNixus","Recherche de marché santé et pharmaceutique pour l&#x27;Europe et le Moyen-Orient",https://www.bionixus.com/fr/healthcare-market-research
/services/qualitative-research,https://www.bionixus.com/services/qualitative-research,200,true,930,true,1070,"Qualitative Pharma Research | KOL Interviews EMEA — BioNixus","Qualitative Pharmaceutical Research & Expert Insights",https://www.bionixus.com/services/qualitative-research
/market-research-ksa,https://www.bionixus.com/market-research-ksa,200,true,928,true,1072,"Market Research KSA | Pharma & Healthcare Intelli | BioNixus","Market Research KSA",https://www.bionixus.com/market-research-ksa
/fr/methodology,https://www.bionixus.com/fr/methodology,200,true,925,true,1075,"Méthodologie des études de marché santé | BioNixus","Méthodologie des études de marché santé",https://www.bionixus.com/fr/methodology
/services/kol-stakeholder-mapping,https://www.bionixus.com/services/kol-stakeholder-mapping,200,true,895,true,1105,"KOL Mapping & Stakeholder Engagement | EMEA — BioNixus","KOL & Stakeholder Mapping",https://www.bionixus.com/services/kol-stakeholder-mapping
/mena-pharma-market-data,https://www.bionixus.com/mena-pharma-market-data,200,true,878,true,1122,"MENA Pharmaceutical Market Data 2026 | Statistics | BioNixus","MENA Pharmaceutical Market Data 2026",https://www.bionixus.com/mena-pharma-market-data
/desmoid-tumor-pharma-market-research,https://www.bionixus.com/desmoid-tumor-pharma-market-research,200,true,861,true,1139,"Desmoid Tumour Pharma Market Research Services | Ogsiveo...","Desmoid Tumour Pharma Market Research & Competitive Intelligence Services",https://www.bionixus.com/desmoid-tumor-pharma-market-research
/saudi-arabia-financial-services-market-research,https://www.bionixus.com/saudi-arabia-financial-services-market-research,200,true,855,true,1145,"Financial Services Market Research Company in Saudi Arabia.","Financial Services & Banking market research company in Saudi Arabia",https://www.bionixus.com/saudi-arabia-financial-services-market-research
/saudi-arabia-public-sector-market-research,https://www.bionixus.com/saudi-arabia-public-sector-market-research,200,true,853,true,1147,"Public Sector Market Research Company in Saudi Arabia (2026","Public Sector & Government market research company in Saudi Arabia",https://www.bionixus.com/saudi-arabia-public-sector-market-research
/saudi-arabia-real-estate-market-research,https://www.bionixus.com/saudi-arabia-real-estate-market-research,200,true,847,true,1153,"Real Estate Market Research Company in Saudi Arabia (2026)","Real Estate & Construction market research company in Saudi Arabia",https://www.bionixus.com/saudi-arabia-real-estate-market-research
/saudi-arabia-fmcg-market-research,https://www.bionixus.com/saudi-arabia-fmcg-market-research,200,true,836,true,1164,"FMCG Market Research Company in Saudi Arabia (2026) |...","FMCG & Consumer Goods market research company in Saudi Arabia",https://www.bionixus.com/saudi-arabia-fmcg-market-research
/market-research-saudi,https://www.bionixus.com/market-research-saudi,200,true,834,true,1166,"Market Research Saudi | Healthcare & Pharma Servi | BioNixus","Market Research Saudi",https://www.bionixus.com/market-research-saudi
/saudi-arabia-technology-market-research,https://www.bionixus.com/saudi-arabia-technology-market-research,200,true,833,true,1167,"Technology Market Research Company in Saudi Arabia (2026)","Technology & B2B Software market research company in Saudi Arabia",https://www.bionixus.com/saudi-arabia-technology-market-research
