pathname,url,status,in_sitemap,word_count,thin,gap_words,title,h1,final_url
/kantar-health-alternative-gcc,https://www.bionixus.com/kantar-health-alternative-gcc,200,true,1987,true,13,"Kantar Health Alternative in GCC & Middle East | BioNixus","Kantar Health Alternative for GCC and Middle East — BioNixus",https://www.bionixus.com/kantar-health-alternative-gcc
/bionixus-vs-iqvia-mena,https://www.bionixus.com/bionixus-vs-iqvia-mena,200,true,1914,true,86,"BioNixus vs IQVIA MENA Research (2026) | BioNixus","BioNixus vs IQVIA for MENA Healthcare Research: Direct Comparison 2026",https://www.bionixus.com/bionixus-vs-iqvia-mena
/es/insights/top-empresas-investigacion-mercado-argentina-2026,https://www.bionixus.com/es/insights/top-empresas-investigacion-mercado-argentina-2026,200,true,1913,true,87,"Mejores Empresas de Investigación de Mercado en A | BioNixus","Top Empresas de Investigación de Mercado en Argentina (Guía 2026)",https://www.bionixus.com/es/insights/top-empresas-investigacion-mercado-argentina-2026
/pharmaceutical-companies-iran,https://www.bionixus.com/pharmaceutical-companies-iran,200,true,1869,true,131,"Pharmaceutical Companies in Iran | Industry Guide | BioNixus","Pharmaceutical Companies in Iran",https://www.bionixus.com/pharmaceutical-companies-iran
/pharmaceutical-market-research-dubai,https://www.bionixus.com/pharmaceutical-market-research-dubai,200,true,1856,true,144,"Pharmaceutical Market Research Companies in Dubai | BioNixus","Pharmaceutical Market Research Companies in Dubai — BioNixus UAE",https://www.bionixus.com/pharmaceutical-market-research-dubai
/pharmaceutical-companies-iraq,https://www.bionixus.com/pharmaceutical-companies-iraq,200,true,1835,true,165,"Pharmaceutical Companies in Iraq | Industry Guide | BioNixus","Pharmaceutical Companies in Iraq",https://www.bionixus.com/pharmaceutical-companies-iraq
/pt/insights/top-market-research-companies-brasil-2026,https://www.bionixus.com/pt/insights/top-market-research-companies-brasil-2026,200,true,1803,true,197,"Melhores Empresas de Pesquisa de Mercado no Brasil (Guia 20","Melhores Empresas de Pesquisa de Mercado no Brasil (Guia 2026)",https://www.bionixus.com/pt/insights/top-market-research-companies-brasil-2026
/bionixus-market-research-middle-east,https://www.bionixus.com/bionixus-market-research-middle-east,200,true,1740,true,260,"Middle East Pharmaceutical Market Research | GCC | BioNixus","Middle East Pharmaceutical Market Research That Moves GCC Launch Decisions Faster",https://www.bionixus.com/bionixus-market-research-middle-east
/clinical-diagnostics-market-research,https://www.bionixus.com/clinical-diagnostics-market-research,200,true,1703,true,297,"Clinical Diagnostics Market Research | QC & Immunohematol...","Clinical Diagnostics Market Assessment",https://www.bionixus.com/clinical-diagnostics-market-research
/healthcare-market-research/therapy/oncology,https://www.bionixus.com/healthcare-market-research/therapy/oncology,200,true,1675,true,325,"Oncology Market Research | BioNixus","Oncology market research",https://www.bionixus.com/healthcare-market-research/therapy/oncology
/healthcare-market-research/therapy/rare-diseases,https://www.bionixus.com/healthcare-market-research/therapy/rare-diseases,200,true,1640,true,360,"Rare Disease & Orphan Drug Market Research | BioNixus","Rare disease market research",https://www.bionixus.com/healthcare-market-research/therapy/rare-diseases
/market-research-saudi-arabia-pharmaceutical,https://www.bionixus.com/market-research-saudi-arabia-pharmaceutical,200,true,1617,true,383,"Healthcare Market Research Company in Saudi Arabia | SFDA...","Healthcare & Pharmaceutical Market Research Company in Saudi Arabia",https://www.bionixus.com/market-research-saudi-arabia-pharmaceutical
/pharmacies-saudi-arabia-marketing,https://www.bionixus.com/pharmacies-saudi-arabia-marketing,200,true,1596,true,404,"Pharmacy Market Research Saudi Arabia: Boost Retail Sales...","Market Research & Marketing Automation for Pharmacies in Saudi Arabia",https://www.bionixus.com/pharmacies-saudi-arabia-marketing
/egypt-pharmaceutical-market-research,https://www.bionixus.com/egypt-pharmaceutical-market-research,200,true,1561,true,439,"Healthcare Market Research Company in Egypt | EDA & MENA...","Healthcare & Pharmaceutical Market Research Company in Egypt",https://www.bionixus.com/egypt-pharmaceutical-market-research
/uae-pharmaceutical-market-research,https://www.bionixus.com/uae-pharmaceutical-market-research,200,true,1542,true,458,"Healthcare Market Research Company in UAE | DHA, DOH & MO...","Healthcare & Pharmaceutical Market Research Company in UAE",https://www.bionixus.com/uae-pharmaceutical-market-research
/market-research,https://www.bionixus.com/market-research,200,true,1484,true,516,"Market Research Services Hub | Healthcare & Pharm | BioNixus","Market research services for healthcare and pharma",https://www.bionixus.com/market-research
/gcc-market-access-guide,https://www.bionixus.com/gcc-market-access-guide,200,true,1466,true,534,"GCC Pharmaceutical Market Access Guide 2026 | SFD | BioNixus","GCC pharmaceutical market access guide 2026 — registration, pricing, and reimbursement",https://www.bionixus.com/gcc-market-access-guide
/healthcare-market-research/therapy/aesthetic-medicine,https://www.bionixus.com/healthcare-market-research/therapy/aesthetic-medicine,200,true,1413,true,587,"Aesthetic Medicine Market Research | BioNixus","Aesthetic medicine market research",https://www.bionixus.com/healthcare-market-research/therapy/aesthetic-medicine
/healthcare-market-research/therapy/vaccines,https://www.bionixus.com/healthcare-market-research/therapy/vaccines,200,true,1389,true,611,"Vaccines Market Research | BioNixus","Vaccines market research",https://www.bionixus.com/healthcare-market-research/therapy/vaccines
/healthcare-market-research/therapy/diabetes,https://www.bionixus.com/healthcare-market-research/therapy/diabetes,200,true,1385,true,615,"Diabetes Market Research | BioNixus","Diabetes market research",https://www.bionixus.com/healthcare-market-research/therapy/diabetes
/biosimilar-market-entry-saudi-arabia,https://www.bionixus.com/biosimilar-market-entry-saudi-arabia,200,true,1376,true,624,"Biosimilar Entry Saudi Arabia (2026) | BioNixus","Biosimilar Market Entry in Saudi Arabia: 2026 Strategy Guide",https://www.bionixus.com/biosimilar-market-entry-saudi-arabia
/healthcare-market-research/therapy/cardiology,https://www.bionixus.com/healthcare-market-research/therapy/cardiology,200,true,1376,true,624,"Cardiology Market Research | BioNixus","Cardiology market research",https://www.bionixus.com/healthcare-market-research/therapy/cardiology
/healthcare-market-research/therapy/respiratory,https://www.bionixus.com/healthcare-market-research/therapy/respiratory,200,true,1373,true,627,"Respiratory Market Research | BioNixus","Respiratory market research",https://www.bionixus.com/healthcare-market-research/therapy/respiratory
/healthcare-market-research/services/market-access,https://www.bionixus.com/healthcare-market-research/services/market-access,200,true,1230,true,770,"market access Healthcare Research Service | BioNixus","Market access research service",https://www.bionixus.com/healthcare-market-research/services/market-access
/pharmaceutical-therapy-areas,https://www.bionixus.com/pharmaceutical-therapy-areas,200,true,1212,true,788,"Pharmaceutical Therapy Areas Market Research | 12 | BioNixus","Pharmaceutical Therapy Areas Market Research Across MENA, UK, and Europe",https://www.bionixus.com/pharmaceutical-therapy-areas
/healthcare-market-research/services/kol-mapping,https://www.bionixus.com/healthcare-market-research/services/kol-mapping,200,true,1188,true,812,"kol mapping Healthcare Research Service | BioNixus","Kol mapping research service",https://www.bionixus.com/healthcare-market-research/services/kol-mapping
/ar/insights/top-market-research-companies-egypt-2026,https://www.bionixus.com/ar/insights/top-market-research-companies-egypt-2026,200,true,1179,true,821,"أفضل شركات أبحاث السوق في مصر (دليل 2026) | BioNixus","أفضل شركات أبحاث السوق في مصر (دليل 2026)",https://www.bionixus.com/ar/insights/top-market-research-companies-egypt-2026
/healthcare-market-research/services/qualitative-research,https://www.bionixus.com/healthcare-market-research/services/qualitative-research,200,true,1179,true,821,"qualitative research Healthcare Research Service | BioNixus","Qualitative research research service",https://www.bionixus.com/healthcare-market-research/services/qualitative-research
/healthcare-market-research/services/physician-insights,https://www.bionixus.com/healthcare-market-research/services/physician-insights,200,true,1174,true,826,"physician insights Healthcare Research Service | BioNixus","Physician insights research service",https://www.bionixus.com/healthcare-market-research/services/physician-insights
/market-research-uae,https://www.bionixus.com/market-research-uae,200,true,1173,true,827,"Market Research in UAE | Healthcare & Pharma Market Resea...","Market Research in the UAE",https://www.bionixus.com/market-research-uae
/healthcare-market-research/services/quantitative-research,https://www.bionixus.com/healthcare-market-research/services/quantitative-research,200,true,1155,true,845,"quantitative research Healthcare Research Service | BioNixus","Quantitative research research service",https://www.bionixus.com/healthcare-market-research/services/quantitative-research
/kol-mapping-saudi-arabia-oncology,https://www.bionixus.com/kol-mapping-saudi-arabia-oncology,200,true,1092,true,908,"KOL Mapping for Oncology in Saudi Arabia | BioNixus MENA Research","KOL Mapping for Oncology in Saudi Arabia: Methodology, Data, and Engagement Strategy",https://www.bionixus.com/kol-mapping-saudi-arabia-oncology
/sfda-market-access-strategy-saudi-arabia,https://www.bionixus.com/sfda-market-access-strategy-saudi-arabia,200,true,1069,true,931,"SFDA Market Access Strategy KSA | BioNixus","SFDA Market Access Strategy in Saudi Arabia: 2026 Complete Guide",https://www.bionixus.com/sfda-market-access-strategy-saudi-arabia
/ar/methodology,https://www.bionixus.com/ar/methodology,200,true,1047,true,953,"منهجية أبحاث السوق الصحي | BioNixus","منهجية أبحاث السوق الصحي والدوائي",https://www.bionixus.com/ar/methodology
/global-websites/united-arab-emirates,https://www.bionixus.com/global-websites/united-arab-emirates,200,true,1016,true,984,"Pharmaceutical & Healthcare Market Research in Du | BioNixus","Pharmaceutical & Healthcare Market Research in Dubai & UAE",https://www.bionixus.com/global-websites/united-arab-emirates
/services/clinical-trial-support,https://www.bionixus.com/services/clinical-trial-support,200,true,1004,true,996,"Clinical Trial Support | Site Identification EMEA — BioNixus","Clinical Trial Support",https://www.bionixus.com/services/clinical-trial-support
/physician-survey-saudi-arabia,https://www.bionixus.com/physician-survey-saudi-arabia,200,true,964,true,1036,"Saudi Physician Surveys (2026) | BioNixus","How to Conduct Physician Surveys in Saudi Arabia: A Complete Guide for Pharma Teams",https://www.bionixus.com/physician-survey-saudi-arabia
/services/market-access,https://www.bionixus.com/services/market-access,200,true,959,true,1041,"Market Access Consulting | HTA Strategy EMEA — BioNixus","Market Access & HTA Strategy",https://www.bionixus.com/services/market-access
/services/quantitative-research,https://www.bionixus.com/services/quantitative-research,200,true,953,true,1047,"Quantitative Healthcare Research | Physician Surveys EMEA","Quantitative Healthcare Research & Physician Surveys",https://www.bionixus.com/services/quantitative-research
/de/methodology,https://www.bionixus.com/de/methodology,200,true,951,true,1049,"Methodik der Gesundheitsmarktforschung | BioNixus","Methodik der Gesundheitsmarktforschung",https://www.bionixus.com/de/methodology
/gcc-pharmaceutical-market-research,https://www.bionixus.com/gcc-pharmaceutical-market-research,200,true,947,true,1053,"GCC Biologics Market & Generic Injectables Resear | BioNixus","GCC Pharmaceutical Market Research — Biologics, Generic Injectables & Precision Medicine 2026",https://www.bionixus.com/gcc-pharmaceutical-market-research
/services/competitive-intelligence,https://www.bionixus.com/services/competitive-intelligence,200,true,946,true,1054,"Pharmaceutical Competitive Intelligence | Pipeline Analysis","Competitive Intelligence",https://www.bionixus.com/services/competitive-intelligence
/services/qualitative-research,https://www.bionixus.com/services/qualitative-research,200,true,930,true,1070,"Qualitative Pharma Research | KOL Interviews EMEA — BioNixus","Qualitative Pharmaceutical Research & Expert Insights",https://www.bionixus.com/services/qualitative-research
/market-research-ksa,https://www.bionixus.com/market-research-ksa,200,true,925,true,1075,"Market Research KSA | Pharma & Healthcare Intelligence |...","Market Research KSA",https://www.bionixus.com/market-research-ksa
/fr/methodology,https://www.bionixus.com/fr/methodology,200,true,921,true,1079,"Méthodologie des études de marché santé | BioNixus","Méthodologie des études de marché santé",https://www.bionixus.com/fr/methodology
/real-world-evidence,https://www.bionixus.com/real-world-evidence,200,true,920,true,1080,"Real World Evidence (RWE) for Pharma | BioNixus EMEA & MENA","Real World Evidence (RWE) for Pharmaceutical and Biotech Teams",https://www.bionixus.com/real-world-evidence
/services/kol-stakeholder-mapping,https://www.bionixus.com/services/kol-stakeholder-mapping,200,true,895,true,1105,"KOL Mapping & Stakeholder Engagement | EMEA — BioNixus","KOL & Stakeholder Mapping",https://www.bionixus.com/services/kol-stakeholder-mapping
/mena-pharma-market-data,https://www.bionixus.com/mena-pharma-market-data,200,true,878,true,1122,"MENA Pharmaceutical Market Data 2026 | Statistics | BioNixus","MENA Pharmaceutical Market Data 2026",https://www.bionixus.com/mena-pharma-market-data
/market-research-saudi,https://www.bionixus.com/market-research-saudi,200,true,831,true,1169,"Market Research Saudi | Healthcare & Pharma Services | Bi...","Market Research Saudi",https://www.bionixus.com/market-research-saudi
/ar/market-research-ksa,https://www.bionixus.com/ar/market-research-ksa,200,true,805,true,1195,"أبحاث السوق في السعودية (KSA) | BioNixus","أبحاث السوق في السعودية",https://www.bionixus.com/ar/market-research-ksa
/saudi-arabia-medtech-market-research,https://www.bionixus.com/saudi-arabia-medtech-market-research,200,true,793,true,1207,"MedTech Market Research Company in Saudi Arabia | SFDA Co...","MedTech & Medical Devices Market Research Company in Saudi Arabia",https://www.bionixus.com/saudi-arabia-medtech-market-research
/ar/market-research-saudi,https://www.bionixus.com/ar/market-research-saudi,200,true,781,true,1219,"أبحاث السوق السعودية | BioNixus","أبحاث السوق في السعودية",https://www.bionixus.com/ar/market-research-saudi
/saudi-arabia-consumer-health-market-research,https://www.bionixus.com/saudi-arabia-consumer-health-market-research,200,true,770,true,1230,"Consumer Health Market Research Company in Saudi Arabia |...","Consumer Health & OTC Market Research Company in Saudi Arabia",https://www.bionixus.com/saudi-arabia-consumer-health-market-research
/saudi-arabia-healthcare-market-research,https://www.bionixus.com/saudi-arabia-healthcare-market-research,200,true,770,true,1230,"Healthcare Market Research Company in Saudi Arabia | SFDA...","Healthcare Providers & Hospitals Market Research Company in Saudi Arabia",https://www.bionixus.com/saudi-arabia-healthcare-market-research
/egypt-medtech-market-research,https://www.bionixus.com/egypt-medtech-market-research,200,true,753,true,1247,"MedTech Market Research Company in Egypt | EDA Context |...","MedTech & Medical Devices Market Research Company in Egypt",https://www.bionixus.com/egypt-medtech-market-research
/saudi-arabia-biotech-market-research,https://www.bionixus.com/saudi-arabia-biotech-market-research,200,true,752,true,1248,"Biotech Market Research Company in Saudi Arabia | SFDA Co...","Biotech & Life Sciences Market Research Company in Saudi Arabia",https://www.bionixus.com/saudi-arabia-biotech-market-research
/saudi-arabia-financial-services-market-research,https://www.bionixus.com/saudi-arabia-financial-services-market-research,200,true,752,true,1248,"Financial Services Market Research Company in Saudi Arabi...","Financial Services & Banking Market Research Company in Saudi Arabia",https://www.bionixus.com/saudi-arabia-financial-services-market-research
/saudi-arabia-public-sector-market-research,https://www.bionixus.com/saudi-arabia-public-sector-market-research,200,true,750,true,1250,"Public Sector Market Research Company in Saudi Arabia | S...","Public Sector & Government Market Research Company in Saudi Arabia",https://www.bionixus.com/saudi-arabia-public-sector-market-research
/uae-medtech-market-research,https://www.bionixus.com/uae-medtech-market-research,200,true,749,true,1251,"MedTech Market Research Company in UAE | MOHAP Context |...","MedTech & Medical Devices Market Research Company in UAE",https://www.bionixus.com/uae-medtech-market-research
/market-research-healthcare,https://www.bionixus.com/market-research-healthcare,200,true,746,true,1254,"Healthcare Market Research in Europe & the Middle East |...","Healthcare market research for pharmaceutical decisions in Europe and the Middle East",https://www.bionixus.com/market-research-healthcare
/pt/market-research-healthcare,https://www.bionixus.com/pt/market-research-healthcare,200,true,746,true,1254,"Healthcare Market Research in Europe & the Middle East |...","Healthcare market research for pharmaceutical decisions in Europe and the Middle East",https://www.bionixus.com/pt/market-research-healthcare
/ru/market-research-healthcare,https://www.bionixus.com/ru/market-research-healthcare,200,true,746,true,1254,"Healthcare Market Research in Europe & the Middle East |...","Healthcare market research for pharmaceutical decisions in Europe and the Middle East",https://www.bionixus.com/ru/market-research-healthcare
/saudi-arabia-real-estate-market-research,https://www.bionixus.com/saudi-arabia-real-estate-market-research,200,true,744,true,1256,"Real Estate Market Research Company in Saudi Arabia | SFD...","Real Estate & Construction Market Research Company in Saudi Arabia",https://www.bionixus.com/saudi-arabia-real-estate-market-research
/services,https://www.bionixus.com/services,200,true,743,true,1257,"Pharmaceutical & Healthcare Market Research Servi | BioNixus","Pharmaceutical and healthcare market research services across EMEA",https://www.bionixus.com/services
/saudi-arabia-fmcg-market-research,https://www.bionixus.com/saudi-arabia-fmcg-market-research,200,true,740,true,1260,"FMCG Market Research Company in Saudi Arabia | SFDA Conte...","FMCG & Consumer Goods Market Research Company in Saudi Arabia",https://www.bionixus.com/saudi-arabia-fmcg-market-research
/saudi-arabia-technology-market-research,https://www.bionixus.com/saudi-arabia-technology-market-research,200,true,737,true,1263,"Technology Market Research Company in Saudi Arabia | SFDA...","Technology & B2B Software Market Research Company in Saudi Arabia",https://www.bionixus.com/saudi-arabia-technology-market-research
/saudi-arabia-telecom-market-research,https://www.bionixus.com/saudi-arabia-telecom-market-research,200,true,736,true,1264,"Telecom Market Research Company in Saudi Arabia | SFDA Co...","Telecom & Connectivity Market Research Company in Saudi Arabia",https://www.bionixus.com/saudi-arabia-telecom-market-research
/uae-consumer-health-market-research,https://www.bionixus.com/uae-consumer-health-market-research,200,true,735,true,1265,"Consumer Health Market Research Company in UAE | MOHAP Co...","Consumer Health & OTC Market Research Company in UAE",https://www.bionixus.com/uae-consumer-health-market-research
/egypt-consumer-health-market-research,https://www.bionixus.com/egypt-consumer-health-market-research,200,true,732,true,1268,"Consumer Health Market Research Company in Egypt | EDA Co...","Consumer Health & OTC Market Research Company in Egypt",https://www.bionixus.com/egypt-consumer-health-market-research
/egypt-healthcare-market-research,https://www.bionixus.com/egypt-healthcare-market-research,200,true,729,true,1271,"Healthcare Market Research Company in Egypt | EDA Context...","Healthcare Providers & Hospitals Market Research Company in Egypt",https://www.bionixus.com/egypt-healthcare-market-research
/uae-healthcare-market-research,https://www.bionixus.com/uae-healthcare-market-research,200,true,729,true,1271,"Healthcare Market Research Company in UAE | MOHAP Context...","Healthcare Providers & Hospitals Market Research Company in UAE",https://www.bionixus.com/uae-healthcare-market-research
/saudi-arabia-energy-market-research,https://www.bionixus.com/saudi-arabia-energy-market-research,200,true,728,true,1272,"Energy Market Research Company in Saudi Arabia | SFDA Con...","Energy & Industrials Market Research Company in Saudi Arabia",https://www.bionixus.com/saudi-arabia-energy-market-research
/saudi-arabia-retail-market-research,https://www.bionixus.com/saudi-arabia-retail-market-research,200,true,728,true,1272,"Retail Market Research Company in Saudi Arabia | SFDA Con...","Retail & Shopper Market Research Company in Saudi Arabia",https://www.bionixus.com/saudi-arabia-retail-market-research
/egypt-biotech-market-research,https://www.bionixus.com/egypt-biotech-market-research,200,true,727,true,1273,"Biotech Market Research Company in Egypt | EDA Context |...","Biotech & Life Sciences Market Research Company in Egypt",https://www.bionixus.com/egypt-biotech-market-research
/egypt-financial-services-market-research,https://www.bionixus.com/egypt-financial-services-market-research,200,true,727,true,1273,"Financial Services Market Research Company in Egypt | EDA...","Financial Services & Banking Market Research Company in Egypt",https://www.bionixus.com/egypt-financial-services-market-research
/uae-financial-services-market-research,https://www.bionixus.com/uae-financial-services-market-research,200,true,727,true,1273,"Financial Services Market Research Company in UAE | MOHAP...","Financial Services & Banking Market Research Company in UAE",https://www.bionixus.com/uae-financial-services-market-research
/saudi-arabia-media-market-research,https://www.bionixus.com/saudi-arabia-media-market-research,200,true,726,true,1274,"Media Market Research Company in Saudi Arabia | SFDA Cont...","Media & Entertainment Market Research Company in Saudi Arabia",https://www.bionixus.com/saudi-arabia-media-market-research
/uae-biotech-market-research,https://www.bionixus.com/uae-biotech-market-research,200,true,726,true,1274,"Biotech Market Research Company in UAE | MOHAP Context |...","Biotech & Life Sciences Market Research Company in UAE",https://www.bionixus.com/uae-biotech-market-research
/saudi-arabia-hospitality-market-research,https://www.bionixus.com/saudi-arabia-hospitality-market-research,200,true,724,true,1276,"Hospitality Market Research Company in Saudi Arabia | SFD...","Hospitality & Tourism Market Research Company in Saudi Arabia",https://www.bionixus.com/saudi-arabia-hospitality-market-research
/saudi-arabia-automotive-market-research,https://www.bionixus.com/saudi-arabia-automotive-market-research,200,true,721,true,1279,"Automotive Market Research Company in Saudi Arabia | SFDA...","Automotive Market Research Company in Saudi Arabia",https://www.bionixus.com/saudi-arabia-automotive-market-research
/uae-real-estate-market-research,https://www.bionixus.com/uae-real-estate-market-research,200,true,720,true,1280,"Real Estate Market Research Company in UAE | MOHAP Contex...","Real Estate & Construction Market Research Company in UAE",https://www.bionixus.com/uae-real-estate-market-research
/uae-public-sector-market-research,https://www.bionixus.com/uae-public-sector-market-research,200,true,717,true,1283,"Public Sector Market Research Company in UAE | MOHAP Cont...","Public Sector & Government Market Research Company in UAE",https://www.bionixus.com/uae-public-sector-market-research
/egypt-real-estate-market-research,https://www.bionixus.com/egypt-real-estate-market-research,200,true,716,true,1284,"Real Estate Market Research Company in Egypt | EDA Contex...","Real Estate & Construction Market Research Company in Egypt",https://www.bionixus.com/egypt-real-estate-market-research
/saudi-arabia-education-market-research,https://www.bionixus.com/saudi-arabia-education-market-research,200,true,715,true,1285,"Education Market Research Company in Saudi Arabia | SFDA...","Education Market Research Company in Saudi Arabia",https://www.bionixus.com/saudi-arabia-education-market-research
/egypt-public-sector-market-research,https://www.bionixus.com/egypt-public-sector-market-research,200,true,713,true,1287,"Public Sector Market Research Company in Egypt | EDA Cont...","Public Sector & Government Market Research Company in Egypt",https://www.bionixus.com/egypt-public-sector-market-research
/egypt-fmcg-market-research,https://www.bionixus.com/egypt-fmcg-market-research,200,true,710,true,1290,"FMCG Market Research Company in Egypt | EDA Context | Bio...","FMCG & Consumer Goods Market Research Company in Egypt",https://www.bionixus.com/egypt-fmcg-market-research
/egypt-technology-market-research,https://www.bionixus.com/egypt-technology-market-research,200,true,710,true,1290,"Technology Market Research Company in Egypt | EDA Context...","Technology & B2B Software Market Research Company in Egypt",https://www.bionixus.com/egypt-technology-market-research
