pathname,url,status,in_sitemap,word_count,thin,gap_words,title,h1,final_url
/quantitative-healthcare-market-research,https://www.bionixus.com/quantitative-healthcare-market-research,0,true,0,false,,"","",https://www.bionixus.com/quantitative-healthcare-market-research
/egypt-healthcare-market-report,https://www.bionixus.com/egypt-healthcare-market-report,200,true,1995,true,5,"Egypt Healthcare Market Report 2026 | USD 25B+ Pharma & UHI","Egypt Healthcare Market Report 2026: Pharmaceutical Intelligence, UHI Access, and EDA Registration",https://www.bionixus.com/egypt-healthcare-market-report
/gcc-pharmaceutical-market-research,https://www.bionixus.com/gcc-pharmaceutical-market-research,200,true,1970,true,30,"GCC Biologics & Generic Injectables Market 2026 | BioNixus","GCC Biologics & Generic Injectables Market Research 2026 — Precision Medicine & Drug Repurposing",https://www.bionixus.com/gcc-pharmaceutical-market-research
/pt/insights/top-empresas-pesquisa-mercado-brasil-2026,https://www.bionixus.com/pt/insights/top-empresas-pesquisa-mercado-brasil-2026,200,true,1958,true,42,"Top Empresas de Pesquisa de Mercado no Brasil (Gu | BioNixus","Top Empresas de Pesquisa de Mercado no Brasil",https://www.bionixus.com/pt/insights/top-empresas-pesquisa-mercado-brasil-2026
/pt/insights/top-market-research-companies-brasil-2026,https://www.bionixus.com/pt/insights/top-market-research-companies-brasil-2026,200,true,1956,true,44,"5 Melhores Empresas de Pesquisa de Mercado no Bra | BioNixus","5 Melhores Empresas de Pesquisa de Mercado no Brasil (2026)",https://www.bionixus.com/pt/insights/top-market-research-companies-brasil-2026
/healthcare-market-research-italy,https://www.bionixus.com/healthcare-market-research-italy,200,true,1947,true,53,"Healthcare Market Research Company in Italy | AIFA & SSN...","Healthcare & Pharmaceutical Market Research in Italy",https://www.bionixus.com/healthcare-market-research-italy
/es/insights/top-empresas-investigacion-mercado-argentina-2026,https://www.bionixus.com/es/insights/top-empresas-investigacion-mercado-argentina-2026,200,true,1939,true,61,"5 Mejores Empresas de Investigación de Mercado en | BioNixus","5 Mejores Empresas de Investigación de Mercado en Argentina (2026)",https://www.bionixus.com/es/insights/top-empresas-investigacion-mercado-argentina-2026
/healthcare-market-research-new-zealand,https://www.bionixus.com/healthcare-market-research-new-zealand,200,true,1930,true,70,"Healthcare Market Research Company in New Zealand | Medsafe","Healthcare & Pharmaceutical Market Research in New Zealand",https://www.bionixus.com/healthcare-market-research-new-zealand
/brazil-pharmaceutical-market-research,https://www.bionixus.com/brazil-pharmaceutical-market-research,200,true,1929,true,71,"Pharmaceutical Market Research Company in Brazil | ANVISA,.","Pharmaceutical Market Research Company in Brazil",https://www.bionixus.com/brazil-pharmaceutical-market-research
/bionixus-vs-iqvia-mena,https://www.bionixus.com/bionixus-vs-iqvia-mena,200,true,1914,true,86,"BioNixus vs IQVIA MENA Research (2026) | BioNixus","BioNixus vs IQVIA for MENA Healthcare Research: Direct Comparison 2026",https://www.bionixus.com/bionixus-vs-iqvia-mena
/gcc-market-access-guide,https://www.bionixus.com/gcc-market-access-guide,200,true,1908,true,92,"GCC Pharmaceutical Market Access Guide 2026 | SFD | BioNixus","GCC pharmaceutical market access guide 2026 — registration, pricing, and reimbursement",https://www.bionixus.com/gcc-market-access-guide
/china-healthcare-market-report,https://www.bionixus.com/china-healthcare-market-report,200,true,1907,true,93,"China Healthcare Market Report 2026 | NMPA, NRDL...","China Healthcare Market Report 2026: NMPA Approval, NRDL Reimbursement, and VBP Commercial Intelligence",https://www.bionixus.com/china-healthcare-market-report
/pharmaceutical-market-research-qatar,https://www.bionixus.com/pharmaceutical-market-research-qatar,200,true,1907,true,93,"Healthcare Market Research Company in Qatar | MoPH & HMC |.","Healthcare & Pharmaceutical Market Research Company in Qatar",https://www.bionixus.com/pharmaceutical-market-research-qatar
/healthcare-market-research-china,https://www.bionixus.com/healthcare-market-research-china,200,true,1903,true,97,"Healthcare Market Research Company in China | NMPA & NHSA...","Healthcare & Pharmaceutical Market Research in China",https://www.bionixus.com/healthcare-market-research-china
/healthcare-market-research-bahrain,https://www.bionixus.com/healthcare-market-research-bahrain,200,true,1893,true,107,"Healthcare Market Research Bahrain | NHRA-Aligned | BioNixus","Healthcare & Pharmaceutical Market Research in Bahrain",https://www.bionixus.com/healthcare-market-research-bahrain
/ar/insights/top-market-research-companies-qatar-2026,https://www.bionixus.com/ar/insights/top-market-research-companies-qatar-2026,200,true,1887,true,113,"أفضل شركات أبحاث السوق في قطر (دليل 2026) | بيونيكسوس","أفضل شركات أبحاث السوق في قطر (دليل 2026)",https://www.bionixus.com/ar/insights/top-market-research-companies-qatar-2026
/brazil-healthcare-market-report,https://www.bionixus.com/brazil-healthcare-market-report,200,true,1857,true,143,"Brazil Healthcare Market Report 2026 | ANVISA, SUS, CONITEC","Brazil Healthcare Market Report 2026: ANVISA, SUS, CONITEC, and Pharmaceutical Market Intelligence",https://www.bionixus.com/brazil-healthcare-market-report
/turkey-healthcare-market-report,https://www.bionixus.com/turkey-healthcare-market-report,200,true,1851,true,149,"Turkey Healthcare Market Report 2026 | TİTCK, SGK...","Turkey Healthcare Market Report 2026: TİTCK, SGK Reimbursement, and Europe-MENA Crossroads Market Intelligence",https://www.bionixus.com/turkey-healthcare-market-report
/germany-medical-devices-market-report,https://www.bionixus.com/germany-medical-devices-market-report,200,true,1849,true,151,"Germany Medical Devices Market Report 2026 | EU MDR, NUB...","Germany Medical Devices Market Report 2026: EU MDR Compliance, DRG Reimbursement, and Hospital Procurement Intelligence",https://www.bionixus.com/germany-medical-devices-market-report
/healthcare-market-research-south-korea,https://www.bionixus.com/healthcare-market-research-south-korea,200,true,1840,true,160,"Healthcare Market Research Company in South Korea | MFDS &.","Healthcare & Pharmaceutical Market Research in South Korea",https://www.bionixus.com/healthcare-market-research-south-korea
/india-healthcare-market-report,https://www.bionixus.com/india-healthcare-market-report,200,true,1840,true,160,"India Healthcare Market Report 2026 | CDSCO, Ayushman Bhara","India Healthcare Market Report 2026: CDSCO, Ayushman Bharat, and Pharmaceutical Market Intelligence",https://www.bionixus.com/india-healthcare-market-report
/healthcare-market-research-japan,https://www.bionixus.com/healthcare-market-research-japan,200,true,1798,true,202,"Healthcare Market Research Company in Japan | PMDA, MHLW &.","Healthcare & Pharmaceutical Market Research in Japan",https://www.bionixus.com/healthcare-market-research-japan
/healthcare-market-research-switzerland,https://www.bionixus.com/healthcare-market-research-switzerland,200,true,1759,true,241,"Healthcare Market Research Switzerland | BioNixus","Healthcare Market Research Company in Switzerland",https://www.bionixus.com/healthcare-market-research-switzerland
/ar/insights/top-market-research-companies-kuwait-2026,https://www.bionixus.com/ar/insights/top-market-research-companies-kuwait-2026,200,true,1752,true,248,"أفضل شركات أبحاث السوق في الكويت (دليل 2026) | بيونيكسوس","أفضل شركات أبحاث السوق في الكويت (دليل 2026)",https://www.bionixus.com/ar/insights/top-market-research-companies-kuwait-2026
/uk-medical-devices-market-report,https://www.bionixus.com/uk-medical-devices-market-report,200,true,1751,true,249,"UK Medical Devices Market Report 2026 | UKCA, MHRA & NHS...","UK Medical Devices Market Report 2026: UKCA Marking, NHS Supply Chain, and MHRA Regulatory Intelligence",https://www.bionixus.com/uk-medical-devices-market-report
/healthcare-market-research-argentina,https://www.bionixus.com/healthcare-market-research-argentina,200,true,1719,true,281,"Healthcare Market Research Company in Argentina | ANMAT &...","Healthcare & Pharmaceutical Market Research in Argentina",https://www.bionixus.com/healthcare-market-research-argentina
/healthcare-market-research-india,https://www.bionixus.com/healthcare-market-research-india,200,true,1710,true,290,"Healthcare Market Research Company in India | CDSCO & ICMR.","Healthcare & Pharmaceutical Market Research in India",https://www.bionixus.com/healthcare-market-research-india
/clinical-diagnostics-market-research,https://www.bionixus.com/clinical-diagnostics-market-research,200,true,1703,true,297,"Clinical Diagnostics Market Research | QC & Immunohematolog","Clinical Diagnostics Market Assessment",https://www.bionixus.com/clinical-diagnostics-market-research
/healthcare-market-research-singapore,https://www.bionixus.com/healthcare-market-research-singapore,200,true,1686,true,314,"Healthcare Market Research Company in Singapore | ACE & HSA","Healthcare & Pharmaceutical Market Research in Singapore",https://www.bionixus.com/healthcare-market-research-singapore
/healthcare-market-research-denmark,https://www.bionixus.com/healthcare-market-research-denmark,200,true,1664,true,336,"Healthcare Market Research Company in Denmark | DKMA &...","Healthcare & Pharmaceutical Market Research in Denmark",https://www.bionixus.com/healthcare-market-research-denmark
/healthcare-market-research-malaysia,https://www.bionixus.com/healthcare-market-research-malaysia,200,true,1660,true,340,"Healthcare Market Research Company in Malaysia | NPRA &...","Healthcare & Pharmaceutical Market Research in Malaysia",https://www.bionixus.com/healthcare-market-research-malaysia
/pharmacies-saudi-arabia-marketing,https://www.bionixus.com/pharmacies-saudi-arabia-marketing,200,true,1658,true,342,"Pharmacy Market Research Saudi Arabia: Boost Retail Sales 4","Market Research & Marketing Automation for Pharmacies in Saudi Arabia",https://www.bionixus.com/pharmacies-saudi-arabia-marketing
/healthcare-market-research-australia,https://www.bionixus.com/healthcare-market-research-australia,200,true,1656,true,344,"Healthcare Market Research Company in Australia | TGA & PBA","Healthcare & Pharmaceutical Market Research in Australia",https://www.bionixus.com/healthcare-market-research-australia
/healthcare-market-research-ireland,https://www.bionixus.com/healthcare-market-research-ireland,200,true,1649,true,351,"Healthcare Market Research Company in Ireland | HPRA & HSE.","Healthcare & Pharmaceutical Market Research in Ireland",https://www.bionixus.com/healthcare-market-research-ireland
/skyrizi-tops-julys-pharma-rankings-and-what-it-means-for-omnichannel-engagement,https://www.bionixus.com/skyrizi-tops-julys-pharma-rankings-and-what-it-means-for-omnichannel-engagement,200,true,1643,true,357,"Skyrizi Tops July Pharma Rankings: Omnichannel Engagement...","Skyrizi Tops July&#x27;s Pharma Rankings — and What It Means for Omnichannel Engagement",https://www.bionixus.com/skyrizi-tops-julys-pharma-rankings-and-what-it-means-for-omnichannel-engagement
/egypt-medical-devices-market-report,https://www.bionixus.com/egypt-medical-devices-market-report,200,true,1639,true,361,"Egypt Medical Devices Market Report 2026 | USD 1.3B Market","Egypt Medical Devices Market Report 2026: Market Size, UHI Program, and Cairo Hospital Intelligence",https://www.bionixus.com/egypt-medical-devices-market-report
/healthcare-market-research-poland,https://www.bionixus.com/healthcare-market-research-poland,200,true,1624,true,376,"Healthcare Market Research Company in Poland | AOTMiT & URP","Healthcare & Pharmaceutical Market Research in Poland",https://www.bionixus.com/healthcare-market-research-poland
/healthcare-market-research-turkey,https://www.bionixus.com/healthcare-market-research-turkey,200,true,1620,true,380,"Healthcare Market Research Company in Turkey | TİTCK & SGK.","Healthcare & Pharmaceutical Market Research in Turkey",https://www.bionixus.com/healthcare-market-research-turkey
/turkey-medical-devices-market-report,https://www.bionixus.com/turkey-medical-devices-market-report,200,true,1606,true,394,"Turkey Medical Devices Market Report 2026 | TİTCK CE Markin","Turkey Medical Devices Market Report 2026: TİTCK Regulation, SGK SUT Reimbursement, and Medical Tourism Intelligence",https://www.bionixus.com/turkey-medical-devices-market-report
/india-medical-devices-market-report,https://www.bionixus.com/india-medical-devices-market-report,200,true,1604,true,396,"India Medical Devices Market Report 2026 | MDR 2017, PLI...","India Medical Devices Market Report 2026: CDSCO MDR 2017, PLI Manufacturing, and Commercial Intelligence",https://www.bionixus.com/india-medical-devices-market-report
/ar/insights/top-sharaket-abhath-sihha-alsaudia-2026,https://www.bionixus.com/ar/insights/top-sharaket-abhath-sihha-alsaudia-2026,200,true,1592,true,408,"أفضل شركات أبحاث سوق الرعاية الصحية في المملكة العربية السعودية (2026) | بيونيكسس","أفضل شركات أبحاث سوق الرعاية الصحية في المملكة العربية السعودية (دليل 2026)",https://www.bionixus.com/ar/insights/top-sharaket-abhath-sihha-alsaudia-2026
/singapore-medical-devices-market-report,https://www.bionixus.com/singapore-medical-devices-market-report,200,true,1578,true,422,"Singapore Medical Devices Market Report 2026 | HSA...","Singapore Medical Devices Market Report 2026: HSA Regulation, ASEAN Distribution Hub, and Medical Tourism Intelligence",https://www.bionixus.com/singapore-medical-devices-market-report
/healthcare-market-research-canada,https://www.bionixus.com/healthcare-market-research-canada,200,true,1575,true,425,"Healthcare Market Research Company in Canada | CADTH & Heal","Healthcare & Pharmaceutical Market Research in Canada",https://www.bionixus.com/healthcare-market-research-canada
/client-reviews,https://www.bionixus.com/client-reviews,200,true,1574,true,426,"Client Reviews | BioNixus Pharmaceutical Market Research","Recommended by more than 40 happy clients",https://www.bionixus.com/client-reviews
/healthcare-market-research-sweden,https://www.bionixus.com/healthcare-market-research-sweden,200,true,1570,true,430,"Healthcare Market Research Company in Sweden | TLV &...","Healthcare & Pharmaceutical Market Research in Sweden",https://www.bionixus.com/healthcare-market-research-sweden
/egypt-pharmaceutical-market-research,https://www.bionixus.com/egypt-pharmaceutical-market-research,200,true,1564,true,436,"Healthcare Market Research Company in Egypt | EDA & MENA...","Healthcare & Pharmaceutical Market Research Company in Egypt",https://www.bionixus.com/egypt-pharmaceutical-market-research
/kuwait-medical-devices-market-report,https://www.bionixus.com/kuwait-medical-devices-market-report,200,true,1552,true,448,"Kuwait Medical Devices Market Report 2026 | CMS Procurement","Kuwait Medical Devices Market Report 2026: CMS Procurement, MOPH Registration, and Hospital Intelligence",https://www.bionixus.com/kuwait-medical-devices-market-report
/healthcare-market-research-spain,https://www.bionixus.com/healthcare-market-research-spain,200,true,1549,true,451,"Healthcare Market Research Company in Spain | AEMPS & SNS...","Healthcare Market Research Company in Spain",https://www.bionixus.com/healthcare-market-research-spain
/uae-pharmaceutical-market-research,https://www.bionixus.com/uae-pharmaceutical-market-research,200,true,1545,true,455,"Healthcare Market Research Company in UAE | DHA, DOH & MOHA","Healthcare & Pharmaceutical Market Research Company in UAE",https://www.bionixus.com/uae-pharmaceutical-market-research
/south-korea-medical-devices-market-report,https://www.bionixus.com/south-korea-medical-devices-market-report,200,true,1544,true,456,"South Korea Medical Devices Market Report 2026 | MFDS, NHIS","South Korea Medical Devices Market Report 2026: MFDS Regulation, NHIS Reimbursement, and Export Market Intelligence",https://www.bionixus.com/south-korea-medical-devices-market-report
/healthcare-market-research-netherlands,https://www.bionixus.com/healthcare-market-research-netherlands,200,true,1535,true,465,"Healthcare Market Research Company in the Netherlands |...","Healthcare & Pharmaceutical Market Research in the Netherlands",https://www.bionixus.com/healthcare-market-research-netherlands
/healthcare-market-research-usa,https://www.bionixus.com/healthcare-market-research-usa,200,true,1529,true,471,"Healthcare Market Research Company in USA | IRB-Compliant H","Healthcare & Pharmaceutical Market Research in the USA",https://www.bionixus.com/healthcare-market-research-usa
/ar/insights/top-sharaket-abhath-alsuq-alsaudia-2026,https://www.bionixus.com/ar/insights/top-sharaket-abhath-alsuq-alsaudia-2026,200,true,1525,true,475,"أفضل شركات أبحاث السوق في المملكة العربية السعودية (دليل 2026) | بيونيكسس","أفضل شركات أبحاث السوق في المملكة العربية السعودية (دليل 2026)",https://www.bionixus.com/ar/insights/top-sharaket-abhath-alsuq-alsaudia-2026
/services,https://www.bionixus.com/services,200,true,1524,true,476,"Global Market Research Services | Pharma, Healthcare &...","Market research services for pharma, healthcare, and commercial industries",https://www.bionixus.com/services
/healthcare-market-research-france,https://www.bionixus.com/healthcare-market-research-france,200,true,1492,true,508,"Healthcare Market Research Company in France | HAS &...","Healthcare Market Research Company in France",https://www.bionixus.com/healthcare-market-research-france
/spain-medical-devices-market-report,https://www.bionixus.com/spain-medical-devices-market-report,200,true,1479,true,521,"Spain Medical Devices Market Report 2026 | AEMPS, RAMD...","Spain Medical Devices Market Report 2026: AEMPS Regulation, SNS Reimbursement, and Regional Procurement Intelligence",https://www.bionixus.com/spain-medical-devices-market-report
/saudi-arabia-medical-devices-market-report,https://www.bionixus.com/saudi-arabia-medical-devices-market-report,200,true,1470,true,530,"Saudi Arabia Medical Devices Market Report 2026 | Hospital.","Saudi Arabia Medical Devices Market Report 2026: Hospital Consumption and Commercial Intelligence",https://www.bionixus.com/saudi-arabia-medical-devices-market-report
/gcc-anesthesia-surgical-market-report,https://www.bionixus.com/gcc-anesthesia-surgical-market-report,200,true,1445,true,555,"GCC Anesthesia & Surgical Market Report 2026 | Hospital...","GCC Anesthesia and Surgical Market Report 2026: Hospital Procedure Volumes and Drug Consumption Intelligence",https://www.bionixus.com/gcc-anesthesia-surgical-market-report
/healthcare-market-research-germany,https://www.bionixus.com/healthcare-market-research-germany,200,true,1428,true,572,"Healthcare Market Research Germany | BioNixus","Healthcare Market Research Company in Germany",https://www.bionixus.com/healthcare-market-research-germany
/healthcare-market-research-qatar,https://www.bionixus.com/healthcare-market-research-qatar,200,true,1420,true,580,"Healthcare Market Research Qatar | Doha & MoPH | BioNixus","Healthcare & Pharmaceutical Market Research in Qatar",https://www.bionixus.com/healthcare-market-research-qatar
/uae-healthcare-market-report,https://www.bionixus.com/uae-healthcare-market-report,200,true,1392,true,608,"UAE Healthcare Market Report 2026 | Market Size, Pharma &...","UAE Healthcare Market Report 2026: Market Size, Pharmaceutical Intelligence, and Commercial Strategy",https://www.bionixus.com/uae-healthcare-market-report
/bionixus-industries,https://www.bionixus.com/bionixus-industries,200,true,1376,true,624,"Market Research Across Industries | BioNixus","One research firm guiding every industry we serve",https://www.bionixus.com/bionixus-industries
/bionixus-industries/insights,https://www.bionixus.com/bionixus-industries/insights,200,true,1376,true,624,"Market Research Across Industries | BioNixus","One research firm guiding every industry we serve",https://www.bionixus.com/bionixus-industries
/biosimilar-market-entry-saudi-arabia,https://www.bionixus.com/biosimilar-market-entry-saudi-arabia,200,true,1376,true,624,"Biosimilar Entry Saudi Arabia (2026) | BioNixus","Biosimilar Market Entry in Saudi Arabia: 2026 Strategy Guide",https://www.bionixus.com/biosimilar-market-entry-saudi-arabia
/healthcare-market-research-oman,https://www.bionixus.com/healthcare-market-research-oman,200,true,1362,true,638,"Healthcare Market Research Oman | MoH Oman & SQUH | BioNixus","Healthcare & Pharmaceutical Market Research in Oman",https://www.bionixus.com/healthcare-market-research-oman
/healthcare-market-research-jordan,https://www.bionixus.com/healthcare-market-research-jordan,200,true,1355,true,645,"Healthcare Market Research Jordan | JFDA-Aligned | BioNixus","Healthcare & Pharmaceutical Market Research in Jordan",https://www.bionixus.com/healthcare-market-research-jordan
/pt/methodology,https://www.bionixus.com/pt/methodology,200,true,1318,true,682,"Metodologia de pesquisa de mercado em saúde | BioNixus","Metodologia de pesquisa de mercado em saúde",https://www.bionixus.com/pt/methodology
/nf1-pharma-market-research,https://www.bionixus.com/nf1-pharma-market-research,200,true,1308,true,692,"NF1 Pharma Market Research Services | Competitive...","NF1 Pharma Market Research & Competitive Intelligence Services",https://www.bionixus.com/nf1-pharma-market-research
/pt/pesquisa-mercado-farmaceutico-brasil,https://www.bionixus.com/pt/pesquisa-mercado-farmaceutico-brasil,200,true,1295,true,705,"Empresa de Pesquisa de Mercado Farmacêutico no Br | BioNixus","Empresa de Pesquisa de Mercado Farmacêutico no Brasil",https://www.bionixus.com/pt/pesquisa-mercado-farmaceutico-brasil
/pt/pesquisa-mercado-saude-brasil,https://www.bionixus.com/pt/pesquisa-mercado-saude-brasil,200,true,1290,true,710,"Empresa de Pesquisa de Mercado de Saúde no Brasil | BioNixus","Empresa de Pesquisa de Mercado de Saúde no Brasil",https://www.bionixus.com/pt/pesquisa-mercado-saude-brasil
/ru/methodology,https://www.bionixus.com/ru/methodology,200,true,1288,true,712,"Методология исследований рынка здравоохранения | BioNixus","Методология исследований рынка здравоохранения",https://www.bionixus.com/ru/methodology
/egypt-healthcare-market-research,https://www.bionixus.com/egypt-healthcare-market-research,200,true,1280,true,720,"Healthcare Market Research Company in Egypt | BioNixus","Healthcare Market Research Company in Egypt",https://www.bionixus.com/egypt-healthcare-market-research
/pharmaceutical-therapy-areas,https://www.bionixus.com/pharmaceutical-therapy-areas,200,true,1212,true,788,"Pharmaceutical Therapy Areas Market Research | 12 | BioNixus","Pharmaceutical Therapy Areas Market Research Across MENA, UK, and Europe",https://www.bionixus.com/pharmaceutical-therapy-areas
/fr/about,https://www.bionixus.com/fr/about,200,true,1193,true,807,"À propos de BioNixus | Recherche marché mondiale fondée sur","Recherche marché mondiale — fondée sur le pharma, l’industrie la plus réglementée que nous servons, et étendue à l’ensemble des secteurs",https://www.bionixus.com/fr/about
/es/about,https://www.bionixus.com/es/about,200,true,1175,true,825,"Sobre BioNixus | Investigación de mercado global basada en.","Investigación de mercado global — construida sobre pharma, la industria más regulada que servimos, y ampliada para ser de confianza en todas las industrias",https://www.bionixus.com/es/about
/ar/about,https://www.bionixus.com/ar/about,200,true,1165,true,835,"عن BioNixus | أبحاث سوق عالمية مبنية على قطاع الأدوية المنظم","أبحاث سوق عالمية — مبنية على قطاع الأدوية، أكثر القطاعات تنظيمًا الذي نخدمه، وتوسّعت لتُوثَق عبر الصناعات",https://www.bionixus.com/ar/about
/de/about,https://www.bionixus.com/de/about,200,true,1162,true,838,"Über BioNixus | Globale Marktforschung auf reguliertem...","Globale Marktforschung — auf pharmazeutischer Forschung aufgebaut, der am stärksten regulierten Branche, die wir bedienen, und über Branchen hinweg ausgeweitet",https://www.bionixus.com/de/about
/pt/about,https://www.bionixus.com/pt/about,200,true,1162,true,838,"Sobre a BioNixus | Pesquisa de mercado global fundada em...","Pesquisa de mercado global — construída sobre pharma, a indústria mais regulada que servimos, e expandida para ser confiável em todas as indústrias",https://www.bionixus.com/pt/about
/services/market-access,https://www.bionixus.com/services/market-access,200,true,1118,true,882,"Market Access Consulting | HTA EMEA & GCC Pricing | BioNixus","Market Access Consulting | HTA EMEA & GCC Pricing",https://www.bionixus.com/services/market-access
/ar/abhath-suq-adwiyah-saudi-arabia,https://www.bionixus.com/ar/abhath-suq-adwiyah-saudi-arabia,200,true,1094,true,906,"أبحاث سوق الأدوية في المملكة العربية السعودية | بيونيكسس","أبحاث سوق الأدوية في المملكة العربية السعودية",https://www.bionixus.com/ar/abhath-suq-adwiyah-saudi-arabia
/kol-mapping-saudi-arabia-oncology,https://www.bionixus.com/kol-mapping-saudi-arabia-oncology,200,true,1092,true,908,"KOL Mapping for Oncology in Saudi Arabia | BioNixus MENA Research","KOL Mapping for Oncology in Saudi Arabia: Methodology, Data, and Engagement Strategy",https://www.bionixus.com/kol-mapping-saudi-arabia-oncology
