pathname,url,status,in_sitemap,word_count,thin,gap_words,title,h1,final_url
/ar,https://www.bionixus.com/ar,200,true,2363,false,-363,"BioNixus | Healthcare & Pharmaceutical Market Research","خدمات BioNixus لأبحاث السوق الصحية والدوائية",https://www.bionixus.com/ar
/diabetes-market-research-uae,https://www.bionixus.com/diabetes-market-research-uae,200,true,2363,false,-363,"Diabetes Market Research UAE | BioNixus","Diabetes Market Research UAE",https://www.bionixus.com/diabetes-market-research-uae
/brand-tracking-pharma-gcc,https://www.bionixus.com/brand-tracking-pharma-gcc,200,true,2358,false,-358,"Brand Tracking Pharma GCC | BioNixus","Brand Tracking Pharma GCC",https://www.bionixus.com/brand-tracking-pharma-gcc
/pharmaceutical-market-research-denmark,https://www.bionixus.com/pharmaceutical-market-research-denmark,200,true,2353,false,-353,"Pharmaceutical Market Research Denmark | BioNixus","Pharmaceutical Market Research Company in Denmark",https://www.bionixus.com/pharmaceutical-market-research-denmark
/egypt-healthcare-market-research,https://www.bionixus.com/egypt-healthcare-market-research,200,true,2298,false,-298,"Healthcare Market Research Company in Egypt (2026) | EDA...","Healthcare Providers & Hospitals market research company in Egypt",https://www.bionixus.com/egypt-healthcare-market-research
/uae-healthcare-market-research,https://www.bionixus.com/uae-healthcare-market-research,200,true,2298,false,-298,"Healthcare Market Research Company in UAE (2026) | MOHAP...","Healthcare Providers & Hospitals market research company in UAE",https://www.bionixus.com/uae-healthcare-market-research
/healthcare-market-research-in-saudi-arabia,https://www.bionixus.com/healthcare-market-research-in-saudi-arabia,200,true,2296,false,-296,"Healthcare Market Research Saudi Arabia | SFDA & | BioNixus","Healthcare & Pharmaceutical Market Research in Saudi Arabia",https://www.bionixus.com/healthcare-market-research-in-saudi-arabia
/saudi-arabia-healthcare-market-research,https://www.bionixus.com/saudi-arabia-healthcare-market-research,200,true,2285,false,-285,"Healthcare Market Research Company in Saudi Arabia (2026)","Healthcare Providers & Hospitals market research company in Saudi Arabia",https://www.bionixus.com/saudi-arabia-healthcare-market-research
/specialist-physician-panel-uae,https://www.bionixus.com/specialist-physician-panel-uae,200,true,2251,false,-251,"Specialist Physician Panel UAE | BioNixus","Specialist Physician Panel UAE",https://www.bionixus.com/specialist-physician-panel-uae
/healthcare-market-research/therapy/biologics,https://www.bionixus.com/healthcare-market-research/therapy/biologics,200,true,2230,false,-230,"Biologics Research Guide: Biosimilars & Market Ac | BioNixus","Biologics market research guide",https://www.bionixus.com/healthcare-market-research/therapy/biologics
/egypt-financial-services-market-research,https://www.bionixus.com/egypt-financial-services-market-research,200,true,2224,false,-224,"Financial Services Market Research Company in Egypt (2026)","Financial Services & Banking market research company in Egypt",https://www.bionixus.com/egypt-financial-services-market-research
/healthcare-market-research/united-arab-emirates,https://www.bionixus.com/healthcare-market-research/united-arab-emirates,200,true,2218,false,-218,"United Arab Emirates Healthcare Market Research | MOHAP, DH","Healthcare Market Research Across the United Arab Emirates",https://www.bionixus.com/healthcare-market-research/united-arab-emirates
/market-research,https://www.bionixus.com/market-research,200,true,2196,false,-196,"Market Research Services Hub | Global Coverage | Healthcare","Market research for healthcare, pharma & industry",https://www.bionixus.com/market-research
/pt/insights/top-empresas-pesquisa-mercado-saude-brasil-2026,https://www.bionixus.com/pt/insights/top-empresas-pesquisa-mercado-saude-brasil-2026,200,true,2189,false,-189,"5 Melhores Empresas de Pesquisa de Mercado em Saú | BioNixus","5 Melhores Empresas de Pesquisa de Mercado em Saúde no Brasil (2026)",https://www.bionixus.com/pt/insights/top-empresas-pesquisa-mercado-saude-brasil-2026
/healthcare-market-research/egypt,https://www.bionixus.com/healthcare-market-research/egypt,200,true,2184,false,-184,"Healthcare Market Research in Egypt | Pharma & Consumer |...","Healthcare Market Research in Egypt",https://www.bionixus.com/healthcare-market-research/egypt
/saudi-arabia-medtech-market-research,https://www.bionixus.com/saudi-arabia-medtech-market-research,200,true,2177,false,-177,"MedTech Market Research Company in Saudi Arabia (2026) | SF","MedTech & Medical Devices market research company in Saudi Arabia",https://www.bionixus.com/saudi-arabia-medtech-market-research
/saudi-arabia-consumer-health-market-research,https://www.bionixus.com/saudi-arabia-consumer-health-market-research,200,true,2165,false,-165,"Consumer Health Market Research Company in Saudi Arabia...","Consumer Health & OTC market research company in Saudi Arabia",https://www.bionixus.com/saudi-arabia-consumer-health-market-research
/healthcare-market-research/therapy/rare-diseases,https://www.bionixus.com/healthcare-market-research/therapy/rare-diseases,200,true,2160,false,-160,"Rare Disease & Orphan Drug Market Research | BioNixus","Rare disease market research",https://www.bionixus.com/healthcare-market-research/therapy/rare-diseases
/pharmaceutical-market-research-usa,https://www.bionixus.com/pharmaceutical-market-research-usa,200,true,2159,false,-159,"Pharmaceutical Market Research Company in USA | FDA, CMS &.","Pharmaceutical Market Research Company in USA",https://www.bionixus.com/pharmaceutical-market-research-usa
/es/insights/top-empresas-investigacion-mercado-salud-argentina-2026,https://www.bionixus.com/es/insights/top-empresas-investigacion-mercado-salud-argentina-2026,200,true,2152,false,-152,"5 Mejores Empresas de Investigación de Mercado en | BioNixus","5 Mejores Empresas de Investigación de Mercado en Salud en Argentina (2026)",https://www.bionixus.com/es/insights/top-empresas-investigacion-mercado-salud-argentina-2026
/healthcare-market-research/south-africa,https://www.bionixus.com/healthcare-market-research/south-africa,200,true,2140,false,-140,"Pharmaceutical Market Research in South Africa | BioNixus","Pharmaceutical Market Research in South Africa",https://www.bionixus.com/healthcare-market-research/south-africa
/healthcare-market-research/united-states,https://www.bionixus.com/healthcare-market-research/united-states,200,true,2140,false,-140,"Pharmaceutical Market Research in United States | BioNixus","Pharmaceutical Market Research in United States",https://www.bionixus.com/healthcare-market-research/united-states
/healthcare-market-research-uk,https://www.bionixus.com/healthcare-market-research-uk,200,true,2127,false,-127,"Pharmaceutical Market Research in United Kingdom | BioNixus","Pharmaceutical Market Research in the United Kingdom",https://www.bionixus.com/healthcare-market-research/uk
/healthcare-market-research/uk,https://www.bionixus.com/healthcare-market-research/uk,200,true,2127,false,-127,"Pharmaceutical Market Research in United Kingdom | BioNixus","Pharmaceutical Market Research in the United Kingdom",https://www.bionixus.com/healthcare-market-research/uk
/saudi-arabia-biotech-market-research,https://www.bionixus.com/saudi-arabia-biotech-market-research,200,true,2121,false,-121,"Biotech Market Research Company in Saudi Arabia (2026) | SF","Biotech & Life Sciences market research company in Saudi Arabia",https://www.bionixus.com/saudi-arabia-biotech-market-research
/heor-consulting-saudi-arabia,https://www.bionixus.com/heor-consulting-saudi-arabia,200,true,2114,false,-114,"HEOR Consulting Saudi Arabia | BioNixus","HEOR Consulting Saudi Arabia",https://www.bionixus.com/heor-consulting-saudi-arabia
/healthcare-market-research/abu-dhabi,https://www.bionixus.com/healthcare-market-research/abu-dhabi,200,true,2112,false,-112,"Pharmaceutical Market Research in Abu Dhabi | BioNixus","Pharmaceutical Market Research in Abu Dhabi",https://www.bionixus.com/healthcare-market-research/abu-dhabi
/iqvia-alternative,https://www.bionixus.com/iqvia-alternative,200,true,2101,false,-101,"IQVIA Competitors &amp; Alternatives for Pharma Market Research | BioNixus","IQVIA Competitors & Alternatives Built for How Pharma Really Works",https://www.bionixus.com/iqvia-alternative
/healthcare-market-research/services/market-access,https://www.bionixus.com/healthcare-market-research/services/market-access,200,true,2100,false,-100,"market access Healthcare Research Service | BioNixus","Market access research service",https://www.bionixus.com/healthcare-market-research/services/market-access
/healthcare-market-research/denmark,https://www.bionixus.com/healthcare-market-research/denmark,200,true,2095,false,-95,"Pharmaceutical Market Research in Denmark | BioNixus","Pharmaceutical Market Research in Denmark",https://www.bionixus.com/healthcare-market-research/denmark
/healthcare-market-research/italy,https://www.bionixus.com/healthcare-market-research/italy,200,true,2095,false,-95,"Pharmaceutical Market Research in Italy | BioNixus","Pharmaceutical Market Research in Italy",https://www.bionixus.com/healthcare-market-research/italy
/healthcare-market-research/sweden,https://www.bionixus.com/healthcare-market-research/sweden,200,true,2095,false,-95,"Pharmaceutical Market Research in Sweden | BioNixus","Pharmaceutical Market Research in Sweden",https://www.bionixus.com/healthcare-market-research/sweden
/healthcare-market-research/switzerland,https://www.bionixus.com/healthcare-market-research/switzerland,200,true,2095,false,-95,"Pharmaceutical Market Research in Switzerland | BioNixus","Pharmaceutical Market Research in Switzerland",https://www.bionixus.com/healthcare-market-research/switzerland
/healthcare-market-research/oman,https://www.bionixus.com/healthcare-market-research/oman,200,true,2094,false,-94,"Healthcare Market Research Oman | MOH Fieldwork | BioNixus","Healthcare Market Research in Oman",https://www.bionixus.com/healthcare-market-research/oman
/healthcare-market-research/algeria,https://www.bionixus.com/healthcare-market-research/algeria,200,true,2093,false,-93,"Pharmaceutical Market Research in Algeria | BioNixus","Pharmaceutical Market Research in Algeria",https://www.bionixus.com/healthcare-market-research/algeria
/healthcare-market-research/iraq,https://www.bionixus.com/healthcare-market-research/iraq,200,true,2093,false,-93,"Pharmaceutical Market Research in Iraq | BioNixus","Pharmaceutical Market Research in Iraq",https://www.bionixus.com/healthcare-market-research/iraq
/healthcare-market-research/jordan,https://www.bionixus.com/healthcare-market-research/jordan,200,true,2093,false,-93,"Pharmaceutical Market Research in Jordan | BioNixus","Pharmaceutical Market Research in Jordan",https://www.bionixus.com/healthcare-market-research/jordan
/healthcare-market-research/kenya,https://www.bionixus.com/healthcare-market-research/kenya,200,true,2093,false,-93,"Pharmaceutical Market Research in Kenya | BioNixus","Pharmaceutical Market Research in Kenya",https://www.bionixus.com/healthcare-market-research/kenya
/healthcare-market-research/lebanon,https://www.bionixus.com/healthcare-market-research/lebanon,200,true,2093,false,-93,"Pharmaceutical Market Research in Lebanon | BioNixus","Pharmaceutical Market Research in Lebanon",https://www.bionixus.com/healthcare-market-research/lebanon
/healthcare-market-research/libya,https://www.bionixus.com/healthcare-market-research/libya,200,true,2093,false,-93,"Pharmaceutical Market Research in Libya | BioNixus","Pharmaceutical Market Research in Libya",https://www.bionixus.com/healthcare-market-research/libya
/healthcare-market-research/mexico,https://www.bionixus.com/healthcare-market-research/mexico,200,true,2093,false,-93,"Pharmaceutical Market Research in Mexico | BioNixus","Pharmaceutical Market Research in Mexico",https://www.bionixus.com/healthcare-market-research/mexico
/healthcare-market-research/morocco,https://www.bionixus.com/healthcare-market-research/morocco,200,true,2093,false,-93,"Pharmaceutical Market Research in Morocco | BioNixus","Pharmaceutical Market Research in Morocco",https://www.bionixus.com/healthcare-market-research/morocco
/healthcare-market-research/nigeria,https://www.bionixus.com/healthcare-market-research/nigeria,200,true,2093,false,-93,"Pharmaceutical Market Research in Nigeria | BioNixus","Pharmaceutical Market Research in Nigeria",https://www.bionixus.com/healthcare-market-research/nigeria
/healthcare-market-research/tunisia,https://www.bionixus.com/healthcare-market-research/tunisia,200,true,2093,false,-93,"Pharmaceutical Market Research in Tunisia | BioNixus","Pharmaceutical Market Research in Tunisia",https://www.bionixus.com/healthcare-market-research/tunisia
/healthcare-market-research/canada,https://www.bionixus.com/healthcare-market-research/canada,200,true,2092,false,-92,"Pharmaceutical Market Research in Canada | BioNixus","Pharmaceutical Market Research in Canada",https://www.bionixus.com/healthcare-market-research/canada
/healthcare-market-research/china,https://www.bionixus.com/healthcare-market-research/china,200,true,2091,false,-91,"Pharmaceutical Market Research in China | BioNixus","Pharmaceutical Market Research in China",https://www.bionixus.com/healthcare-market-research/china
/healthcare-market-research/qatar,https://www.bionixus.com/healthcare-market-research/qatar,200,true,2087,false,-87,"Healthcare Market Research Qatar | MOPH Fieldwork | BioNixus","Healthcare Market Research in Qatar",https://www.bionixus.com/healthcare-market-research/qatar
/healthcare-market-research/bahrain,https://www.bionixus.com/healthcare-market-research/bahrain,200,true,2081,false,-81,"Healthcare Market Research Bahrain | NHRA Fieldwo | BioNixus","Healthcare Market Research in Bahrain",https://www.bionixus.com/healthcare-market-research/bahrain
/healthcare-market-research/kuwait,https://www.bionixus.com/healthcare-market-research/kuwait,200,true,2080,false,-80,"Healthcare Market Research Kuwait | MOH Fieldwork | BioNixus","Pharmaceutical Market Research in Kuwait",https://www.bionixus.com/healthcare-market-research/kuwait
/healthcare-market-research/jeddah,https://www.bionixus.com/healthcare-market-research/jeddah,200,true,2078,false,-78,"Pharmaceutical Market Research in Jeddah | BioNixus","Pharmaceutical Market Research in Jeddah",https://www.bionixus.com/healthcare-market-research/jeddah
/healthcare-market-research/dubai,https://www.bionixus.com/healthcare-market-research/dubai,200,true,2075,false,-75,"Healthcare Market Research Dubai | Pharma Fieldwork UAE |...","Pharmaceutical Market Research in Dubai",https://www.bionixus.com/healthcare-market-research/dubai
/uae-medtech-market-research,https://www.bionixus.com/uae-medtech-market-research,200,true,2075,false,-75,"MedTech Market Research Company in UAE (2026) | MOHAP Conte","MedTech & Medical Devices market research company in UAE",https://www.bionixus.com/uae-medtech-market-research
/healthcare-market-research/therapy/oncology,https://www.bionixus.com/healthcare-market-research/therapy/oncology,200,true,2073,false,-73,"Oncology Market Research | BioNixus","Oncology market research",https://www.bionixus.com/healthcare-market-research/therapy/oncology
/uae-consumer-health-market-research,https://www.bionixus.com/uae-consumer-health-market-research,200,true,2072,false,-72,"Consumer Health Market Research Company in UAE (2026) | MOH","Consumer Health & OTC market research company in UAE",https://www.bionixus.com/uae-consumer-health-market-research
/egypt-medtech-market-research,https://www.bionixus.com/egypt-medtech-market-research,200,true,2071,false,-71,"MedTech Market Research Company in Egypt (2026) | EDA Conte","MedTech & Medical Devices market research company in Egypt",https://www.bionixus.com/egypt-medtech-market-research
/healthcare-market-research/europe,https://www.bionixus.com/healthcare-market-research/europe,200,true,2068,false,-68,"Pharmaceutical Market Research in Europe | BioNixus","Pharmaceutical Market Research Across Europe",https://www.bionixus.com/healthcare-market-research/europe
/healthcare-market-research/riyadh,https://www.bionixus.com/healthcare-market-research/riyadh,200,true,2068,false,-68,"Pharmaceutical Market Research in Riyadh | BioNixus","Pharmaceutical Market Research in Riyadh",https://www.bionixus.com/healthcare-market-research/riyadh
/healthcare-market-research/germany,https://www.bionixus.com/healthcare-market-research/germany,200,true,2067,false,-67,"Healthcare Market Research Germany | AMNOG & G-BA | BioNixus","Pharmaceutical Market Research in Germany",https://www.bionixus.com/healthcare-market-research/germany
/egypt-consumer-health-market-research,https://www.bionixus.com/egypt-consumer-health-market-research,200,true,2066,false,-66,"Consumer Health Market Research Company in Egypt (2026) | E","Consumer Health & OTC market research company in Egypt",https://www.bionixus.com/egypt-consumer-health-market-research
/healthcare-market-research/japan,https://www.bionixus.com/healthcare-market-research/japan,200,true,2064,false,-64,"Healthcare Market Research Japan | PMDA Fieldwork | BioNixus","Pharmaceutical Market Research in Japan",https://www.bionixus.com/healthcare-market-research/japan
/healthcare-market-research/singapore,https://www.bionixus.com/healthcare-market-research/singapore,200,true,2064,false,-64,"Healthcare Market Research Singapore | HSA Fieldw | BioNixus","Healthcare Market Research in Singapore",https://www.bionixus.com/healthcare-market-research/singapore
/healthcare-market-research/france,https://www.bionixus.com/healthcare-market-research/france,200,true,2062,false,-62,"Healthcare Market Research France | HAS & ANSM | BioNixus","Pharmaceutical Market Research in France",https://www.bionixus.com/healthcare-market-research/france
/healthcare-market-research/spain,https://www.bionixus.com/healthcare-market-research/spain,200,true,2062,false,-62,"Healthcare Market Research Spain | AEMPS Fieldwor | BioNixus","Pharmaceutical Market Research in Spain",https://www.bionixus.com/healthcare-market-research/spain
/healthcare-market-research/turkey,https://www.bionixus.com/healthcare-market-research/turkey,200,true,2059,false,-59,"Healthcare Market Research Turkey | TITCK Fieldwo | BioNixus","Healthcare Market Research in Turkey",https://www.bionixus.com/healthcare-market-research/turkey
/uae-biotech-market-research,https://www.bionixus.com/uae-biotech-market-research,200,true,2047,false,-47,"Biotech Market Research Company in UAE (2026) | MOHAP Conte","Biotech & Life Sciences market research company in UAE",https://www.bionixus.com/uae-biotech-market-research
/gfk-alternative-egypt,https://www.bionixus.com/gfk-alternative-egypt,200,true,2040,false,-40,"GfK Alternative in Egypt — International Market Research | BioNixus","GfK Alternative in Egypt — International Market Research by BioNixus",https://www.bionixus.com/gfk-alternative-egypt
/healthcare-market-research/services/physician-insights,https://www.bionixus.com/healthcare-market-research/services/physician-insights,200,true,2036,false,-36,"physician insights Healthcare Research Service | BioNixus","Physician insights research service",https://www.bionixus.com/healthcare-market-research/services/physician-insights
/egypt-biotech-market-research,https://www.bionixus.com/egypt-biotech-market-research,200,true,2033,false,-33,"Biotech Market Research Company in Egypt (2026) | EDA Conte","Biotech & Life Sciences market research company in Egypt",https://www.bionixus.com/egypt-biotech-market-research
/healthcare-market-research/therapy/respiratory,https://www.bionixus.com/healthcare-market-research/therapy/respiratory,200,true,2025,false,-25,"Respiratory Market Research | BioNixus","Respiratory market research",https://www.bionixus.com/healthcare-market-research/therapy/respiratory
/market-research-saudi-arabia-pharmaceutical,https://www.bionixus.com/market-research-saudi-arabia-pharmaceutical,200,true,2025,false,-25,"Pharma Market Research Company Saudi Arabia | Proposal-Read","Healthcare & Pharmaceutical Market Research Company in Saudi Arabia",https://www.bionixus.com/market-research-saudi-arabia-pharmaceutical
/healthcare-market-research/therapy/aesthetic-medicine,https://www.bionixus.com/healthcare-market-research/therapy/aesthetic-medicine,200,true,2023,false,-23,"Aesthetic Medicine Market Research | BioNixus","Aesthetic medicine market research",https://www.bionixus.com/healthcare-market-research/therapy/aesthetic-medicine
/healthcare-market-research/therapy/cardiology,https://www.bionixus.com/healthcare-market-research/therapy/cardiology,200,true,2018,false,-18,"Cardiology Market Research | BioNixus","Cardiology market research",https://www.bionixus.com/healthcare-market-research/therapy/cardiology
/healthcare-market-research/services/quantitative-research,https://www.bionixus.com/healthcare-market-research/services/quantitative-research,200,true,2017,false,-17,"quantitative research Healthcare Research Service | BioNixus","Quantitative research research service",https://www.bionixus.com/healthcare-market-research/services/quantitative-research
/healthcare-market-research/services/kol-mapping,https://www.bionixus.com/healthcare-market-research/services/kol-mapping,200,true,2013,false,-13,"kol mapping Healthcare Research Service | BioNixus","Kol mapping research service",https://www.bionixus.com/healthcare-market-research/services/kol-mapping
/market-research-in-egypt,https://www.bionixus.com/market-research-in-egypt,200,true,2010,false,-10,"Market Research Companies in Egypt | BioNixus","Market Research Company in Egypt",https://www.bionixus.com/market-research-in-egypt
/healthcare-market-research/services/qualitative-research,https://www.bionixus.com/healthcare-market-research/services/qualitative-research,200,true,2007,false,-7,"qualitative research Healthcare Research Service | BioNixus","Qualitative research research service",https://www.bionixus.com/healthcare-market-research/services/qualitative-research